-- This file is automatically generated. You should know what you did if you want to edit this
-- !all_types_bool_col_topn_asc --
false	1	1	1	10	1.1	10.1	1	01/01/09	1	2009-01-01T07:01	2009	1
false	3	3	3	30	3.3	30.3	3	01/01/09	3	2009-01-01T07:03:00.300	2009	1
false	5	5	5	50	5.5	50.5	5	01/01/09	5	2009-01-01T07:05:00.100	2009	1
false	7	7	7	70	7.7	70.7	7	01/01/09	7	2009-01-01T07:07:00.210	2009	1
false	9	9	9	90	9.9	90.89999999999999	9	01/01/09	9	2009-01-01T07:09:00.360	2009	1
false	1	1	1	10	1.1	10.1	11	01/02/09	1	2009-01-02T07:11:00.450	2009	1
false	3	3	3	30	3.3	30.3	13	01/02/09	3	2009-01-02T07:13:00.480	2009	1
false	5	5	5	50	5.5	50.5	15	01/02/09	5	2009-01-02T07:15:00.550	2009	1
false	7	7	7	70	7.7	70.7	17	01/02/09	7	2009-01-02T07:17:00.660	2009	1
false	9	9	9	90	9.9	90.89999999999999	19	01/02/09	9	2009-01-02T07:19:00.810	2009	1

-- !all_types_bool_col_topn_desc --
true	8	8	8	80	8.8	80.8	7298	12/31/10	8	2010-12-31T12:08:13.780	2010	12
true	6	6	6	60	6.6	60.59999999999999	7296	12/31/10	6	2010-12-31T12:06:13.650	2010	12
true	4	4	4	40	4.4	40.4	7294	12/31/10	4	2010-12-31T12:04:13.560	2010	12
true	2	2	2	20	2.2	20.2	7292	12/31/10	2	2010-12-31T12:02:13.510	2010	12
true	0	0	0	0	0.0	0	7290	12/31/10	0	2010-12-31T12:00:13.500	2010	12
true	8	8	8	80	8.8	80.8	7288	12/30/10	8	2010-12-30T11:58:13.330	2010	12
true	6	6	6	60	6.6	60.59999999999999	7286	12/30/10	6	2010-12-30T11:56:13.200	2010	12
true	4	4	4	40	4.4	40.4	7284	12/30/10	4	2010-12-30T11:54:13.110	2010	12
true	2	2	2	20	2.2	20.2	7282	12/30/10	2	2010-12-30T11:52:13.600	2010	12
true	0	0	0	0	0.0	0	7280	12/30/10	0	2010-12-30T11:50:13.500	2010	12

-- !all_types_tinyint_col_topn_asc --
true	0	0	0	0	0.0	0	0	01/01/09	0	2009-01-01T07:00	2009	1
true	0	0	0	0	0.0	0	10	01/02/09	0	2009-01-02T07:10:00.450	2009	1
true	0	0	0	0	0.0	0	20	01/03/09	0	2009-01-03T07:20:00.900	2009	1
true	0	0	0	0	0.0	0	30	01/04/09	0	2009-01-04T07:30:01.350	2009	1
true	0	0	0	0	0.0	0	40	01/05/09	0	2009-01-05T07:40:01.800	2009	1
true	0	0	0	0	0.0	0	50	01/06/09	0	2009-01-06T07:50:02.250	2009	1
true	0	0	0	0	0.0	0	60	01/07/09	0	2009-01-07T08:00:02.700	2009	1
true	0	0	0	0	0.0	0	70	01/08/09	0	2009-01-08T08:10:03.150	2009	1
true	0	0	0	0	0.0	0	80	01/09/09	0	2009-01-09T08:20:03.600	2009	1
true	0	0	0	0	0.0	0	90	01/10/09	0	2009-01-10T08:30:04.500	2009	1

-- !all_types_tinyint_col_topn_desc --
false	9	9	9	90	9.9	90.89999999999999	7299	12/31/10	9	2010-12-31T12:09:13.860	2010	12
false	9	9	9	90	9.9	90.89999999999999	7289	12/30/10	9	2010-12-30T11:59:13.410	2010	12
false	9	9	9	90	9.9	90.89999999999999	7279	12/29/10	9	2010-12-29T11:49:12.960	2010	12
false	9	9	9	90	9.9	90.89999999999999	7269	12/28/10	9	2010-12-28T11:39:12.510	2010	12
false	9	9	9	90	9.9	90.89999999999999	7259	12/27/10	9	2010-12-27T11:29:12.600	2010	12
false	9	9	9	90	9.9	90.89999999999999	7249	12/26/10	9	2010-12-26T11:19:11.610	2010	12
false	9	9	9	90	9.9	90.89999999999999	7239	12/25/10	9	2010-12-25T11:09:11.160	2010	12
false	9	9	9	90	9.9	90.89999999999999	7229	12/24/10	9	2010-12-24T10:59:10.710	2010	12
false	9	9	9	90	9.9	90.89999999999999	7219	12/23/10	9	2010-12-23T10:49:10.260	2010	12
false	9	9	9	90	9.9	90.89999999999999	7209	12/22/10	9	2010-12-22T10:39:09.810	2010	12

-- !all_types_smallint_col_topn_asc --
true	0	0	0	0	0.0	0	0	01/01/09	0	2009-01-01T07:00	2009	1
true	0	0	0	0	0.0	0	10	01/02/09	0	2009-01-02T07:10:00.450	2009	1
true	0	0	0	0	0.0	0	20	01/03/09	0	2009-01-03T07:20:00.900	2009	1
true	0	0	0	0	0.0	0	30	01/04/09	0	2009-01-04T07:30:01.350	2009	1
true	0	0	0	0	0.0	0	40	01/05/09	0	2009-01-05T07:40:01.800	2009	1
true	0	0	0	0	0.0	0	50	01/06/09	0	2009-01-06T07:50:02.250	2009	1
true	0	0	0	0	0.0	0	60	01/07/09	0	2009-01-07T08:00:02.700	2009	1
true	0	0	0	0	0.0	0	70	01/08/09	0	2009-01-08T08:10:03.150	2009	1
true	0	0	0	0	0.0	0	80	01/09/09	0	2009-01-09T08:20:03.600	2009	1
true	0	0	0	0	0.0	0	90	01/10/09	0	2009-01-10T08:30:04.500	2009	1

-- !all_types_smallint_col_topn_desc --
false	9	9	9	90	9.9	90.89999999999999	7299	12/31/10	9	2010-12-31T12:09:13.860	2010	12
false	9	9	9	90	9.9	90.89999999999999	7289	12/30/10	9	2010-12-30T11:59:13.410	2010	12
false	9	9	9	90	9.9	90.89999999999999	7279	12/29/10	9	2010-12-29T11:49:12.960	2010	12
false	9	9	9	90	9.9	90.89999999999999	7269	12/28/10	9	2010-12-28T11:39:12.510	2010	12
false	9	9	9	90	9.9	90.89999999999999	7259	12/27/10	9	2010-12-27T11:29:12.600	2010	12
false	9	9	9	90	9.9	90.89999999999999	7249	12/26/10	9	2010-12-26T11:19:11.610	2010	12
false	9	9	9	90	9.9	90.89999999999999	7239	12/25/10	9	2010-12-25T11:09:11.160	2010	12
false	9	9	9	90	9.9	90.89999999999999	7229	12/24/10	9	2010-12-24T10:59:10.710	2010	12
false	9	9	9	90	9.9	90.89999999999999	7219	12/23/10	9	2010-12-23T10:49:10.260	2010	12
false	9	9	9	90	9.9	90.89999999999999	7209	12/22/10	9	2010-12-22T10:39:09.810	2010	12

-- !all_types_int_col_topn_asc --
true	0	0	0	0	0.0	0	0	01/01/09	0	2009-01-01T07:00	2009	1
true	0	0	0	0	0.0	0	10	01/02/09	0	2009-01-02T07:10:00.450	2009	1
true	0	0	0	0	0.0	0	20	01/03/09	0	2009-01-03T07:20:00.900	2009	1
true	0	0	0	0	0.0	0	30	01/04/09	0	2009-01-04T07:30:01.350	2009	1
true	0	0	0	0	0.0	0	40	01/05/09	0	2009-01-05T07:40:01.800	2009	1
true	0	0	0	0	0.0	0	50	01/06/09	0	2009-01-06T07:50:02.250	2009	1
true	0	0	0	0	0.0	0	60	01/07/09	0	2009-01-07T08:00:02.700	2009	1
true	0	0	0	0	0.0	0	70	01/08/09	0	2009-01-08T08:10:03.150	2009	1
true	0	0	0	0	0.0	0	80	01/09/09	0	2009-01-09T08:20:03.600	2009	1
true	0	0	0	0	0.0	0	90	01/10/09	0	2009-01-10T08:30:04.500	2009	1

-- !all_types_int_col_topn_desc --
false	9	9	9	90	9.9	90.89999999999999	7299	12/31/10	9	2010-12-31T12:09:13.860	2010	12
false	9	9	9	90	9.9	90.89999999999999	7289	12/30/10	9	2010-12-30T11:59:13.410	2010	12
false	9	9	9	90	9.9	90.89999999999999	7279	12/29/10	9	2010-12-29T11:49:12.960	2010	12
false	9	9	9	90	9.9	90.89999999999999	7269	12/28/10	9	2010-12-28T11:39:12.510	2010	12
false	9	9	9	90	9.9	90.89999999999999	7259	12/27/10	9	2010-12-27T11:29:12.600	2010	12
false	9	9	9	90	9.9	90.89999999999999	7249	12/26/10	9	2010-12-26T11:19:11.610	2010	12
false	9	9	9	90	9.9	90.89999999999999	7239	12/25/10	9	2010-12-25T11:09:11.160	2010	12
false	9	9	9	90	9.9	90.89999999999999	7229	12/24/10	9	2010-12-24T10:59:10.710	2010	12
false	9	9	9	90	9.9	90.89999999999999	7219	12/23/10	9	2010-12-23T10:49:10.260	2010	12
false	9	9	9	90	9.9	90.89999999999999	7209	12/22/10	9	2010-12-22T10:39:09.810	2010	12

-- !all_types_bigint_col_topn_asc --
true	0	0	0	0	0.0	0	0	01/01/09	0	2009-01-01T07:00	2009	1
true	0	0	0	0	0.0	0	10	01/02/09	0	2009-01-02T07:10:00.450	2009	1
true	0	0	0	0	0.0	0	20	01/03/09	0	2009-01-03T07:20:00.900	2009	1
true	0	0	0	0	0.0	0	30	01/04/09	0	2009-01-04T07:30:01.350	2009	1
true	0	0	0	0	0.0	0	40	01/05/09	0	2009-01-05T07:40:01.800	2009	1
true	0	0	0	0	0.0	0	50	01/06/09	0	2009-01-06T07:50:02.250	2009	1
true	0	0	0	0	0.0	0	60	01/07/09	0	2009-01-07T08:00:02.700	2009	1
true	0	0	0	0	0.0	0	70	01/08/09	0	2009-01-08T08:10:03.150	2009	1
true	0	0	0	0	0.0	0	80	01/09/09	0	2009-01-09T08:20:03.600	2009	1
true	0	0	0	0	0.0	0	90	01/10/09	0	2009-01-10T08:30:04.500	2009	1

-- !all_types_bigint_col_topn_desc --
false	9	9	9	90	9.9	90.89999999999999	7299	12/31/10	9	2010-12-31T12:09:13.860	2010	12
false	9	9	9	90	9.9	90.89999999999999	7289	12/30/10	9	2010-12-30T11:59:13.410	2010	12
false	9	9	9	90	9.9	90.89999999999999	7279	12/29/10	9	2010-12-29T11:49:12.960	2010	12
false	9	9	9	90	9.9	90.89999999999999	7269	12/28/10	9	2010-12-28T11:39:12.510	2010	12
false	9	9	9	90	9.9	90.89999999999999	7259	12/27/10	9	2010-12-27T11:29:12.600	2010	12
false	9	9	9	90	9.9	90.89999999999999	7249	12/26/10	9	2010-12-26T11:19:11.610	2010	12
false	9	9	9	90	9.9	90.89999999999999	7239	12/25/10	9	2010-12-25T11:09:11.160	2010	12
false	9	9	9	90	9.9	90.89999999999999	7229	12/24/10	9	2010-12-24T10:59:10.710	2010	12
false	9	9	9	90	9.9	90.89999999999999	7219	12/23/10	9	2010-12-23T10:49:10.260	2010	12
false	9	9	9	90	9.9	90.89999999999999	7209	12/22/10	9	2010-12-22T10:39:09.810	2010	12

-- !all_types_float_col_topn_asc --
true	0	0	0	0	0.0	0	0	01/01/09	0	2009-01-01T07:00	2009	1
true	0	0	0	0	0.0	0	10	01/02/09	0	2009-01-02T07:10:00.450	2009	1
true	0	0	0	0	0.0	0	20	01/03/09	0	2009-01-03T07:20:00.900	2009	1
true	0	0	0	0	0.0	0	30	01/04/09	0	2009-01-04T07:30:01.350	2009	1
true	0	0	0	0	0.0	0	40	01/05/09	0	2009-01-05T07:40:01.800	2009	1
true	0	0	0	0	0.0	0	50	01/06/09	0	2009-01-06T07:50:02.250	2009	1
true	0	0	0	0	0.0	0	60	01/07/09	0	2009-01-07T08:00:02.700	2009	1
true	0	0	0	0	0.0	0	70	01/08/09	0	2009-01-08T08:10:03.150	2009	1
true	0	0	0	0	0.0	0	80	01/09/09	0	2009-01-09T08:20:03.600	2009	1
true	0	0	0	0	0.0	0	90	01/10/09	0	2009-01-10T08:30:04.500	2009	1

-- !all_types_float_col_topn_desc --
false	9	9	9	90	9.9	90.89999999999999	7299	12/31/10	9	2010-12-31T12:09:13.860	2010	12
false	9	9	9	90	9.9	90.89999999999999	7289	12/30/10	9	2010-12-30T11:59:13.410	2010	12
false	9	9	9	90	9.9	90.89999999999999	7279	12/29/10	9	2010-12-29T11:49:12.960	2010	12
false	9	9	9	90	9.9	90.89999999999999	7269	12/28/10	9	2010-12-28T11:39:12.510	2010	12
false	9	9	9	90	9.9	90.89999999999999	7259	12/27/10	9	2010-12-27T11:29:12.600	2010	12
false	9	9	9	90	9.9	90.89999999999999	7249	12/26/10	9	2010-12-26T11:19:11.610	2010	12
false	9	9	9	90	9.9	90.89999999999999	7239	12/25/10	9	2010-12-25T11:09:11.160	2010	12
false	9	9	9	90	9.9	90.89999999999999	7229	12/24/10	9	2010-12-24T10:59:10.710	2010	12
false	9	9	9	90	9.9	90.89999999999999	7219	12/23/10	9	2010-12-23T10:49:10.260	2010	12
false	9	9	9	90	9.9	90.89999999999999	7209	12/22/10	9	2010-12-22T10:39:09.810	2010	12

-- !all_types_double_col_topn_asc --
true	0	0	0	0	0.0	0	0	01/01/09	0	2009-01-01T07:00	2009	1
true	0	0	0	0	0.0	0	10	01/02/09	0	2009-01-02T07:10:00.450	2009	1
true	0	0	0	0	0.0	0	20	01/03/09	0	2009-01-03T07:20:00.900	2009	1
true	0	0	0	0	0.0	0	30	01/04/09	0	2009-01-04T07:30:01.350	2009	1
true	0	0	0	0	0.0	0	40	01/05/09	0	2009-01-05T07:40:01.800	2009	1
true	0	0	0	0	0.0	0	50	01/06/09	0	2009-01-06T07:50:02.250	2009	1
true	0	0	0	0	0.0	0	60	01/07/09	0	2009-01-07T08:00:02.700	2009	1
true	0	0	0	0	0.0	0	70	01/08/09	0	2009-01-08T08:10:03.150	2009	1
true	0	0	0	0	0.0	0	80	01/09/09	0	2009-01-09T08:20:03.600	2009	1
true	0	0	0	0	0.0	0	90	01/10/09	0	2009-01-10T08:30:04.500	2009	1

-- !all_types_double_col_topn_desc --
false	9	9	9	90	9.9	90.89999999999999	7299	12/31/10	9	2010-12-31T12:09:13.860	2010	12
false	9	9	9	90	9.9	90.89999999999999	7289	12/30/10	9	2010-12-30T11:59:13.410	2010	12
false	9	9	9	90	9.9	90.89999999999999	7279	12/29/10	9	2010-12-29T11:49:12.960	2010	12
false	9	9	9	90	9.9	90.89999999999999	7269	12/28/10	9	2010-12-28T11:39:12.510	2010	12
false	9	9	9	90	9.9	90.89999999999999	7259	12/27/10	9	2010-12-27T11:29:12.600	2010	12
false	9	9	9	90	9.9	90.89999999999999	7249	12/26/10	9	2010-12-26T11:19:11.610	2010	12
false	9	9	9	90	9.9	90.89999999999999	7239	12/25/10	9	2010-12-25T11:09:11.160	2010	12
false	9	9	9	90	9.9	90.89999999999999	7229	12/24/10	9	2010-12-24T10:59:10.710	2010	12
false	9	9	9	90	9.9	90.89999999999999	7219	12/23/10	9	2010-12-23T10:49:10.260	2010	12
false	9	9	9	90	9.9	90.89999999999999	7209	12/22/10	9	2010-12-22T10:39:09.810	2010	12

-- !all_types_id_topn_asc --
true	0	0	0	0	0.0	0	0	01/01/09	0	2009-01-01T07:00	2009	1
false	1	1	1	10	1.1	10.1	1	01/01/09	1	2009-01-01T07:01	2009	1
true	2	2	2	20	2.2	20.2	2	01/01/09	2	2009-01-01T07:02:00.100	2009	1
false	3	3	3	30	3.3	30.3	3	01/01/09	3	2009-01-01T07:03:00.300	2009	1
true	4	4	4	40	4.4	40.4	4	01/01/09	4	2009-01-01T07:04:00.600	2009	1
false	5	5	5	50	5.5	50.5	5	01/01/09	5	2009-01-01T07:05:00.100	2009	1
true	6	6	6	60	6.6	60.59999999999999	6	01/01/09	6	2009-01-01T07:06:00.150	2009	1
false	7	7	7	70	7.7	70.7	7	01/01/09	7	2009-01-01T07:07:00.210	2009	1
true	8	8	8	80	8.8	80.8	8	01/01/09	8	2009-01-01T07:08:00.280	2009	1
false	9	9	9	90	9.9	90.89999999999999	9	01/01/09	9	2009-01-01T07:09:00.360	2009	1

-- !all_types_id_topn_desc --
false	9	9	9	90	9.9	90.89999999999999	7299	12/31/10	9	2010-12-31T12:09:13.860	2010	12
true	8	8	8	80	8.8	80.8	7298	12/31/10	8	2010-12-31T12:08:13.780	2010	12
false	7	7	7	70	7.7	70.7	7297	12/31/10	7	2010-12-31T12:07:13.710	2010	12
true	6	6	6	60	6.6	60.59999999999999	7296	12/31/10	6	2010-12-31T12:06:13.650	2010	12
false	5	5	5	50	5.5	50.5	7295	12/31/10	5	2010-12-31T12:05:13.600	2010	12
true	4	4	4	40	4.4	40.4	7294	12/31/10	4	2010-12-31T12:04:13.560	2010	12
false	3	3	3	30	3.3	30.3	7293	12/31/10	3	2010-12-31T12:03:13.530	2010	12
true	2	2	2	20	2.2	20.2	7292	12/31/10	2	2010-12-31T12:02:13.510	2010	12
false	1	1	1	10	1.1	10.1	7291	12/31/10	1	2010-12-31T12:01:13.500	2010	12
true	0	0	0	0	0.0	0	7290	12/31/10	0	2010-12-31T12:00:13.500	2010	12

-- !all_types_date_string_col_topn_asc --
true	0	0	0	0	0.0	0	0	01/01/09	0	2009-01-01T07:00	2009	1
false	1	1	1	10	1.1	10.1	1	01/01/09	1	2009-01-01T07:01	2009	1
true	2	2	2	20	2.2	20.2	2	01/01/09	2	2009-01-01T07:02:00.100	2009	1
false	3	3	3	30	3.3	30.3	3	01/01/09	3	2009-01-01T07:03:00.300	2009	1
true	4	4	4	40	4.4	40.4	4	01/01/09	4	2009-01-01T07:04:00.600	2009	1
false	5	5	5	50	5.5	50.5	5	01/01/09	5	2009-01-01T07:05:00.100	2009	1
true	6	6	6	60	6.6	60.59999999999999	6	01/01/09	6	2009-01-01T07:06:00.150	2009	1
false	7	7	7	70	7.7	70.7	7	01/01/09	7	2009-01-01T07:07:00.210	2009	1
true	8	8	8	80	8.8	80.8	8	01/01/09	8	2009-01-01T07:08:00.280	2009	1
false	9	9	9	90	9.9	90.89999999999999	9	01/01/09	9	2009-01-01T07:09:00.360	2009	1

-- !all_types_date_string_col_topn_desc --
false	9	9	9	90	9.9	90.89999999999999	7299	12/31/10	9	2010-12-31T12:09:13.860	2010	12
true	8	8	8	80	8.8	80.8	7298	12/31/10	8	2010-12-31T12:08:13.780	2010	12
false	7	7	7	70	7.7	70.7	7297	12/31/10	7	2010-12-31T12:07:13.710	2010	12
true	6	6	6	60	6.6	60.59999999999999	7296	12/31/10	6	2010-12-31T12:06:13.650	2010	12
false	5	5	5	50	5.5	50.5	7295	12/31/10	5	2010-12-31T12:05:13.600	2010	12
true	4	4	4	40	4.4	40.4	7294	12/31/10	4	2010-12-31T12:04:13.560	2010	12
false	3	3	3	30	3.3	30.3	7293	12/31/10	3	2010-12-31T12:03:13.530	2010	12
true	2	2	2	20	2.2	20.2	7292	12/31/10	2	2010-12-31T12:02:13.510	2010	12
false	1	1	1	10	1.1	10.1	7291	12/31/10	1	2010-12-31T12:01:13.500	2010	12
true	0	0	0	0	0.0	0	7290	12/31/10	0	2010-12-31T12:00:13.500	2010	12

-- !all_types_string_col_topn_asc --
true	0	0	0	0	0.0	0	0	01/01/09	0	2009-01-01T07:00	2009	1
true	0	0	0	0	0.0	0	10	01/02/09	0	2009-01-02T07:10:00.450	2009	1
true	0	0	0	0	0.0	0	20	01/03/09	0	2009-01-03T07:20:00.900	2009	1
true	0	0	0	0	0.0	0	30	01/04/09	0	2009-01-04T07:30:01.350	2009	1
true	0	0	0	0	0.0	0	40	01/05/09	0	2009-01-05T07:40:01.800	2009	1
true	0	0	0	0	0.0	0	50	01/06/09	0	2009-01-06T07:50:02.250	2009	1
true	0	0	0	0	0.0	0	60	01/07/09	0	2009-01-07T08:00:02.700	2009	1
true	0	0	0	0	0.0	0	70	01/08/09	0	2009-01-08T08:10:03.150	2009	1
true	0	0	0	0	0.0	0	80	01/09/09	0	2009-01-09T08:20:03.600	2009	1
true	0	0	0	0	0.0	0	90	01/10/09	0	2009-01-10T08:30:04.500	2009	1

-- !all_types_string_col_topn_desc --
false	9	9	9	90	9.9	90.89999999999999	7299	12/31/10	9	2010-12-31T12:09:13.860	2010	12
false	9	9	9	90	9.9	90.89999999999999	7289	12/30/10	9	2010-12-30T11:59:13.410	2010	12
false	9	9	9	90	9.9	90.89999999999999	7279	12/29/10	9	2010-12-29T11:49:12.960	2010	12
false	9	9	9	90	9.9	90.89999999999999	7269	12/28/10	9	2010-12-28T11:39:12.510	2010	12
false	9	9	9	90	9.9	90.89999999999999	7259	12/27/10	9	2010-12-27T11:29:12.600	2010	12
false	9	9	9	90	9.9	90.89999999999999	7249	12/26/10	9	2010-12-26T11:19:11.610	2010	12
false	9	9	9	90	9.9	90.89999999999999	7239	12/25/10	9	2010-12-25T11:09:11.160	2010	12
false	9	9	9	90	9.9	90.89999999999999	7229	12/24/10	9	2010-12-24T10:59:10.710	2010	12
false	9	9	9	90	9.9	90.89999999999999	7219	12/23/10	9	2010-12-23T10:49:10.260	2010	12
false	9	9	9	90	9.9	90.89999999999999	7209	12/22/10	9	2010-12-22T10:39:09.810	2010	12

-- !all_types_timestamp_col_topn_asc --
true	0	0	0	0	0.0	0	0	01/01/09	0	2009-01-01T07:00	2009	1
false	1	1	1	10	1.1	10.1	1	01/01/09	1	2009-01-01T07:01	2009	1
true	2	2	2	20	2.2	20.2	2	01/01/09	2	2009-01-01T07:02:00.100	2009	1
false	3	3	3	30	3.3	30.3	3	01/01/09	3	2009-01-01T07:03:00.300	2009	1
true	4	4	4	40	4.4	40.4	4	01/01/09	4	2009-01-01T07:04:00.600	2009	1
false	5	5	5	50	5.5	50.5	5	01/01/09	5	2009-01-01T07:05:00.100	2009	1
true	6	6	6	60	6.6	60.59999999999999	6	01/01/09	6	2009-01-01T07:06:00.150	2009	1
false	7	7	7	70	7.7	70.7	7	01/01/09	7	2009-01-01T07:07:00.210	2009	1
true	8	8	8	80	8.8	80.8	8	01/01/09	8	2009-01-01T07:08:00.280	2009	1
false	9	9	9	90	9.9	90.89999999999999	9	01/01/09	9	2009-01-01T07:09:00.360	2009	1

-- !all_types_timestamp_col_topn_desc --
false	9	9	9	90	9.9	90.89999999999999	7299	12/31/10	9	2010-12-31T12:09:13.860	2010	12
true	8	8	8	80	8.8	80.8	7298	12/31/10	8	2010-12-31T12:08:13.780	2010	12
false	7	7	7	70	7.7	70.7	7297	12/31/10	7	2010-12-31T12:07:13.710	2010	12
true	6	6	6	60	6.6	60.59999999999999	7296	12/31/10	6	2010-12-31T12:06:13.650	2010	12
false	5	5	5	50	5.5	50.5	7295	12/31/10	5	2010-12-31T12:05:13.600	2010	12
true	4	4	4	40	4.4	40.4	7294	12/31/10	4	2010-12-31T12:04:13.560	2010	12
false	3	3	3	30	3.3	30.3	7293	12/31/10	3	2010-12-31T12:03:13.530	2010	12
true	2	2	2	20	2.2	20.2	7292	12/31/10	2	2010-12-31T12:02:13.510	2010	12
false	1	1	1	10	1.1	10.1	7291	12/31/10	1	2010-12-31T12:01:13.500	2010	12
true	0	0	0	0	0.0	0	7290	12/31/10	0	2010-12-31T12:00:13.500	2010	12

-- !all_types_year_topn_asc --
true	0	0	0	0	0.0	0	0	01/01/09	0	2009-01-01T07:00	2009	1
false	1	1	1	10	1.1	10.1	1	01/01/09	1	2009-01-01T07:01	2009	1
true	2	2	2	20	2.2	20.2	2	01/01/09	2	2009-01-01T07:02:00.100	2009	1
false	3	3	3	30	3.3	30.3	3	01/01/09	3	2009-01-01T07:03:00.300	2009	1
true	4	4	4	40	4.4	40.4	4	01/01/09	4	2009-01-01T07:04:00.600	2009	1
false	5	5	5	50	5.5	50.5	5	01/01/09	5	2009-01-01T07:05:00.100	2009	1
true	6	6	6	60	6.6	60.59999999999999	6	01/01/09	6	2009-01-01T07:06:00.150	2009	1
false	7	7	7	70	7.7	70.7	7	01/01/09	7	2009-01-01T07:07:00.210	2009	1
true	8	8	8	80	8.8	80.8	8	01/01/09	8	2009-01-01T07:08:00.280	2009	1
false	9	9	9	90	9.9	90.89999999999999	9	01/01/09	9	2009-01-01T07:09:00.360	2009	1

-- !all_types_year_topn_desc --
false	9	9	9	90	9.9	90.89999999999999	7299	12/31/10	9	2010-12-31T12:09:13.860	2010	12
true	8	8	8	80	8.8	80.8	7298	12/31/10	8	2010-12-31T12:08:13.780	2010	12
false	7	7	7	70	7.7	70.7	7297	12/31/10	7	2010-12-31T12:07:13.710	2010	12
true	6	6	6	60	6.6	60.59999999999999	7296	12/31/10	6	2010-12-31T12:06:13.650	2010	12
false	5	5	5	50	5.5	50.5	7295	12/31/10	5	2010-12-31T12:05:13.600	2010	12
true	4	4	4	40	4.4	40.4	7294	12/31/10	4	2010-12-31T12:04:13.560	2010	12
false	3	3	3	30	3.3	30.3	7293	12/31/10	3	2010-12-31T12:03:13.530	2010	12
true	2	2	2	20	2.2	20.2	7292	12/31/10	2	2010-12-31T12:02:13.510	2010	12
false	1	1	1	10	1.1	10.1	7291	12/31/10	1	2010-12-31T12:01:13.500	2010	12
true	0	0	0	0	0.0	0	7290	12/31/10	0	2010-12-31T12:00:13.500	2010	12

-- !all_types_month_topn_asc --
true	0	0	0	0	0.0	0	0	01/01/09	0	2009-01-01T07:00	2009	1
false	1	1	1	10	1.1	10.1	1	01/01/09	1	2009-01-01T07:01	2009	1
true	2	2	2	20	2.2	20.2	2	01/01/09	2	2009-01-01T07:02:00.100	2009	1
false	3	3	3	30	3.3	30.3	3	01/01/09	3	2009-01-01T07:03:00.300	2009	1
true	4	4	4	40	4.4	40.4	4	01/01/09	4	2009-01-01T07:04:00.600	2009	1
false	5	5	5	50	5.5	50.5	5	01/01/09	5	2009-01-01T07:05:00.100	2009	1
true	6	6	6	60	6.6	60.59999999999999	6	01/01/09	6	2009-01-01T07:06:00.150	2009	1
false	7	7	7	70	7.7	70.7	7	01/01/09	7	2009-01-01T07:07:00.210	2009	1
true	8	8	8	80	8.8	80.8	8	01/01/09	8	2009-01-01T07:08:00.280	2009	1
false	9	9	9	90	9.9	90.89999999999999	9	01/01/09	9	2009-01-01T07:09:00.360	2009	1

-- !all_types_month_topn_desc --
false	9	9	9	90	9.9	90.89999999999999	7299	12/31/10	9	2010-12-31T12:09:13.860	2010	12
true	8	8	8	80	8.8	80.8	7298	12/31/10	8	2010-12-31T12:08:13.780	2010	12
false	7	7	7	70	7.7	70.7	7297	12/31/10	7	2010-12-31T12:07:13.710	2010	12
true	6	6	6	60	6.6	60.59999999999999	7296	12/31/10	6	2010-12-31T12:06:13.650	2010	12
false	5	5	5	50	5.5	50.5	7295	12/31/10	5	2010-12-31T12:05:13.600	2010	12
true	4	4	4	40	4.4	40.4	7294	12/31/10	4	2010-12-31T12:04:13.560	2010	12
false	3	3	3	30	3.3	30.3	7293	12/31/10	3	2010-12-31T12:03:13.530	2010	12
true	2	2	2	20	2.2	20.2	7292	12/31/10	2	2010-12-31T12:02:13.510	2010	12
false	1	1	1	10	1.1	10.1	7291	12/31/10	1	2010-12-31T12:01:13.500	2010	12
true	0	0	0	0	0.0	0	7290	12/31/10	0	2010-12-31T12:00:13.500	2010	12

-- !schema_1 --
1	7706	1	155190	17.00	21168.23	0.04	0.02	N	O	1996-03-13	1996-02-12	1996-03-22	DELIVER IN PERSON	TRUCK	egular courts above the	cn	beijing

-- !schema_2 --
6374628540732951412	-77	-65	-70	-107	-215	65	0	-526	-1309	3750	8827	-19795	34647	57042	-1662	-138248	-890685	-228568	1633079	-2725524	6163040	-10491702	697237	74565050	127767368	93532213	-209675435	-32116110	-3624917040	-2927805617	15581947241	21893441661	24075494509	-116822110531	-59683724667	-146210393388	114424524398	1341560771667	-1638742564263	520137948334	-2927347587131	7415137351179	-7963937754617	52157548982266	140803519083304	-294675355729619	-868076759504942	181128508165910	-91753231238823	-3511241416682881	-11545256318348796	-1952917510863468	-5161099825338866	-59726090170689781	287170105829528178	607326725526282735	1253194074103207461	-162443950414676064	-2964036188567341159	2602201580810990248	5581917084094110764	111739292249520611	-315687754593838642	-2804420462762366976	-2078683524

-- !schema_3 --
false	5	5	5	50	5.5	50.5	7295	12/31/10	5	2010-12-31T12:05:13.600	2010	12
false	7	7	7	70	7.7	70.7	7297	12/31/10	7	2010-12-31T12:07:13.710	2010	12
false	9	9	9	90	9.9	90.89999999999999	7299	12/31/10	9	2010-12-31T12:09:13.860	2010	12
true	6	6	6	60	6.6	60.59999999999999	7296	12/31/10	6	2010-12-31T12:06:13.650	2010	12
true	8	8	8	80	8.8	80.8	7298	12/31/10	8	2010-12-31T12:08:13.780	2010	12

-- !schema_4 --
2	24	15314771	999319712124142303	true	6.009337E8	4.817722807977021e+16	\N	northern rural	2022-08-30T23:21:08	407186.2849	phones	int_col	2019-01-01	[2.595433907849411e+17, 5.88165568758352e+17, 4.780259987226574e+17, 6.926622881251557e+17, 9.86405645575228e+17]	\N	phones	int_col
5	59	317349992	998913039814974432	false	5.6584858E8	9.900861328269033e+17	Handling man satisfy firework descent top. Racing closed county set-up crown cave. Correctly front duration pure.	\N	2022-09-02T19:52:57	372765.2493	desktops	tinyint_col	2021-10-03	[9.983261252571983e+17, 3.612076153030643e+17, 9.969131496509435e+17, 8.991290717923475e+17, 1.195589374709888e+17]	["CrySxz", "FMXGRcaGbahSVqhp", "oRKqPmhM", "VdODasEdDWFSRIQf"]	desktops	tinyint_col
6	62	915699741	999653836472045196	true	4.51937504E8	8.796150544502191e+17	Tale get speed platform august curved. Ease grass neighbour landlord. Baby genetic youth.	\N	2022-08-07T09:30:56	875620.2176	phones	smallint_col	\N	[9.423540715161855e+17, 4.833249992029562e+17, 9.167007747789834e+17]	["zNfbLeFx", "GNTJOmWJyRmOK", "hwvfhSQGsaaMEqUrWCK", "cQrQsROKLARA", "nONj", "oepXBFB", "IPtUql"]	phones	smallint_col

-- !schema_5 --
00cwjIryUv	EXHwpeK2Nl	hv2PYEMYMM	eo69nyw4Yv	K6797tgjFg	LlFNd8Kyy5	wkpLCO3uo1	AIXCj1MfeD	ni0HxZbiUO	6IjRdM8Gqi	qsTMK6A2eC	1wu7v9OPwW	qavArd9tDc	sU88hZADLj	lyzWlwLOCx	2022-11-25

-- !schema_6 --
""	"test"

-- !schema_7 --
\N	\N	\N	\N	\N	\N	\N	\N	\N		test		test	test      	1	2	3	4	5.1	6.2	true	false	2011-05-06	2011-05-06T07:08:09.123	-1.2	12.30	-1234.5678	123456789.12340000	-1234567890.12345678	1234567890123456789012.1234567800000000	dGVzdDI=

-- !all_types_bool_col_topn_asc --
false	1	1	1	10	1.1	10.1	1	01/01/09	1	2009-01-01T07:01	2009	1
false	3	3	3	30	3.3	30.3	3	01/01/09	3	2009-01-01T07:03:00.300	2009	1
false	5	5	5	50	5.5	50.5	5	01/01/09	5	2009-01-01T07:05:00.100	2009	1
false	7	7	7	70	7.7	70.7	7	01/01/09	7	2009-01-01T07:07:00.210	2009	1
false	9	9	9	90	9.9	90.89999999999999	9	01/01/09	9	2009-01-01T07:09:00.360	2009	1
false	1	1	1	10	1.1	10.1	11	01/02/09	1	2009-01-02T07:11:00.450	2009	1
false	3	3	3	30	3.3	30.3	13	01/02/09	3	2009-01-02T07:13:00.480	2009	1
false	5	5	5	50	5.5	50.5	15	01/02/09	5	2009-01-02T07:15:00.550	2009	1
false	7	7	7	70	7.7	70.7	17	01/02/09	7	2009-01-02T07:17:00.660	2009	1
false	9	9	9	90	9.9	90.89999999999999	19	01/02/09	9	2009-01-02T07:19:00.810	2009	1

-- !all_types_bool_col_topn_desc --
true	8	8	8	80	8.8	80.8	7298	12/31/10	8	2010-12-31T12:08:13.780	2010	12
true	6	6	6	60	6.6	60.59999999999999	7296	12/31/10	6	2010-12-31T12:06:13.650	2010	12
true	4	4	4	40	4.4	40.4	7294	12/31/10	4	2010-12-31T12:04:13.560	2010	12
true	2	2	2	20	2.2	20.2	7292	12/31/10	2	2010-12-31T12:02:13.510	2010	12
true	0	0	0	0	0.0	0	7290	12/31/10	0	2010-12-31T12:00:13.500	2010	12
true	8	8	8	80	8.8	80.8	7288	12/30/10	8	2010-12-30T11:58:13.330	2010	12
true	6	6	6	60	6.6	60.59999999999999	7286	12/30/10	6	2010-12-30T11:56:13.200	2010	12
true	4	4	4	40	4.4	40.4	7284	12/30/10	4	2010-12-30T11:54:13.110	2010	12
true	2	2	2	20	2.2	20.2	7282	12/30/10	2	2010-12-30T11:52:13.600	2010	12
true	0	0	0	0	0.0	0	7280	12/30/10	0	2010-12-30T11:50:13.500	2010	12

-- !all_types_tinyint_col_topn_asc --
true	0	0	0	0	0.0	0	0	01/01/09	0	2009-01-01T07:00	2009	1
true	0	0	0	0	0.0	0	10	01/02/09	0	2009-01-02T07:10:00.450	2009	1
true	0	0	0	0	0.0	0	20	01/03/09	0	2009-01-03T07:20:00.900	2009	1
true	0	0	0	0	0.0	0	30	01/04/09	0	2009-01-04T07:30:01.350	2009	1
true	0	0	0	0	0.0	0	40	01/05/09	0	2009-01-05T07:40:01.800	2009	1
true	0	0	0	0	0.0	0	50	01/06/09	0	2009-01-06T07:50:02.250	2009	1
true	0	0	0	0	0.0	0	60	01/07/09	0	2009-01-07T08:00:02.700	2009	1
true	0	0	0	0	0.0	0	70	01/08/09	0	2009-01-08T08:10:03.150	2009	1
true	0	0	0	0	0.0	0	80	01/09/09	0	2009-01-09T08:20:03.600	2009	1
true	0	0	0	0	0.0	0	90	01/10/09	0	2009-01-10T08:30:04.500	2009	1

-- !all_types_tinyint_col_topn_desc --
false	9	9	9	90	9.9	90.89999999999999	7299	12/31/10	9	2010-12-31T12:09:13.860	2010	12
false	9	9	9	90	9.9	90.89999999999999	7289	12/30/10	9	2010-12-30T11:59:13.410	2010	12
false	9	9	9	90	9.9	90.89999999999999	7279	12/29/10	9	2010-12-29T11:49:12.960	2010	12
false	9	9	9	90	9.9	90.89999999999999	7269	12/28/10	9	2010-12-28T11:39:12.510	2010	12
false	9	9	9	90	9.9	90.89999999999999	7259	12/27/10	9	2010-12-27T11:29:12.600	2010	12
false	9	9	9	90	9.9	90.89999999999999	7249	12/26/10	9	2010-12-26T11:19:11.610	2010	12
false	9	9	9	90	9.9	90.89999999999999	7239	12/25/10	9	2010-12-25T11:09:11.160	2010	12
false	9	9	9	90	9.9	90.89999999999999	7229	12/24/10	9	2010-12-24T10:59:10.710	2010	12
false	9	9	9	90	9.9	90.89999999999999	7219	12/23/10	9	2010-12-23T10:49:10.260	2010	12
false	9	9	9	90	9.9	90.89999999999999	7209	12/22/10	9	2010-12-22T10:39:09.810	2010	12

-- !all_types_smallint_col_topn_asc --
true	0	0	0	0	0.0	0	0	01/01/09	0	2009-01-01T07:00	2009	1
true	0	0	0	0	0.0	0	10	01/02/09	0	2009-01-02T07:10:00.450	2009	1
true	0	0	0	0	0.0	0	20	01/03/09	0	2009-01-03T07:20:00.900	2009	1
true	0	0	0	0	0.0	0	30	01/04/09	0	2009-01-04T07:30:01.350	2009	1
true	0	0	0	0	0.0	0	40	01/05/09	0	2009-01-05T07:40:01.800	2009	1
true	0	0	0	0	0.0	0	50	01/06/09	0	2009-01-06T07:50:02.250	2009	1
true	0	0	0	0	0.0	0	60	01/07/09	0	2009-01-07T08:00:02.700	2009	1
true	0	0	0	0	0.0	0	70	01/08/09	0	2009-01-08T08:10:03.150	2009	1
true	0	0	0	0	0.0	0	80	01/09/09	0	2009-01-09T08:20:03.600	2009	1
true	0	0	0	0	0.0	0	90	01/10/09	0	2009-01-10T08:30:04.500	2009	1

-- !all_types_smallint_col_topn_desc --
false	9	9	9	90	9.9	90.89999999999999	7299	12/31/10	9	2010-12-31T12:09:13.860	2010	12
false	9	9	9	90	9.9	90.89999999999999	7289	12/30/10	9	2010-12-30T11:59:13.410	2010	12
false	9	9	9	90	9.9	90.89999999999999	7279	12/29/10	9	2010-12-29T11:49:12.960	2010	12
false	9	9	9	90	9.9	90.89999999999999	7269	12/28/10	9	2010-12-28T11:39:12.510	2010	12
false	9	9	9	90	9.9	90.89999999999999	7259	12/27/10	9	2010-12-27T11:29:12.600	2010	12
false	9	9	9	90	9.9	90.89999999999999	7249	12/26/10	9	2010-12-26T11:19:11.610	2010	12
false	9	9	9	90	9.9	90.89999999999999	7239	12/25/10	9	2010-12-25T11:09:11.160	2010	12
false	9	9	9	90	9.9	90.89999999999999	7229	12/24/10	9	2010-12-24T10:59:10.710	2010	12
false	9	9	9	90	9.9	90.89999999999999	7219	12/23/10	9	2010-12-23T10:49:10.260	2010	12
false	9	9	9	90	9.9	90.89999999999999	7209	12/22/10	9	2010-12-22T10:39:09.810	2010	12

-- !all_types_int_col_topn_asc --
true	0	0	0	0	0.0	0	0	01/01/09	0	2009-01-01T07:00	2009	1
true	0	0	0	0	0.0	0	10	01/02/09	0	2009-01-02T07:10:00.450	2009	1
true	0	0	0	0	0.0	0	20	01/03/09	0	2009-01-03T07:20:00.900	2009	1
true	0	0	0	0	0.0	0	30	01/04/09	0	2009-01-04T07:30:01.350	2009	1
true	0	0	0	0	0.0	0	40	01/05/09	0	2009-01-05T07:40:01.800	2009	1
true	0	0	0	0	0.0	0	50	01/06/09	0	2009-01-06T07:50:02.250	2009	1
true	0	0	0	0	0.0	0	60	01/07/09	0	2009-01-07T08:00:02.700	2009	1
true	0	0	0	0	0.0	0	70	01/08/09	0	2009-01-08T08:10:03.150	2009	1
true	0	0	0	0	0.0	0	80	01/09/09	0	2009-01-09T08:20:03.600	2009	1
true	0	0	0	0	0.0	0	90	01/10/09	0	2009-01-10T08:30:04.500	2009	1

-- !all_types_int_col_topn_desc --
false	9	9	9	90	9.9	90.89999999999999	7299	12/31/10	9	2010-12-31T12:09:13.860	2010	12
false	9	9	9	90	9.9	90.89999999999999	7289	12/30/10	9	2010-12-30T11:59:13.410	2010	12
false	9	9	9	90	9.9	90.89999999999999	7279	12/29/10	9	2010-12-29T11:49:12.960	2010	12
false	9	9	9	90	9.9	90.89999999999999	7269	12/28/10	9	2010-12-28T11:39:12.510	2010	12
false	9	9	9	90	9.9	90.89999999999999	7259	12/27/10	9	2010-12-27T11:29:12.600	2010	12
false	9	9	9	90	9.9	90.89999999999999	7249	12/26/10	9	2010-12-26T11:19:11.610	2010	12
false	9	9	9	90	9.9	90.89999999999999	7239	12/25/10	9	2010-12-25T11:09:11.160	2010	12
false	9	9	9	90	9.9	90.89999999999999	7229	12/24/10	9	2010-12-24T10:59:10.710	2010	12
false	9	9	9	90	9.9	90.89999999999999	7219	12/23/10	9	2010-12-23T10:49:10.260	2010	12
false	9	9	9	90	9.9	90.89999999999999	7209	12/22/10	9	2010-12-22T10:39:09.810	2010	12

-- !all_types_bigint_col_topn_asc --
true	0	0	0	0	0.0	0	0	01/01/09	0	2009-01-01T07:00	2009	1
true	0	0	0	0	0.0	0	10	01/02/09	0	2009-01-02T07:10:00.450	2009	1
true	0	0	0	0	0.0	0	20	01/03/09	0	2009-01-03T07:20:00.900	2009	1
true	0	0	0	0	0.0	0	30	01/04/09	0	2009-01-04T07:30:01.350	2009	1
true	0	0	0	0	0.0	0	40	01/05/09	0	2009-01-05T07:40:01.800	2009	1
true	0	0	0	0	0.0	0	50	01/06/09	0	2009-01-06T07:50:02.250	2009	1
true	0	0	0	0	0.0	0	60	01/07/09	0	2009-01-07T08:00:02.700	2009	1
true	0	0	0	0	0.0	0	70	01/08/09	0	2009-01-08T08:10:03.150	2009	1
true	0	0	0	0	0.0	0	80	01/09/09	0	2009-01-09T08:20:03.600	2009	1
true	0	0	0	0	0.0	0	90	01/10/09	0	2009-01-10T08:30:04.500	2009	1

-- !all_types_bigint_col_topn_desc --
false	9	9	9	90	9.9	90.89999999999999	7299	12/31/10	9	2010-12-31T12:09:13.860	2010	12
false	9	9	9	90	9.9	90.89999999999999	7289	12/30/10	9	2010-12-30T11:59:13.410	2010	12
false	9	9	9	90	9.9	90.89999999999999	7279	12/29/10	9	2010-12-29T11:49:12.960	2010	12
false	9	9	9	90	9.9	90.89999999999999	7269	12/28/10	9	2010-12-28T11:39:12.510	2010	12
false	9	9	9	90	9.9	90.89999999999999	7259	12/27/10	9	2010-12-27T11:29:12.600	2010	12
false	9	9	9	90	9.9	90.89999999999999	7249	12/26/10	9	2010-12-26T11:19:11.610	2010	12
false	9	9	9	90	9.9	90.89999999999999	7239	12/25/10	9	2010-12-25T11:09:11.160	2010	12
false	9	9	9	90	9.9	90.89999999999999	7229	12/24/10	9	2010-12-24T10:59:10.710	2010	12
false	9	9	9	90	9.9	90.89999999999999	7219	12/23/10	9	2010-12-23T10:49:10.260	2010	12
false	9	9	9	90	9.9	90.89999999999999	7209	12/22/10	9	2010-12-22T10:39:09.810	2010	12

-- !all_types_float_col_topn_asc --
true	0	0	0	0	0.0	0	0	01/01/09	0	2009-01-01T07:00	2009	1
true	0	0	0	0	0.0	0	10	01/02/09	0	2009-01-02T07:10:00.450	2009	1
true	0	0	0	0	0.0	0	20	01/03/09	0	2009-01-03T07:20:00.900	2009	1
true	0	0	0	0	0.0	0	30	01/04/09	0	2009-01-04T07:30:01.350	2009	1
true	0	0	0	0	0.0	0	40	01/05/09	0	2009-01-05T07:40:01.800	2009	1
true	0	0	0	0	0.0	0	50	01/06/09	0	2009-01-06T07:50:02.250	2009	1
true	0	0	0	0	0.0	0	60	01/07/09	0	2009-01-07T08:00:02.700	2009	1
true	0	0	0	0	0.0	0	70	01/08/09	0	2009-01-08T08:10:03.150	2009	1
true	0	0	0	0	0.0	0	80	01/09/09	0	2009-01-09T08:20:03.600	2009	1
true	0	0	0	0	0.0	0	90	01/10/09	0	2009-01-10T08:30:04.500	2009	1

-- !all_types_float_col_topn_desc --
false	9	9	9	90	9.9	90.89999999999999	7299	12/31/10	9	2010-12-31T12:09:13.860	2010	12
false	9	9	9	90	9.9	90.89999999999999	7289	12/30/10	9	2010-12-30T11:59:13.410	2010	12
false	9	9	9	90	9.9	90.89999999999999	7279	12/29/10	9	2010-12-29T11:49:12.960	2010	12
false	9	9	9	90	9.9	90.89999999999999	7269	12/28/10	9	2010-12-28T11:39:12.510	2010	12
false	9	9	9	90	9.9	90.89999999999999	7259	12/27/10	9	2010-12-27T11:29:12.600	2010	12
false	9	9	9	90	9.9	90.89999999999999	7249	12/26/10	9	2010-12-26T11:19:11.610	2010	12
false	9	9	9	90	9.9	90.89999999999999	7239	12/25/10	9	2010-12-25T11:09:11.160	2010	12
false	9	9	9	90	9.9	90.89999999999999	7229	12/24/10	9	2010-12-24T10:59:10.710	2010	12
false	9	9	9	90	9.9	90.89999999999999	7219	12/23/10	9	2010-12-23T10:49:10.260	2010	12
false	9	9	9	90	9.9	90.89999999999999	7209	12/22/10	9	2010-12-22T10:39:09.810	2010	12

-- !all_types_double_col_topn_asc --
true	0	0	0	0	0.0	0	0	01/01/09	0	2009-01-01T07:00	2009	1
true	0	0	0	0	0.0	0	10	01/02/09	0	2009-01-02T07:10:00.450	2009	1
true	0	0	0	0	0.0	0	20	01/03/09	0	2009-01-03T07:20:00.900	2009	1
true	0	0	0	0	0.0	0	30	01/04/09	0	2009-01-04T07:30:01.350	2009	1
true	0	0	0	0	0.0	0	40	01/05/09	0	2009-01-05T07:40:01.800	2009	1
true	0	0	0	0	0.0	0	50	01/06/09	0	2009-01-06T07:50:02.250	2009	1
true	0	0	0	0	0.0	0	60	01/07/09	0	2009-01-07T08:00:02.700	2009	1
true	0	0	0	0	0.0	0	70	01/08/09	0	2009-01-08T08:10:03.150	2009	1
true	0	0	0	0	0.0	0	80	01/09/09	0	2009-01-09T08:20:03.600	2009	1
true	0	0	0	0	0.0	0	90	01/10/09	0	2009-01-10T08:30:04.500	2009	1

-- !all_types_double_col_topn_desc --
false	9	9	9	90	9.9	90.89999999999999	7299	12/31/10	9	2010-12-31T12:09:13.860	2010	12
false	9	9	9	90	9.9	90.89999999999999	7289	12/30/10	9	2010-12-30T11:59:13.410	2010	12
false	9	9	9	90	9.9	90.89999999999999	7279	12/29/10	9	2010-12-29T11:49:12.960	2010	12
false	9	9	9	90	9.9	90.89999999999999	7269	12/28/10	9	2010-12-28T11:39:12.510	2010	12
false	9	9	9	90	9.9	90.89999999999999	7259	12/27/10	9	2010-12-27T11:29:12.600	2010	12
false	9	9	9	90	9.9	90.89999999999999	7249	12/26/10	9	2010-12-26T11:19:11.610	2010	12
false	9	9	9	90	9.9	90.89999999999999	7239	12/25/10	9	2010-12-25T11:09:11.160	2010	12
false	9	9	9	90	9.9	90.89999999999999	7229	12/24/10	9	2010-12-24T10:59:10.710	2010	12
false	9	9	9	90	9.9	90.89999999999999	7219	12/23/10	9	2010-12-23T10:49:10.260	2010	12
false	9	9	9	90	9.9	90.89999999999999	7209	12/22/10	9	2010-12-22T10:39:09.810	2010	12

-- !all_types_id_topn_asc --
true	0	0	0	0	0.0	0	0	01/01/09	0	2009-01-01T07:00	2009	1
false	1	1	1	10	1.1	10.1	1	01/01/09	1	2009-01-01T07:01	2009	1
true	2	2	2	20	2.2	20.2	2	01/01/09	2	2009-01-01T07:02:00.100	2009	1
false	3	3	3	30	3.3	30.3	3	01/01/09	3	2009-01-01T07:03:00.300	2009	1
true	4	4	4	40	4.4	40.4	4	01/01/09	4	2009-01-01T07:04:00.600	2009	1
false	5	5	5	50	5.5	50.5	5	01/01/09	5	2009-01-01T07:05:00.100	2009	1
true	6	6	6	60	6.6	60.59999999999999	6	01/01/09	6	2009-01-01T07:06:00.150	2009	1
false	7	7	7	70	7.7	70.7	7	01/01/09	7	2009-01-01T07:07:00.210	2009	1
true	8	8	8	80	8.8	80.8	8	01/01/09	8	2009-01-01T07:08:00.280	2009	1
false	9	9	9	90	9.9	90.89999999999999	9	01/01/09	9	2009-01-01T07:09:00.360	2009	1

-- !all_types_id_topn_desc --
false	9	9	9	90	9.9	90.89999999999999	7299	12/31/10	9	2010-12-31T12:09:13.860	2010	12
true	8	8	8	80	8.8	80.8	7298	12/31/10	8	2010-12-31T12:08:13.780	2010	12
false	7	7	7	70	7.7	70.7	7297	12/31/10	7	2010-12-31T12:07:13.710	2010	12
true	6	6	6	60	6.6	60.59999999999999	7296	12/31/10	6	2010-12-31T12:06:13.650	2010	12
false	5	5	5	50	5.5	50.5	7295	12/31/10	5	2010-12-31T12:05:13.600	2010	12
true	4	4	4	40	4.4	40.4	7294	12/31/10	4	2010-12-31T12:04:13.560	2010	12
false	3	3	3	30	3.3	30.3	7293	12/31/10	3	2010-12-31T12:03:13.530	2010	12
true	2	2	2	20	2.2	20.2	7292	12/31/10	2	2010-12-31T12:02:13.510	2010	12
false	1	1	1	10	1.1	10.1	7291	12/31/10	1	2010-12-31T12:01:13.500	2010	12
true	0	0	0	0	0.0	0	7290	12/31/10	0	2010-12-31T12:00:13.500	2010	12

-- !all_types_date_string_col_topn_asc --
true	0	0	0	0	0.0	0	0	01/01/09	0	2009-01-01T07:00	2009	1
false	1	1	1	10	1.1	10.1	1	01/01/09	1	2009-01-01T07:01	2009	1
true	2	2	2	20	2.2	20.2	2	01/01/09	2	2009-01-01T07:02:00.100	2009	1
false	3	3	3	30	3.3	30.3	3	01/01/09	3	2009-01-01T07:03:00.300	2009	1
true	4	4	4	40	4.4	40.4	4	01/01/09	4	2009-01-01T07:04:00.600	2009	1
false	5	5	5	50	5.5	50.5	5	01/01/09	5	2009-01-01T07:05:00.100	2009	1
true	6	6	6	60	6.6	60.59999999999999	6	01/01/09	6	2009-01-01T07:06:00.150	2009	1
false	7	7	7	70	7.7	70.7	7	01/01/09	7	2009-01-01T07:07:00.210	2009	1
true	8	8	8	80	8.8	80.8	8	01/01/09	8	2009-01-01T07:08:00.280	2009	1
false	9	9	9	90	9.9	90.89999999999999	9	01/01/09	9	2009-01-01T07:09:00.360	2009	1

-- !all_types_date_string_col_topn_desc --
false	9	9	9	90	9.9	90.89999999999999	7299	12/31/10	9	2010-12-31T12:09:13.860	2010	12
true	8	8	8	80	8.8	80.8	7298	12/31/10	8	2010-12-31T12:08:13.780	2010	12
false	7	7	7	70	7.7	70.7	7297	12/31/10	7	2010-12-31T12:07:13.710	2010	12
true	6	6	6	60	6.6	60.59999999999999	7296	12/31/10	6	2010-12-31T12:06:13.650	2010	12
false	5	5	5	50	5.5	50.5	7295	12/31/10	5	2010-12-31T12:05:13.600	2010	12
true	4	4	4	40	4.4	40.4	7294	12/31/10	4	2010-12-31T12:04:13.560	2010	12
false	3	3	3	30	3.3	30.3	7293	12/31/10	3	2010-12-31T12:03:13.530	2010	12
true	2	2	2	20	2.2	20.2	7292	12/31/10	2	2010-12-31T12:02:13.510	2010	12
false	1	1	1	10	1.1	10.1	7291	12/31/10	1	2010-12-31T12:01:13.500	2010	12
true	0	0	0	0	0.0	0	7290	12/31/10	0	2010-12-31T12:00:13.500	2010	12

-- !all_types_string_col_topn_asc --
true	0	0	0	0	0.0	0	0	01/01/09	0	2009-01-01T07:00	2009	1
true	0	0	0	0	0.0	0	10	01/02/09	0	2009-01-02T07:10:00.450	2009	1
true	0	0	0	0	0.0	0	20	01/03/09	0	2009-01-03T07:20:00.900	2009	1
true	0	0	0	0	0.0	0	30	01/04/09	0	2009-01-04T07:30:01.350	2009	1
true	0	0	0	0	0.0	0	40	01/05/09	0	2009-01-05T07:40:01.800	2009	1
true	0	0	0	0	0.0	0	50	01/06/09	0	2009-01-06T07:50:02.250	2009	1
true	0	0	0	0	0.0	0	60	01/07/09	0	2009-01-07T08:00:02.700	2009	1
true	0	0	0	0	0.0	0	70	01/08/09	0	2009-01-08T08:10:03.150	2009	1
true	0	0	0	0	0.0	0	80	01/09/09	0	2009-01-09T08:20:03.600	2009	1
true	0	0	0	0	0.0	0	90	01/10/09	0	2009-01-10T08:30:04.500	2009	1

-- !all_types_string_col_topn_desc --
false	9	9	9	90	9.9	90.89999999999999	7299	12/31/10	9	2010-12-31T12:09:13.860	2010	12
false	9	9	9	90	9.9	90.89999999999999	7289	12/30/10	9	2010-12-30T11:59:13.410	2010	12
false	9	9	9	90	9.9	90.89999999999999	7279	12/29/10	9	2010-12-29T11:49:12.960	2010	12
false	9	9	9	90	9.9	90.89999999999999	7269	12/28/10	9	2010-12-28T11:39:12.510	2010	12
false	9	9	9	90	9.9	90.89999999999999	7259	12/27/10	9	2010-12-27T11:29:12.600	2010	12
false	9	9	9	90	9.9	90.89999999999999	7249	12/26/10	9	2010-12-26T11:19:11.610	2010	12
false	9	9	9	90	9.9	90.89999999999999	7239	12/25/10	9	2010-12-25T11:09:11.160	2010	12
false	9	9	9	90	9.9	90.89999999999999	7229	12/24/10	9	2010-12-24T10:59:10.710	2010	12
false	9	9	9	90	9.9	90.89999999999999	7219	12/23/10	9	2010-12-23T10:49:10.260	2010	12
false	9	9	9	90	9.9	90.89999999999999	7209	12/22/10	9	2010-12-22T10:39:09.810	2010	12

-- !all_types_timestamp_col_topn_asc --
true	0	0	0	0	0.0	0	0	01/01/09	0	2009-01-01T07:00	2009	1
false	1	1	1	10	1.1	10.1	1	01/01/09	1	2009-01-01T07:01	2009	1
true	2	2	2	20	2.2	20.2	2	01/01/09	2	2009-01-01T07:02:00.100	2009	1
false	3	3	3	30	3.3	30.3	3	01/01/09	3	2009-01-01T07:03:00.300	2009	1
true	4	4	4	40	4.4	40.4	4	01/01/09	4	2009-01-01T07:04:00.600	2009	1
false	5	5	5	50	5.5	50.5	5	01/01/09	5	2009-01-01T07:05:00.100	2009	1
true	6	6	6	60	6.6	60.59999999999999	6	01/01/09	6	2009-01-01T07:06:00.150	2009	1
false	7	7	7	70	7.7	70.7	7	01/01/09	7	2009-01-01T07:07:00.210	2009	1
true	8	8	8	80	8.8	80.8	8	01/01/09	8	2009-01-01T07:08:00.280	2009	1
false	9	9	9	90	9.9	90.89999999999999	9	01/01/09	9	2009-01-01T07:09:00.360	2009	1

-- !all_types_timestamp_col_topn_desc --
false	9	9	9	90	9.9	90.89999999999999	7299	12/31/10	9	2010-12-31T12:09:13.860	2010	12
true	8	8	8	80	8.8	80.8	7298	12/31/10	8	2010-12-31T12:08:13.780	2010	12
false	7	7	7	70	7.7	70.7	7297	12/31/10	7	2010-12-31T12:07:13.710	2010	12
true	6	6	6	60	6.6	60.59999999999999	7296	12/31/10	6	2010-12-31T12:06:13.650	2010	12
false	5	5	5	50	5.5	50.5	7295	12/31/10	5	2010-12-31T12:05:13.600	2010	12
true	4	4	4	40	4.4	40.4	7294	12/31/10	4	2010-12-31T12:04:13.560	2010	12
false	3	3	3	30	3.3	30.3	7293	12/31/10	3	2010-12-31T12:03:13.530	2010	12
true	2	2	2	20	2.2	20.2	7292	12/31/10	2	2010-12-31T12:02:13.510	2010	12
false	1	1	1	10	1.1	10.1	7291	12/31/10	1	2010-12-31T12:01:13.500	2010	12
true	0	0	0	0	0.0	0	7290	12/31/10	0	2010-12-31T12:00:13.500	2010	12

-- !all_types_year_topn_asc --
true	0	0	0	0	0.0	0	0	01/01/09	0	2009-01-01T07:00	2009	1
false	1	1	1	10	1.1	10.1	1	01/01/09	1	2009-01-01T07:01	2009	1
true	2	2	2	20	2.2	20.2	2	01/01/09	2	2009-01-01T07:02:00.100	2009	1
false	3	3	3	30	3.3	30.3	3	01/01/09	3	2009-01-01T07:03:00.300	2009	1
true	4	4	4	40	4.4	40.4	4	01/01/09	4	2009-01-01T07:04:00.600	2009	1
false	5	5	5	50	5.5	50.5	5	01/01/09	5	2009-01-01T07:05:00.100	2009	1
true	6	6	6	60	6.6	60.59999999999999	6	01/01/09	6	2009-01-01T07:06:00.150	2009	1
false	7	7	7	70	7.7	70.7	7	01/01/09	7	2009-01-01T07:07:00.210	2009	1
true	8	8	8	80	8.8	80.8	8	01/01/09	8	2009-01-01T07:08:00.280	2009	1
false	9	9	9	90	9.9	90.89999999999999	9	01/01/09	9	2009-01-01T07:09:00.360	2009	1

-- !all_types_year_topn_desc --
false	9	9	9	90	9.9	90.89999999999999	7299	12/31/10	9	2010-12-31T12:09:13.860	2010	12
true	8	8	8	80	8.8	80.8	7298	12/31/10	8	2010-12-31T12:08:13.780	2010	12
false	7	7	7	70	7.7	70.7	7297	12/31/10	7	2010-12-31T12:07:13.710	2010	12
true	6	6	6	60	6.6	60.59999999999999	7296	12/31/10	6	2010-12-31T12:06:13.650	2010	12
false	5	5	5	50	5.5	50.5	7295	12/31/10	5	2010-12-31T12:05:13.600	2010	12
true	4	4	4	40	4.4	40.4	7294	12/31/10	4	2010-12-31T12:04:13.560	2010	12
false	3	3	3	30	3.3	30.3	7293	12/31/10	3	2010-12-31T12:03:13.530	2010	12
true	2	2	2	20	2.2	20.2	7292	12/31/10	2	2010-12-31T12:02:13.510	2010	12
false	1	1	1	10	1.1	10.1	7291	12/31/10	1	2010-12-31T12:01:13.500	2010	12
true	0	0	0	0	0.0	0	7290	12/31/10	0	2010-12-31T12:00:13.500	2010	12

-- !all_types_month_topn_asc --
true	0	0	0	0	0.0	0	0	01/01/09	0	2009-01-01T07:00	2009	1
false	1	1	1	10	1.1	10.1	1	01/01/09	1	2009-01-01T07:01	2009	1
true	2	2	2	20	2.2	20.2	2	01/01/09	2	2009-01-01T07:02:00.100	2009	1
false	3	3	3	30	3.3	30.3	3	01/01/09	3	2009-01-01T07:03:00.300	2009	1
true	4	4	4	40	4.4	40.4	4	01/01/09	4	2009-01-01T07:04:00.600	2009	1
false	5	5	5	50	5.5	50.5	5	01/01/09	5	2009-01-01T07:05:00.100	2009	1
true	6	6	6	60	6.6	60.59999999999999	6	01/01/09	6	2009-01-01T07:06:00.150	2009	1
false	7	7	7	70	7.7	70.7	7	01/01/09	7	2009-01-01T07:07:00.210	2009	1
true	8	8	8	80	8.8	80.8	8	01/01/09	8	2009-01-01T07:08:00.280	2009	1
false	9	9	9	90	9.9	90.89999999999999	9	01/01/09	9	2009-01-01T07:09:00.360	2009	1

-- !all_types_month_topn_desc --
false	9	9	9	90	9.9	90.89999999999999	7299	12/31/10	9	2010-12-31T12:09:13.860	2010	12
true	8	8	8	80	8.8	80.8	7298	12/31/10	8	2010-12-31T12:08:13.780	2010	12
false	7	7	7	70	7.7	70.7	7297	12/31/10	7	2010-12-31T12:07:13.710	2010	12
true	6	6	6	60	6.6	60.59999999999999	7296	12/31/10	6	2010-12-31T12:06:13.650	2010	12
false	5	5	5	50	5.5	50.5	7295	12/31/10	5	2010-12-31T12:05:13.600	2010	12
true	4	4	4	40	4.4	40.4	7294	12/31/10	4	2010-12-31T12:04:13.560	2010	12
false	3	3	3	30	3.3	30.3	7293	12/31/10	3	2010-12-31T12:03:13.530	2010	12
true	2	2	2	20	2.2	20.2	7292	12/31/10	2	2010-12-31T12:02:13.510	2010	12
false	1	1	1	10	1.1	10.1	7291	12/31/10	1	2010-12-31T12:01:13.500	2010	12
true	0	0	0	0	0.0	0	7290	12/31/10	0	2010-12-31T12:00:13.500	2010	12

-- !schema_1 --
1	7706	1	155190	17.00	21168.23	0.04	0.02	N	O	1996-03-13	1996-02-12	1996-03-22	DELIVER IN PERSON	TRUCK	egular courts above the	cn	beijing

-- !schema_2 --
6374628540732951412	-77	-65	-70	-107	-215	65	0	-526	-1309	3750	8827	-19795	34647	57042	-1662	-138248	-890685	-228568	1633079	-2725524	6163040	-10491702	697237	74565050	127767368	93532213	-209675435	-32116110	-3624917040	-2927805617	15581947241	21893441661	24075494509	-116822110531	-59683724667	-146210393388	114424524398	1341560771667	-1638742564263	520137948334	-2927347587131	7415137351179	-7963937754617	52157548982266	140803519083304	-294675355729619	-868076759504942	181128508165910	-91753231238823	-3511241416682881	-11545256318348796	-1952917510863468	-5161099825338866	-59726090170689781	287170105829528178	607326725526282735	1253194074103207461	-162443950414676064	-2964036188567341159	2602201580810990248	5581917084094110764	111739292249520611	-315687754593838642	-2804420462762366976	-2078683524

-- !schema_3 --
false	5	5	5	50	5.5	50.5	7295	12/31/10	5	2010-12-31T12:05:13.600	2010	12
false	7	7	7	70	7.7	70.7	7297	12/31/10	7	2010-12-31T12:07:13.710	2010	12
false	9	9	9	90	9.9	90.89999999999999	7299	12/31/10	9	2010-12-31T12:09:13.860	2010	12
true	6	6	6	60	6.6	60.59999999999999	7296	12/31/10	6	2010-12-31T12:06:13.650	2010	12
true	8	8	8	80	8.8	80.8	7298	12/31/10	8	2010-12-31T12:08:13.780	2010	12

-- !schema_4 --
2	24	15314771	999319712124142303	true	6.009337E8	4.817722807977021e+16	\N	northern rural	2022-08-30T23:21:08	407186.2849	phones	int_col	2019-01-01	[2.595433907849411e+17, 5.88165568758352e+17, 4.780259987226574e+17, 6.926622881251557e+17, 9.86405645575228e+17]	\N	phones	int_col
5	59	317349992	998913039814974432	false	5.6584858E8	9.900861328269033e+17	Handling man satisfy firework descent top. Racing closed county set-up crown cave. Correctly front duration pure.	\N	2022-09-02T19:52:57	372765.2493	desktops	tinyint_col	2021-10-03	[9.983261252571983e+17, 3.612076153030643e+17, 9.969131496509435e+17, 8.991290717923475e+17, 1.195589374709888e+17]	["CrySxz", "FMXGRcaGbahSVqhp", "oRKqPmhM", "VdODasEdDWFSRIQf"]	desktops	tinyint_col
6	62	915699741	999653836472045196	true	4.51937504E8	8.796150544502191e+17	Tale get speed platform august curved. Ease grass neighbour landlord. Baby genetic youth.	\N	2022-08-07T09:30:56	875620.2176	phones	smallint_col	\N	[9.423540715161855e+17, 4.833249992029562e+17, 9.167007747789834e+17]	["zNfbLeFx", "GNTJOmWJyRmOK", "hwvfhSQGsaaMEqUrWCK", "cQrQsROKLARA", "nONj", "oepXBFB", "IPtUql"]	phones	smallint_col

-- !schema_5 --
00cwjIryUv	EXHwpeK2Nl	hv2PYEMYMM	eo69nyw4Yv	K6797tgjFg	LlFNd8Kyy5	wkpLCO3uo1	AIXCj1MfeD	ni0HxZbiUO	6IjRdM8Gqi	qsTMK6A2eC	1wu7v9OPwW	qavArd9tDc	sU88hZADLj	lyzWlwLOCx	2022-11-25

-- !schema_6 --
""	"test"

-- !schema_7 --
\N	\N	\N	\N	\N	\N	\N	\N	\N		test		test	test      	1	2	3	4	5.1	6.2	true	false	2011-05-06	2011-05-06T07:08:09.123	-1.2	12.30	-1234.5678	123456789.12340000	-1234567890.12345678	1234567890123456789012.1234567800000000	dGVzdDI=

