-- This file is automatically generated. You should know what you did if you want to edit this
-- !q1 --
false	1	1	1	10	1.1	10.1	1	01/01/09	1	2009-01-01T07:01	2009	1
false	1	1	1	10	1.1	10.1	11	01/02/09	1	2009-01-02T07:11:00.450	2009	1
false	1	1	1	10	1.1	10.1	21	01/03/09	1	2009-01-03T07:21:00.900	2009	1
false	3	3	3	30	3.3	30.3	13	01/02/09	3	2009-01-02T07:13:00.480	2009	1
false	3	3	3	30	3.3	30.3	23	01/03/09	3	2009-01-03T07:23:00.930	2009	1
false	3	3	3	30	3.3	30.3	3	01/01/09	3	2009-01-01T07:03:00.300	2009	1
false	5	5	5	50	5.5	50.5	15	01/02/09	5	2009-01-02T07:15:00.550	2009	1
false	5	5	5	50	5.5	50.5	25	01/03/09	5	2009-01-03T07:25:01	2009	1
false	5	5	5	50	5.5	50.5	5	01/01/09	5	2009-01-01T07:05:00.100	2009	1
false	7	7	7	70	7.7	70.7	17	01/02/09	7	2009-01-02T07:17:00.660	2009	1
false	7	7	7	70	7.7	70.7	27	01/03/09	7	2009-01-03T07:27:01.110	2009	1
false	7	7	7	70	7.7	70.7	7	01/01/09	7	2009-01-01T07:07:00.210	2009	1
false	9	9	9	90	9.9	90.89999999999999	19	01/02/09	9	2009-01-02T07:19:00.810	2009	1
false	9	9	9	90	9.9	90.89999999999999	29	01/03/09	9	2009-01-03T07:29:01.260	2009	1
false	9	9	9	90	9.9	90.89999999999999	9	01/01/09	9	2009-01-01T07:09:00.360	2009	1
true	0	0	0	0	0.0	0	0	01/01/09	0	2009-01-01T07:00	2009	1
true	0	0	0	0	0.0	0	10	01/02/09	0	2009-01-02T07:10:00.450	2009	1
true	0	0	0	0	0.0	0	20	01/03/09	0	2009-01-03T07:20:00.900	2009	1
true	2	2	2	20	2.2	20.2	12	01/02/09	2	2009-01-02T07:12:00.460	2009	1
true	2	2	2	20	2.2	20.2	2	01/01/09	2	2009-01-01T07:02:00.100	2009	1
true	2	2	2	20	2.2	20.2	22	01/03/09	2	2009-01-03T07:22:00.910	2009	1
true	2	2	2	20	2.2	20.2	7272	12/29/10	2	2010-12-29T11:42:12.610	2010	12
true	2	2	2	20	2.2	20.2	7282	12/30/10	2	2010-12-30T11:52:13.600	2010	12
true	2	2	2	20	2.2	20.2	7292	12/31/10	2	2010-12-31T12:02:13.510	2010	12
true	4	4	4	40	4.4	40.4	14	01/02/09	4	2009-01-02T07:14:00.510	2009	1
true	4	4	4	40	4.4	40.4	24	01/03/09	4	2009-01-03T07:24:00.960	2009	1
true	4	4	4	40	4.4	40.4	4	01/01/09	4	2009-01-01T07:04:00.600	2009	1
true	6	6	6	60	6.6	60.59999999999999	16	01/02/09	6	2009-01-02T07:16:00.600	2009	1
true	6	6	6	60	6.6	60.59999999999999	26	01/03/09	6	2009-01-03T07:26:01.500	2009	1
true	6	6	6	60	6.6	60.59999999999999	6	01/01/09	6	2009-01-01T07:06:00.150	2009	1
true	8	8	8	80	8.8	80.8	18	01/02/09	8	2009-01-02T07:18:00.730	2009	1
true	8	8	8	80	8.8	80.8	28	01/03/09	8	2009-01-03T07:28:01.180	2009	1
true	8	8	8	80	8.8	80.8	8	01/01/09	8	2009-01-01T07:08:00.280	2009	1

-- !q2 --
false	1	1	1	10	1.1	10.1	2301	08/19/09	1	2009-08-19T09:01:08.100	2009	8
false	1	1	1	10	1.1	10.1	2311	08/20/09	1	2009-08-20T09:11:08.550	2009	8
false	1	1	1	10	1.1	10.1	2321	08/21/09	1	2009-08-21T09:21:09	2009	8
false	1	1	1	10	1.1	10.1	2331	08/22/09	1	2009-08-22T09:31:09.450	2009	8
false	1	1	1	10	1.1	10.1	2341	08/23/09	1	2009-08-23T09:41:09.900	2009	8
false	1	1	1	10	1.1	10.1	2351	08/24/09	1	2009-08-24T09:51:10.350	2009	8
false	1	1	1	10	1.1	10.1	2361	08/25/09	1	2009-08-25T10:01:10.800	2009	8
false	1	1	1	10	1.1	10.1	2371	08/26/09	1	2009-08-26T10:11:11.250	2009	8
false	1	1	1	10	1.1	10.1	2381	08/27/09	1	2009-08-27T10:21:11.700	2009	8
false	1	1	1	10	1.1	10.1	2391	08/28/09	1	2009-08-28T10:31:12.150	2009	8
false	1	1	1	10	1.1	10.1	2401	08/29/09	1	2009-08-29T10:41:12.600	2009	8
false	1	1	1	10	1.1	10.1	2411	08/30/09	1	2009-08-30T10:51:13.500	2009	8
false	1	1	1	10	1.1	10.1	2421	08/31/09	1	2009-08-31T11:01:13.500	2009	8
false	1	1	1	10	1.1	10.1	2431	09/01/09	1	2009-09-01T06:01	2009	9
false	1	1	1	10	1.1	10.1	2441	09/02/09	1	2009-09-02T06:11:00.450	2009	9
false	1	1	1	10	1.1	10.1	2451	09/03/09	1	2009-09-03T06:21:00.900	2009	9
false	1	1	1	10	1.1	10.1	2461	09/04/09	1	2009-09-04T06:31:01.350	2009	9
false	1	1	1	10	1.1	10.1	2471	09/05/09	1	2009-09-05T06:41:01.800	2009	9
false	1	1	1	10	1.1	10.1	2481	09/06/09	1	2009-09-06T06:51:02.250	2009	9
false	1	1	1	10	1.1	10.1	2491	09/07/09	1	2009-09-07T07:01:02.700	2009	9
false	1	1	1	10	1.1	10.1	2501	09/08/09	1	2009-09-08T07:11:03.150	2009	9
false	1	1	1	10	1.1	10.1	2511	09/09/09	1	2009-09-09T07:21:03.600	2009	9
false	1	1	1	10	1.1	10.1	2521	09/10/09	1	2009-09-10T07:31:04.500	2009	9
false	1	1	1	10	1.1	10.1	2531	09/11/09	1	2009-09-11T07:41:04.500	2009	9
false	1	1	1	10	1.1	10.1	2541	09/12/09	1	2009-09-12T07:51:04.950	2009	9
false	1	1	1	10	1.1	10.1	2551	09/13/09	1	2009-09-13T08:01:05.400	2009	9
false	1	1	1	10	1.1	10.1	2561	09/14/09	1	2009-09-14T08:11:05.850	2009	9
false	1	1	1	10	1.1	10.1	2571	09/15/09	1	2009-09-15T08:21:06.300	2009	9
false	1	1	1	10	1.1	10.1	2581	09/16/09	1	2009-09-16T08:31:06.750	2009	9
false	1	1	1	10	1.1	10.1	2591	09/17/09	1	2009-09-17T08:41:07.200	2009	9
false	1	1	1	10	1.1	10.1	2601	09/18/09	1	2009-09-18T08:51:07.650	2009	9
false	1	1	1	10	1.1	10.1	2611	09/19/09	1	2009-09-19T09:01:08.100	2009	9
false	1	1	1	10	1.1	10.1	2621	09/20/09	1	2009-09-20T09:11:08.550	2009	9
false	1	1	1	10	1.1	10.1	2631	09/21/09	1	2009-09-21T09:21:09	2009	9
false	1	1	1	10	1.1	10.1	2641	09/22/09	1	2009-09-22T09:31:09.450	2009	9
false	1	1	1	10	1.1	10.1	2651	09/23/09	1	2009-09-23T09:41:09.900	2009	9
false	1	1	1	10	1.1	10.1	2661	09/24/09	1	2009-09-24T09:51:10.350	2009	9
false	1	1	1	10	1.1	10.1	2671	09/25/09	1	2009-09-25T10:01:10.800	2009	9
false	1	1	1	10	1.1	10.1	2681	09/26/09	1	2009-09-26T10:11:11.250	2009	9
false	1	1	1	10	1.1	10.1	2691	09/27/09	1	2009-09-27T10:21:11.700	2009	9
false	1	1	1	10	1.1	10.1	2701	09/28/09	1	2009-09-28T10:31:12.150	2009	9
false	1	1	1	10	1.1	10.1	2711	09/29/09	1	2009-09-29T10:41:12.600	2009	9
false	1	1	1	10	1.1	10.1	2721	09/30/09	1	2009-09-30T10:51:13.500	2009	9
false	1	1	1	10	1.1	10.1	2731	10/01/09	1	2009-10-01T06:01	2009	10
false	1	1	1	10	1.1	10.1	2741	10/02/09	1	2009-10-02T06:11:00.450	2009	10
false	1	1	1	10	1.1	10.1	2751	10/03/09	1	2009-10-03T06:21:00.900	2009	10
false	1	1	1	10	1.1	10.1	2761	10/04/09	1	2009-10-04T06:31:01.350	2009	10
false	1	1	1	10	1.1	10.1	2771	10/05/09	1	2009-10-05T06:41:01.800	2009	10
false	1	1	1	10	1.1	10.1	2781	10/06/09	1	2009-10-06T06:51:02.250	2009	10
false	1	1	1	10	1.1	10.1	2791	10/07/09	1	2009-10-07T07:01:02.700	2009	10
false	1	1	1	10	1.1	10.1	2801	10/08/09	1	2009-10-08T07:11:03.150	2009	10
false	1	1	1	10	1.1	10.1	2811	10/09/09	1	2009-10-09T07:21:03.600	2009	10
false	1	1	1	10	1.1	10.1	2821	10/10/09	1	2009-10-10T07:31:04.500	2009	10
false	1	1	1	10	1.1	10.1	2831	10/11/09	1	2009-10-11T07:41:04.500	2009	10
false	1	1	1	10	1.1	10.1	2841	10/12/09	1	2009-10-12T07:51:04.950	2009	10
false	1	1	1	10	1.1	10.1	2851	10/13/09	1	2009-10-13T08:01:05.400	2009	10
false	1	1	1	10	1.1	10.1	2861	10/14/09	1	2009-10-14T08:11:05.850	2009	10
false	1	1	1	10	1.1	10.1	2871	10/15/09	1	2009-10-15T08:21:06.300	2009	10
false	1	1	1	10	1.1	10.1	2881	10/16/09	1	2009-10-16T08:31:06.750	2009	10
false	1	1	1	10	1.1	10.1	2891	10/17/09	1	2009-10-17T08:41:07.200	2009	10
false	1	1	1	10	1.1	10.1	2901	10/18/09	1	2009-10-18T08:51:07.650	2009	10
false	1	1	1	10	1.1	10.1	2911	10/19/09	1	2009-10-19T09:01:08.100	2009	10
false	1	1	1	10	1.1	10.1	2921	10/20/09	1	2009-10-20T09:11:08.550	2009	10
false	1	1	1	10	1.1	10.1	2931	10/21/09	1	2009-10-21T09:21:09	2009	10
false	1	1	1	10	1.1	10.1	2941	10/22/09	1	2009-10-22T09:31:09.450	2009	10
false	1	1	1	10	1.1	10.1	2951	10/23/09	1	2009-10-23T09:41:09.900	2009	10
false	1	1	1	10	1.1	10.1	2961	10/24/09	1	2009-10-24T09:51:10.350	2009	10
false	1	1	1	10	1.1	10.1	2971	10/25/09	1	2009-10-25T11:01:10.800	2009	10
false	1	1	1	10	1.1	10.1	2981	10/26/09	1	2009-10-26T11:11:11.250	2009	10
false	1	1	1	10	1.1	10.1	2991	10/27/09	1	2009-10-27T11:21:11.700	2009	10
false	1	1	1	10	1.1	10.1	3001	10/28/09	1	2009-10-28T11:31:12.150	2009	10
false	1	1	1	10	1.1	10.1	3011	10/29/09	1	2009-10-29T11:41:12.600	2009	10
false	1	1	1	10	1.1	10.1	3021	10/30/09	1	2009-10-30T11:51:13.500	2009	10
false	1	1	1	10	1.1	10.1	3031	10/31/09	1	2009-10-31T12:01:13.500	2009	10
false	1	1	1	10	1.1	10.1	3041	11/01/09	1	2009-11-01T07:01	2009	11
false	1	1	1	10	1.1	10.1	3051	11/02/09	1	2009-11-02T07:11:00.450	2009	11
false	1	1	1	10	1.1	10.1	3061	11/03/09	1	2009-11-03T07:21:00.900	2009	11
false	1	1	1	10	1.1	10.1	3071	11/04/09	1	2009-11-04T07:31:01.350	2009	11
false	1	1	1	10	1.1	10.1	3081	11/05/09	1	2009-11-05T07:41:01.800	2009	11
false	1	1	1	10	1.1	10.1	3091	11/06/09	1	2009-11-06T07:51:02.250	2009	11
false	1	1	1	10	1.1	10.1	3101	11/07/09	1	2009-11-07T08:01:02.700	2009	11
false	1	1	1	10	1.1	10.1	3111	11/08/09	1	2009-11-08T08:11:03.150	2009	11
false	1	1	1	10	1.1	10.1	3121	11/09/09	1	2009-11-09T08:21:03.600	2009	11
false	1	1	1	10	1.1	10.1	3131	11/10/09	1	2009-11-10T08:31:04.500	2009	11
false	1	1	1	10	1.1	10.1	3141	11/11/09	1	2009-11-11T08:41:04.500	2009	11
false	1	1	1	10	1.1	10.1	3151	11/12/09	1	2009-11-12T08:51:04.950	2009	11
false	1	1	1	10	1.1	10.1	3161	11/13/09	1	2009-11-13T09:01:05.400	2009	11
false	1	1	1	10	1.1	10.1	3171	11/14/09	1	2009-11-14T09:11:05.850	2009	11
false	1	1	1	10	1.1	10.1	3181	11/15/09	1	2009-11-15T09:21:06.300	2009	11
false	1	1	1	10	1.1	10.1	3191	11/16/09	1	2009-11-16T09:31:06.750	2009	11
false	1	1	1	10	1.1	10.1	3201	11/17/09	1	2009-11-17T09:41:07.200	2009	11
false	1	1	1	10	1.1	10.1	3211	11/18/09	1	2009-11-18T09:51:07.650	2009	11
false	1	1	1	10	1.1	10.1	3221	11/19/09	1	2009-11-19T10:01:08.100	2009	11
false	1	1	1	10	1.1	10.1	3231	11/20/09	1	2009-11-20T10:11:08.550	2009	11
false	1	1	1	10	1.1	10.1	3241	11/21/09	1	2009-11-21T10:21:09	2009	11
false	1	1	1	10	1.1	10.1	3251	11/22/09	1	2009-11-22T10:31:09.450	2009	11
false	1	1	1	10	1.1	10.1	3261	11/23/09	1	2009-11-23T10:41:09.900	2009	11
false	1	1	1	10	1.1	10.1	3271	11/24/09	1	2009-11-24T10:51:10.350	2009	11
false	1	1	1	10	1.1	10.1	3281	11/25/09	1	2009-11-25T11:01:10.800	2009	11
false	1	1	1	10	1.1	10.1	3291	11/26/09	1	2009-11-26T11:11:11.250	2009	11
false	1	1	1	10	1.1	10.1	3301	11/27/09	1	2009-11-27T11:21:11.700	2009	11
false	1	1	1	10	1.1	10.1	3311	11/28/09	1	2009-11-28T11:31:12.150	2009	11
false	1	1	1	10	1.1	10.1	3321	11/29/09	1	2009-11-29T11:41:12.600	2009	11
false	1	1	1	10	1.1	10.1	3331	11/30/09	1	2009-11-30T11:51:13.500	2009	11
false	1	1	1	10	1.1	10.1	3341	12/01/09	1	2009-12-01T07:01	2009	12
false	1	1	1	10	1.1	10.1	3351	12/02/09	1	2009-12-02T07:11:00.450	2009	12
false	1	1	1	10	1.1	10.1	3361	12/03/09	1	2009-12-03T07:21:00.900	2009	12
false	1	1	1	10	1.1	10.1	3371	12/04/09	1	2009-12-04T07:31:01.350	2009	12
false	1	1	1	10	1.1	10.1	3381	12/05/09	1	2009-12-05T07:41:01.800	2009	12
false	1	1	1	10	1.1	10.1	3391	12/06/09	1	2009-12-06T07:51:02.250	2009	12
false	1	1	1	10	1.1	10.1	3401	12/07/09	1	2009-12-07T08:01:02.700	2009	12
false	1	1	1	10	1.1	10.1	3411	12/08/09	1	2009-12-08T08:11:03.150	2009	12
false	1	1	1	10	1.1	10.1	3421	12/09/09	1	2009-12-09T08:21:03.600	2009	12
false	1	1	1	10	1.1	10.1	3431	12/10/09	1	2009-12-10T08:31:04.500	2009	12
false	1	1	1	10	1.1	10.1	3441	12/11/09	1	2009-12-11T08:41:04.500	2009	12
false	1	1	1	10	1.1	10.1	3451	12/12/09	1	2009-12-12T08:51:04.950	2009	12
false	1	1	1	10	1.1	10.1	3461	12/13/09	1	2009-12-13T09:01:05.400	2009	12
false	1	1	1	10	1.1	10.1	3471	12/14/09	1	2009-12-14T09:11:05.850	2009	12
false	1	1	1	10	1.1	10.1	3481	12/15/09	1	2009-12-15T09:21:06.300	2009	12
false	1	1	1	10	1.1	10.1	3491	12/16/09	1	2009-12-16T09:31:06.750	2009	12
false	1	1	1	10	1.1	10.1	3501	12/17/09	1	2009-12-17T09:41:07.200	2009	12
false	1	1	1	10	1.1	10.1	3511	12/18/09	1	2009-12-18T09:51:07.650	2009	12
false	1	1	1	10	1.1	10.1	3521	12/19/09	1	2009-12-19T10:01:08.100	2009	12
false	1	1	1	10	1.1	10.1	3531	12/20/09	1	2009-12-20T10:11:08.550	2009	12
false	1	1	1	10	1.1	10.1	3541	12/21/09	1	2009-12-21T10:21:09	2009	12
false	1	1	1	10	1.1	10.1	3551	12/22/09	1	2009-12-22T10:31:09.450	2009	12
false	1	1	1	10	1.1	10.1	3561	12/23/09	1	2009-12-23T10:41:09.900	2009	12
false	1	1	1	10	1.1	10.1	3571	12/24/09	1	2009-12-24T10:51:10.350	2009	12
false	1	1	1	10	1.1	10.1	3581	12/25/09	1	2009-12-25T11:01:10.800	2009	12
false	1	1	1	10	1.1	10.1	3591	12/26/09	1	2009-12-26T11:11:11.250	2009	12
false	1	1	1	10	1.1	10.1	3601	12/27/09	1	2009-12-27T11:21:11.700	2009	12
false	1	1	1	10	1.1	10.1	3611	12/28/09	1	2009-12-28T11:31:12.150	2009	12
false	1	1	1	10	1.1	10.1	3621	12/29/09	1	2009-12-29T11:41:12.600	2009	12
false	1	1	1	10	1.1	10.1	3631	12/30/09	1	2009-12-30T11:51:13.500	2009	12
false	1	1	1	10	1.1	10.1	3641	12/31/09	1	2009-12-31T12:01:13.500	2009	12
false	1	1	1	10	1.1	10.1	3651	01/01/10	1	2010-01-01T07:01	2010	1
false	1	1	1	10	1.1	10.1	3661	01/02/10	1	2010-01-02T07:11:00.450	2010	1
false	1	1	1	10	1.1	10.1	3671	01/03/10	1	2010-01-03T07:21:00.900	2010	1
false	1	1	1	10	1.1	10.1	3681	01/04/10	1	2010-01-04T07:31:01.350	2010	1
false	1	1	1	10	1.1	10.1	3691	01/05/10	1	2010-01-05T07:41:01.800	2010	1
false	1	1	1	10	1.1	10.1	3701	01/06/10	1	2010-01-06T07:51:02.250	2010	1
false	1	1	1	10	1.1	10.1	3711	01/07/10	1	2010-01-07T08:01:02.700	2010	1
false	1	1	1	10	1.1	10.1	3721	01/08/10	1	2010-01-08T08:11:03.150	2010	1
false	1	1	1	10	1.1	10.1	3731	01/09/10	1	2010-01-09T08:21:03.600	2010	1
false	1	1	1	10	1.1	10.1	3741	01/10/10	1	2010-01-10T08:31:04.500	2010	1
false	1	1	1	10	1.1	10.1	3751	01/11/10	1	2010-01-11T08:41:04.500	2010	1
false	1	1	1	10	1.1	10.1	3761	01/12/10	1	2010-01-12T08:51:04.950	2010	1
false	1	1	1	10	1.1	10.1	3771	01/13/10	1	2010-01-13T09:01:05.400	2010	1
false	1	1	1	10	1.1	10.1	3781	01/14/10	1	2010-01-14T09:11:05.850	2010	1
false	1	1	1	10	1.1	10.1	3791	01/15/10	1	2010-01-15T09:21:06.300	2010	1
false	1	1	1	10	1.1	10.1	3801	01/16/10	1	2010-01-16T09:31:06.750	2010	1
false	1	1	1	10	1.1	10.1	3811	01/17/10	1	2010-01-17T09:41:07.200	2010	1
false	1	1	1	10	1.1	10.1	3821	01/18/10	1	2010-01-18T09:51:07.650	2010	1
false	1	1	1	10	1.1	10.1	3831	01/19/10	1	2010-01-19T10:01:08.100	2010	1
false	1	1	1	10	1.1	10.1	3841	01/20/10	1	2010-01-20T10:11:08.550	2010	1
false	1	1	1	10	1.1	10.1	3851	01/21/10	1	2010-01-21T10:21:09	2010	1
false	1	1	1	10	1.1	10.1	3861	01/22/10	1	2010-01-22T10:31:09.450	2010	1
false	1	1	1	10	1.1	10.1	3871	01/23/10	1	2010-01-23T10:41:09.900	2010	1
false	1	1	1	10	1.1	10.1	3881	01/24/10	1	2010-01-24T10:51:10.350	2010	1
false	1	1	1	10	1.1	10.1	3891	01/25/10	1	2010-01-25T11:01:10.800	2010	1
false	1	1	1	10	1.1	10.1	3901	01/26/10	1	2010-01-26T11:11:11.250	2010	1
false	1	1	1	10	1.1	10.1	3911	01/27/10	1	2010-01-27T11:21:11.700	2010	1
false	1	1	1	10	1.1	10.1	3921	01/28/10	1	2010-01-28T11:31:12.150	2010	1
false	1	1	1	10	1.1	10.1	3931	01/29/10	1	2010-01-29T11:41:12.600	2010	1
false	1	1	1	10	1.1	10.1	3941	01/30/10	1	2010-01-30T11:51:13.500	2010	1
false	1	1	1	10	1.1	10.1	3951	01/31/10	1	2010-01-31T12:01:13.500	2010	1
false	1	1	1	10	1.1	10.1	3961	02/01/10	1	2010-02-01T07:01	2010	2
false	1	1	1	10	1.1	10.1	3971	02/02/10	1	2010-02-02T07:11:00.450	2010	2
false	1	1	1	10	1.1	10.1	3981	02/03/10	1	2010-02-03T07:21:00.900	2010	2
false	1	1	1	10	1.1	10.1	3991	02/04/10	1	2010-02-04T07:31:01.350	2010	2
false	1	1	1	10	1.1	10.1	4001	02/05/10	1	2010-02-05T07:41:01.800	2010	2
false	1	1	1	10	1.1	10.1	4011	02/06/10	1	2010-02-06T07:51:02.250	2010	2
false	1	1	1	10	1.1	10.1	4021	02/07/10	1	2010-02-07T08:01:02.700	2010	2
false	1	1	1	10	1.1	10.1	4031	02/08/10	1	2010-02-08T08:11:03.150	2010	2
false	1	1	1	10	1.1	10.1	4041	02/09/10	1	2010-02-09T08:21:03.600	2010	2
false	1	1	1	10	1.1	10.1	4051	02/10/10	1	2010-02-10T08:31:04.500	2010	2
false	1	1	1	10	1.1	10.1	4061	02/11/10	1	2010-02-11T08:41:04.500	2010	2
false	1	1	1	10	1.1	10.1	4071	02/12/10	1	2010-02-12T08:51:04.950	2010	2
false	1	1	1	10	1.1	10.1	4081	02/13/10	1	2010-02-13T09:01:05.400	2010	2
false	1	1	1	10	1.1	10.1	4091	02/14/10	1	2010-02-14T09:11:05.850	2010	2
false	1	1	1	10	1.1	10.1	4101	02/15/10	1	2010-02-15T09:21:06.300	2010	2
false	1	1	1	10	1.1	10.1	4111	02/16/10	1	2010-02-16T09:31:06.750	2010	2
false	1	1	1	10	1.1	10.1	4121	02/17/10	1	2010-02-17T09:41:07.200	2010	2
false	1	1	1	10	1.1	10.1	4131	02/18/10	1	2010-02-18T09:51:07.650	2010	2
false	1	1	1	10	1.1	10.1	4141	02/19/10	1	2010-02-19T10:01:08.100	2010	2
false	1	1	1	10	1.1	10.1	4151	02/20/10	1	2010-02-20T10:11:08.550	2010	2
false	1	1	1	10	1.1	10.1	4161	02/21/10	1	2010-02-21T10:21:09	2010	2
false	1	1	1	10	1.1	10.1	4171	02/22/10	1	2010-02-22T10:31:09.450	2010	2
false	1	1	1	10	1.1	10.1	4181	02/23/10	1	2010-02-23T10:41:09.900	2010	2
false	1	1	1	10	1.1	10.1	4191	02/24/10	1	2010-02-24T10:51:10.350	2010	2
false	1	1	1	10	1.1	10.1	4201	02/25/10	1	2010-02-25T11:01:10.800	2010	2
false	1	1	1	10	1.1	10.1	4211	02/26/10	1	2010-02-26T11:11:11.250	2010	2
false	1	1	1	10	1.1	10.1	4221	02/27/10	1	2010-02-27T11:21:11.700	2010	2
false	1	1	1	10	1.1	10.1	4231	02/28/10	1	2010-02-28T11:31:12.150	2010	2
false	1	1	1	10	1.1	10.1	4241	03/01/10	1	2010-03-01T07:01	2010	3
false	1	1	1	10	1.1	10.1	4251	03/02/10	1	2010-03-02T07:11:00.450	2010	3
false	1	1	1	10	1.1	10.1	4261	03/03/10	1	2010-03-03T07:21:00.900	2010	3
false	1	1	1	10	1.1	10.1	4271	03/04/10	1	2010-03-04T07:31:01.350	2010	3
false	1	1	1	10	1.1	10.1	4281	03/05/10	1	2010-03-05T07:41:01.800	2010	3
false	1	1	1	10	1.1	10.1	4291	03/06/10	1	2010-03-06T07:51:02.250	2010	3
false	1	1	1	10	1.1	10.1	4301	03/07/10	1	2010-03-07T08:01:02.700	2010	3
false	1	1	1	10	1.1	10.1	4311	03/08/10	1	2010-03-08T08:11:03.150	2010	3
false	1	1	1	10	1.1	10.1	4321	03/09/10	1	2010-03-09T08:21:03.600	2010	3
false	1	1	1	10	1.1	10.1	4331	03/10/10	1	2010-03-10T08:31:04.500	2010	3
false	1	1	1	10	1.1	10.1	4341	03/11/10	1	2010-03-11T08:41:04.500	2010	3
false	1	1	1	10	1.1	10.1	4351	03/12/10	1	2010-03-12T08:51:04.950	2010	3
false	1	1	1	10	1.1	10.1	4361	03/13/10	1	2010-03-13T09:01:05.400	2010	3
false	1	1	1	10	1.1	10.1	4371	03/14/10	1	2010-03-14T08:11:05.850	2010	3
false	1	1	1	10	1.1	10.1	4381	03/15/10	1	2010-03-15T08:21:06.300	2010	3
false	1	1	1	10	1.1	10.1	4391	03/16/10	1	2010-03-16T08:31:06.750	2010	3
false	1	1	1	10	1.1	10.1	4401	03/17/10	1	2010-03-17T08:41:07.200	2010	3
false	1	1	1	10	1.1	10.1	4411	03/18/10	1	2010-03-18T08:51:07.650	2010	3
false	1	1	1	10	1.1	10.1	4421	03/19/10	1	2010-03-19T09:01:08.100	2010	3
false	1	1	1	10	1.1	10.1	4431	03/20/10	1	2010-03-20T09:11:08.550	2010	3
false	1	1	1	10	1.1	10.1	4441	03/21/10	1	2010-03-21T09:21:09	2010	3
false	1	1	1	10	1.1	10.1	4451	03/22/10	1	2010-03-22T09:31:09.450	2010	3
false	1	1	1	10	1.1	10.1	4461	03/23/10	1	2010-03-23T09:41:09.900	2010	3
false	1	1	1	10	1.1	10.1	4471	03/24/10	1	2010-03-24T09:51:10.350	2010	3
false	1	1	1	10	1.1	10.1	4481	03/25/10	1	2010-03-25T10:01:10.800	2010	3
false	1	1	1	10	1.1	10.1	4491	03/26/10	1	2010-03-26T10:11:11.250	2010	3
false	1	1	1	10	1.1	10.1	4501	03/27/10	1	2010-03-27T10:21:11.700	2010	3
false	1	1	1	10	1.1	10.1	4511	03/28/10	1	2010-03-28T09:31:12.150	2010	3
false	1	1	1	10	1.1	10.1	4521	03/29/10	1	2010-03-29T09:41:12.600	2010	3
false	1	1	1	10	1.1	10.1	4531	03/30/10	1	2010-03-30T09:51:13.500	2010	3
false	1	1	1	10	1.1	10.1	4541	03/31/10	1	2010-03-31T10:01:13.500	2010	3
false	1	1	1	10	1.1	10.1	4551	04/01/10	1	2010-04-01T06:01	2010	4
false	1	1	1	10	1.1	10.1	4561	04/02/10	1	2010-04-02T06:11:00.450	2010	4
false	1	1	1	10	1.1	10.1	4571	04/03/10	1	2010-04-03T06:21:00.900	2010	4
false	1	1	1	10	1.1	10.1	4581	04/04/10	1	2010-04-04T06:31:01.350	2010	4
false	1	1	1	10	1.1	10.1	4591	04/05/10	1	2010-04-05T06:41:01.800	2010	4
false	1	1	1	10	1.1	10.1	4601	04/06/10	1	2010-04-06T06:51:02.250	2010	4
false	1	1	1	10	1.1	10.1	4611	04/07/10	1	2010-04-07T07:01:02.700	2010	4
false	1	1	1	10	1.1	10.1	4621	04/08/10	1	2010-04-08T07:11:03.150	2010	4
false	1	1	1	10	1.1	10.1	4631	04/09/10	1	2010-04-09T07:21:03.600	2010	4
false	1	1	1	10	1.1	10.1	4641	04/10/10	1	2010-04-10T07:31:04.500	2010	4
false	1	1	1	10	1.1	10.1	4651	04/11/10	1	2010-04-11T07:41:04.500	2010	4
false	1	1	1	10	1.1	10.1	4661	04/12/10	1	2010-04-12T07:51:04.950	2010	4
false	1	1	1	10	1.1	10.1	4671	04/13/10	1	2010-04-13T08:01:05.400	2010	4
false	1	1	1	10	1.1	10.1	4681	04/14/10	1	2010-04-14T08:11:05.850	2010	4
false	1	1	1	10	1.1	10.1	4691	04/15/10	1	2010-04-15T08:21:06.300	2010	4
false	1	1	1	10	1.1	10.1	4701	04/16/10	1	2010-04-16T08:31:06.750	2010	4
false	1	1	1	10	1.1	10.1	4711	04/17/10	1	2010-04-17T08:41:07.200	2010	4
false	1	1	1	10	1.1	10.1	4721	04/18/10	1	2010-04-18T08:51:07.650	2010	4
false	1	1	1	10	1.1	10.1	4731	04/19/10	1	2010-04-19T09:01:08.100	2010	4
false	1	1	1	10	1.1	10.1	4741	04/20/10	1	2010-04-20T09:11:08.550	2010	4
false	1	1	1	10	1.1	10.1	4751	04/21/10	1	2010-04-21T09:21:09	2010	4
false	1	1	1	10	1.1	10.1	4761	04/22/10	1	2010-04-22T09:31:09.450	2010	4
false	1	1	1	10	1.1	10.1	4771	04/23/10	1	2010-04-23T09:41:09.900	2010	4
false	1	1	1	10	1.1	10.1	4781	04/24/10	1	2010-04-24T09:51:10.350	2010	4
false	1	1	1	10	1.1	10.1	4791	04/25/10	1	2010-04-25T10:01:10.800	2010	4
false	1	1	1	10	1.1	10.1	4801	04/26/10	1	2010-04-26T10:11:11.250	2010	4
false	1	1	1	10	1.1	10.1	4811	04/27/10	1	2010-04-27T10:21:11.700	2010	4
false	1	1	1	10	1.1	10.1	4821	04/28/10	1	2010-04-28T10:31:12.150	2010	4
false	1	1	1	10	1.1	10.1	4831	04/29/10	1	2010-04-29T10:41:12.600	2010	4
false	1	1	1	10	1.1	10.1	4841	04/30/10	1	2010-04-30T10:51:13.500	2010	4
false	1	1	1	10	1.1	10.1	4851	05/01/10	1	2010-05-01T06:01	2010	5
false	1	1	1	10	1.1	10.1	4861	05/02/10	1	2010-05-02T06:11:00.450	2010	5
false	1	1	1	10	1.1	10.1	4871	05/03/10	1	2010-05-03T06:21:00.900	2010	5
false	1	1	1	10	1.1	10.1	4881	05/04/10	1	2010-05-04T06:31:01.350	2010	5
false	1	1	1	10	1.1	10.1	4891	05/05/10	1	2010-05-05T06:41:01.800	2010	5
false	1	1	1	10	1.1	10.1	4901	05/06/10	1	2010-05-06T06:51:02.250	2010	5
false	1	1	1	10	1.1	10.1	4911	05/07/10	1	2010-05-07T07:01:02.700	2010	5
false	1	1	1	10	1.1	10.1	4921	05/08/10	1	2010-05-08T07:11:03.150	2010	5
false	1	1	1	10	1.1	10.1	4931	05/09/10	1	2010-05-09T07:21:03.600	2010	5
false	1	1	1	10	1.1	10.1	4941	05/10/10	1	2010-05-10T07:31:04.500	2010	5
false	1	1	1	10	1.1	10.1	4951	05/11/10	1	2010-05-11T07:41:04.500	2010	5
false	1	1	1	10	1.1	10.1	4961	05/12/10	1	2010-05-12T07:51:04.950	2010	5
false	1	1	1	10	1.1	10.1	4971	05/13/10	1	2010-05-13T08:01:05.400	2010	5
false	1	1	1	10	1.1	10.1	4981	05/14/10	1	2010-05-14T08:11:05.850	2010	5
false	1	1	1	10	1.1	10.1	4991	05/15/10	1	2010-05-15T08:21:06.300	2010	5
false	1	1	1	10	1.1	10.1	5001	05/16/10	1	2010-05-16T08:31:06.750	2010	5
false	1	1	1	10	1.1	10.1	5011	05/17/10	1	2010-05-17T08:41:07.200	2010	5
false	1	1	1	10	1.1	10.1	5021	05/18/10	1	2010-05-18T08:51:07.650	2010	5
false	1	1	1	10	1.1	10.1	5031	05/19/10	1	2010-05-19T09:01:08.100	2010	5
false	1	1	1	10	1.1	10.1	5041	05/20/10	1	2010-05-20T09:11:08.550	2010	5
false	1	1	1	10	1.1	10.1	5051	05/21/10	1	2010-05-21T09:21:09	2010	5
false	1	1	1	10	1.1	10.1	5061	05/22/10	1	2010-05-22T09:31:09.450	2010	5
false	1	1	1	10	1.1	10.1	5071	05/23/10	1	2010-05-23T09:41:09.900	2010	5
false	1	1	1	10	1.1	10.1	5081	05/24/10	1	2010-05-24T09:51:10.350	2010	5
false	1	1	1	10	1.1	10.1	5091	05/25/10	1	2010-05-25T10:01:10.800	2010	5
false	1	1	1	10	1.1	10.1	5101	05/26/10	1	2010-05-26T10:11:11.250	2010	5
false	1	1	1	10	1.1	10.1	5111	05/27/10	1	2010-05-27T10:21:11.700	2010	5
false	1	1	1	10	1.1	10.1	5121	05/28/10	1	2010-05-28T10:31:12.150	2010	5
false	1	1	1	10	1.1	10.1	5131	05/29/10	1	2010-05-29T10:41:12.600	2010	5
false	1	1	1	10	1.1	10.1	5141	05/30/10	1	2010-05-30T10:51:13.500	2010	5
false	1	1	1	10	1.1	10.1	5151	05/31/10	1	2010-05-31T11:01:13.500	2010	5
false	1	1	1	10	1.1	10.1	5161	06/01/10	1	2010-06-01T06:01	2010	6
false	1	1	1	10	1.1	10.1	5171	06/02/10	1	2010-06-02T06:11:00.450	2010	6
false	1	1	1	10	1.1	10.1	5181	06/03/10	1	2010-06-03T06:21:00.900	2010	6
false	1	1	1	10	1.1	10.1	5191	06/04/10	1	2010-06-04T06:31:01.350	2010	6
false	1	1	1	10	1.1	10.1	5201	06/05/10	1	2010-06-05T06:41:01.800	2010	6
false	1	1	1	10	1.1	10.1	5211	06/06/10	1	2010-06-06T06:51:02.250	2010	6
false	1	1	1	10	1.1	10.1	5221	06/07/10	1	2010-06-07T07:01:02.700	2010	6
false	1	1	1	10	1.1	10.1	5231	06/08/10	1	2010-06-08T07:11:03.150	2010	6
false	1	1	1	10	1.1	10.1	5241	06/09/10	1	2010-06-09T07:21:03.600	2010	6
false	1	1	1	10	1.1	10.1	5251	06/10/10	1	2010-06-10T07:31:04.500	2010	6
false	1	1	1	10	1.1	10.1	5261	06/11/10	1	2010-06-11T07:41:04.500	2010	6
false	1	1	1	10	1.1	10.1	5271	06/12/10	1	2010-06-12T07:51:04.950	2010	6
false	1	1	1	10	1.1	10.1	5281	06/13/10	1	2010-06-13T08:01:05.400	2010	6
false	1	1	1	10	1.1	10.1	5291	06/14/10	1	2010-06-14T08:11:05.850	2010	6
false	1	1	1	10	1.1	10.1	5301	06/15/10	1	2010-06-15T08:21:06.300	2010	6
false	1	1	1	10	1.1	10.1	5311	06/16/10	1	2010-06-16T08:31:06.750	2010	6
false	1	1	1	10	1.1	10.1	5321	06/17/10	1	2010-06-17T08:41:07.200	2010	6
false	1	1	1	10	1.1	10.1	5331	06/18/10	1	2010-06-18T08:51:07.650	2010	6
false	1	1	1	10	1.1	10.1	5341	06/19/10	1	2010-06-19T09:01:08.100	2010	6
false	1	1	1	10	1.1	10.1	5351	06/20/10	1	2010-06-20T09:11:08.550	2010	6
false	1	1	1	10	1.1	10.1	5361	06/21/10	1	2010-06-21T09:21:09	2010	6
false	1	1	1	10	1.1	10.1	5371	06/22/10	1	2010-06-22T09:31:09.450	2010	6
false	1	1	1	10	1.1	10.1	5381	06/23/10	1	2010-06-23T09:41:09.900	2010	6
false	1	1	1	10	1.1	10.1	5391	06/24/10	1	2010-06-24T09:51:10.350	2010	6
false	1	1	1	10	1.1	10.1	5401	06/25/10	1	2010-06-25T10:01:10.800	2010	6
false	1	1	1	10	1.1	10.1	5411	06/26/10	1	2010-06-26T10:11:11.250	2010	6
false	1	1	1	10	1.1	10.1	5421	06/27/10	1	2010-06-27T10:21:11.700	2010	6
false	1	1	1	10	1.1	10.1	5431	06/28/10	1	2010-06-28T10:31:12.150	2010	6
false	1	1	1	10	1.1	10.1	5441	06/29/10	1	2010-06-29T10:41:12.600	2010	6
false	1	1	1	10	1.1	10.1	5451	06/30/10	1	2010-06-30T10:51:13.500	2010	6
false	1	1	1	10	1.1	10.1	5461	07/01/10	1	2010-07-01T06:01	2010	7
false	1	1	1	10	1.1	10.1	5471	07/02/10	1	2010-07-02T06:11:00.450	2010	7
false	1	1	1	10	1.1	10.1	5481	07/03/10	1	2010-07-03T06:21:00.900	2010	7
false	1	1	1	10	1.1	10.1	5491	07/04/10	1	2010-07-04T06:31:01.350	2010	7
false	1	1	1	10	1.1	10.1	5501	07/05/10	1	2010-07-05T06:41:01.800	2010	7
false	1	1	1	10	1.1	10.1	5511	07/06/10	1	2010-07-06T06:51:02.250	2010	7
false	1	1	1	10	1.1	10.1	5521	07/07/10	1	2010-07-07T07:01:02.700	2010	7
false	1	1	1	10	1.1	10.1	5531	07/08/10	1	2010-07-08T07:11:03.150	2010	7
false	1	1	1	10	1.1	10.1	5541	07/09/10	1	2010-07-09T07:21:03.600	2010	7
false	1	1	1	10	1.1	10.1	5551	07/10/10	1	2010-07-10T07:31:04.500	2010	7
false	1	1	1	10	1.1	10.1	5561	07/11/10	1	2010-07-11T07:41:04.500	2010	7
false	1	1	1	10	1.1	10.1	5571	07/12/10	1	2010-07-12T07:51:04.950	2010	7
false	1	1	1	10	1.1	10.1	5581	07/13/10	1	2010-07-13T08:01:05.400	2010	7
false	1	1	1	10	1.1	10.1	5591	07/14/10	1	2010-07-14T08:11:05.850	2010	7
false	1	1	1	10	1.1	10.1	5601	07/15/10	1	2010-07-15T08:21:06.300	2010	7
false	1	1	1	10	1.1	10.1	5611	07/16/10	1	2010-07-16T08:31:06.750	2010	7
false	1	1	1	10	1.1	10.1	5621	07/17/10	1	2010-07-17T08:41:07.200	2010	7
false	1	1	1	10	1.1	10.1	5631	07/18/10	1	2010-07-18T08:51:07.650	2010	7
false	1	1	1	10	1.1	10.1	5641	07/19/10	1	2010-07-19T09:01:08.100	2010	7
false	1	1	1	10	1.1	10.1	5651	07/20/10	1	2010-07-20T09:11:08.550	2010	7
false	1	1	1	10	1.1	10.1	5661	07/21/10	1	2010-07-21T09:21:09	2010	7
false	1	1	1	10	1.1	10.1	5671	07/22/10	1	2010-07-22T09:31:09.450	2010	7
false	1	1	1	10	1.1	10.1	5681	07/23/10	1	2010-07-23T09:41:09.900	2010	7
false	1	1	1	10	1.1	10.1	5691	07/24/10	1	2010-07-24T09:51:10.350	2010	7
false	1	1	1	10	1.1	10.1	5701	07/25/10	1	2010-07-25T10:01:10.800	2010	7
false	1	1	1	10	1.1	10.1	5711	07/26/10	1	2010-07-26T10:11:11.250	2010	7
false	1	1	1	10	1.1	10.1	5721	07/27/10	1	2010-07-27T10:21:11.700	2010	7
false	1	1	1	10	1.1	10.1	5731	07/28/10	1	2010-07-28T10:31:12.150	2010	7
false	1	1	1	10	1.1	10.1	5741	07/29/10	1	2010-07-29T10:41:12.600	2010	7
false	1	1	1	10	1.1	10.1	5751	07/30/10	1	2010-07-30T10:51:13.500	2010	7
false	1	1	1	10	1.1	10.1	5761	07/31/10	1	2010-07-31T11:01:13.500	2010	7
false	1	1	1	10	1.1	10.1	5771	08/01/10	1	2010-08-01T06:01	2010	8
false	1	1	1	10	1.1	10.1	5781	08/02/10	1	2010-08-02T06:11:00.450	2010	8
false	1	1	1	10	1.1	10.1	5791	08/03/10	1	2010-08-03T06:21:00.900	2010	8
false	1	1	1	10	1.1	10.1	5801	08/04/10	1	2010-08-04T06:31:01.350	2010	8
false	1	1	1	10	1.1	10.1	5811	08/05/10	1	2010-08-05T06:41:01.800	2010	8
false	1	1	1	10	1.1	10.1	5821	08/06/10	1	2010-08-06T06:51:02.250	2010	8
false	1	1	1	10	1.1	10.1	5831	08/07/10	1	2010-08-07T07:01:02.700	2010	8
false	1	1	1	10	1.1	10.1	5841	08/08/10	1	2010-08-08T07:11:03.150	2010	8
false	1	1	1	10	1.1	10.1	5851	08/09/10	1	2010-08-09T07:21:03.600	2010	8
false	1	1	1	10	1.1	10.1	5861	08/10/10	1	2010-08-10T07:31:04.500	2010	8
false	1	1	1	10	1.1	10.1	5871	08/11/10	1	2010-08-11T07:41:04.500	2010	8
false	1	1	1	10	1.1	10.1	5881	08/12/10	1	2010-08-12T07:51:04.950	2010	8
false	1	1	1	10	1.1	10.1	5891	08/13/10	1	2010-08-13T08:01:05.400	2010	8
false	1	1	1	10	1.1	10.1	5901	08/14/10	1	2010-08-14T08:11:05.850	2010	8
false	1	1	1	10	1.1	10.1	5911	08/15/10	1	2010-08-15T08:21:06.300	2010	8
false	1	1	1	10	1.1	10.1	5921	08/16/10	1	2010-08-16T08:31:06.750	2010	8
false	1	1	1	10	1.1	10.1	5931	08/17/10	1	2010-08-17T08:41:07.200	2010	8
false	1	1	1	10	1.1	10.1	5941	08/18/10	1	2010-08-18T08:51:07.650	2010	8
false	1	1	1	10	1.1	10.1	5951	08/19/10	1	2010-08-19T09:01:08.100	2010	8
false	1	1	1	10	1.1	10.1	5961	08/20/10	1	2010-08-20T09:11:08.550	2010	8
false	1	1	1	10	1.1	10.1	5971	08/21/10	1	2010-08-21T09:21:09	2010	8
false	1	1	1	10	1.1	10.1	5981	08/22/10	1	2010-08-22T09:31:09.450	2010	8
false	1	1	1	10	1.1	10.1	5991	08/23/10	1	2010-08-23T09:41:09.900	2010	8
false	1	1	1	10	1.1	10.1	6001	08/24/10	1	2010-08-24T09:51:10.350	2010	8
false	1	1	1	10	1.1	10.1	6011	08/25/10	1	2010-08-25T10:01:10.800	2010	8
false	1	1	1	10	1.1	10.1	6021	08/26/10	1	2010-08-26T10:11:11.250	2010	8
false	1	1	1	10	1.1	10.1	6031	08/27/10	1	2010-08-27T10:21:11.700	2010	8
false	1	1	1	10	1.1	10.1	6041	08/28/10	1	2010-08-28T10:31:12.150	2010	8
false	1	1	1	10	1.1	10.1	6051	08/29/10	1	2010-08-29T10:41:12.600	2010	8
false	1	1	1	10	1.1	10.1	6061	08/30/10	1	2010-08-30T10:51:13.500	2010	8
false	1	1	1	10	1.1	10.1	6071	08/31/10	1	2010-08-31T11:01:13.500	2010	8
false	1	1	1	10	1.1	10.1	6081	09/01/10	1	2010-09-01T06:01	2010	9
false	1	1	1	10	1.1	10.1	6091	09/02/10	1	2010-09-02T06:11:00.450	2010	9
false	1	1	1	10	1.1	10.1	6101	09/03/10	1	2010-09-03T06:21:00.900	2010	9
false	1	1	1	10	1.1	10.1	6111	09/04/10	1	2010-09-04T06:31:01.350	2010	9
false	1	1	1	10	1.1	10.1	6121	09/05/10	1	2010-09-05T06:41:01.800	2010	9
false	1	1	1	10	1.1	10.1	6131	09/06/10	1	2010-09-06T06:51:02.250	2010	9
false	1	1	1	10	1.1	10.1	6141	09/07/10	1	2010-09-07T07:01:02.700	2010	9
false	1	1	1	10	1.1	10.1	6151	09/08/10	1	2010-09-08T07:11:03.150	2010	9
false	1	1	1	10	1.1	10.1	6161	09/09/10	1	2010-09-09T07:21:03.600	2010	9
false	1	1	1	10	1.1	10.1	6171	09/10/10	1	2010-09-10T07:31:04.500	2010	9
false	1	1	1	10	1.1	10.1	6181	09/11/10	1	2010-09-11T07:41:04.500	2010	9
false	1	1	1	10	1.1	10.1	6191	09/12/10	1	2010-09-12T07:51:04.950	2010	9
false	1	1	1	10	1.1	10.1	6201	09/13/10	1	2010-09-13T08:01:05.400	2010	9
false	1	1	1	10	1.1	10.1	6211	09/14/10	1	2010-09-14T08:11:05.850	2010	9
false	1	1	1	10	1.1	10.1	6221	09/15/10	1	2010-09-15T08:21:06.300	2010	9
false	1	1	1	10	1.1	10.1	6231	09/16/10	1	2010-09-16T08:31:06.750	2010	9
false	1	1	1	10	1.1	10.1	6241	09/17/10	1	2010-09-17T08:41:07.200	2010	9
false	1	1	1	10	1.1	10.1	6251	09/18/10	1	2010-09-18T08:51:07.650	2010	9
false	1	1	1	10	1.1	10.1	6261	09/19/10	1	2010-09-19T09:01:08.100	2010	9
false	1	1	1	10	1.1	10.1	6271	09/20/10	1	2010-09-20T09:11:08.550	2010	9
false	1	1	1	10	1.1	10.1	6281	09/21/10	1	2010-09-21T09:21:09	2010	9
false	1	1	1	10	1.1	10.1	6291	09/22/10	1	2010-09-22T09:31:09.450	2010	9
false	1	1	1	10	1.1	10.1	6301	09/23/10	1	2010-09-23T09:41:09.900	2010	9
false	1	1	1	10	1.1	10.1	6311	09/24/10	1	2010-09-24T09:51:10.350	2010	9
false	1	1	1	10	1.1	10.1	6321	09/25/10	1	2010-09-25T10:01:10.800	2010	9
false	1	1	1	10	1.1	10.1	6331	09/26/10	1	2010-09-26T10:11:11.250	2010	9
false	1	1	1	10	1.1	10.1	6341	09/27/10	1	2010-09-27T10:21:11.700	2010	9
false	1	1	1	10	1.1	10.1	6351	09/28/10	1	2010-09-28T10:31:12.150	2010	9
false	1	1	1	10	1.1	10.1	6361	09/29/10	1	2010-09-29T10:41:12.600	2010	9
false	1	1	1	10	1.1	10.1	6371	09/30/10	1	2010-09-30T10:51:13.500	2010	9
false	1	1	1	10	1.1	10.1	6381	10/01/10	1	2010-10-01T06:01	2010	10
false	1	1	1	10	1.1	10.1	6391	10/02/10	1	2010-10-02T06:11:00.450	2010	10
false	1	1	1	10	1.1	10.1	6401	10/03/10	1	2010-10-03T06:21:00.900	2010	10
false	1	1	1	10	1.1	10.1	6411	10/04/10	1	2010-10-04T06:31:01.350	2010	10
false	1	1	1	10	1.1	10.1	6421	10/05/10	1	2010-10-05T06:41:01.800	2010	10
false	1	1	1	10	1.1	10.1	6431	10/06/10	1	2010-10-06T06:51:02.250	2010	10
false	1	1	1	10	1.1	10.1	6441	10/07/10	1	2010-10-07T07:01:02.700	2010	10
false	1	1	1	10	1.1	10.1	6451	10/08/10	1	2010-10-08T07:11:03.150	2010	10
false	1	1	1	10	1.1	10.1	6461	10/09/10	1	2010-10-09T07:21:03.600	2010	10
false	1	1	1	10	1.1	10.1	6471	10/10/10	1	2010-10-10T07:31:04.500	2010	10
false	1	1	1	10	1.1	10.1	6481	10/11/10	1	2010-10-11T07:41:04.500	2010	10
false	1	1	1	10	1.1	10.1	6491	10/12/10	1	2010-10-12T07:51:04.950	2010	10
false	1	1	1	10	1.1	10.1	6501	10/13/10	1	2010-10-13T08:01:05.400	2010	10
false	1	1	1	10	1.1	10.1	6511	10/14/10	1	2010-10-14T08:11:05.850	2010	10
false	1	1	1	10	1.1	10.1	6521	10/15/10	1	2010-10-15T08:21:06.300	2010	10
false	1	1	1	10	1.1	10.1	6531	10/16/10	1	2010-10-16T08:31:06.750	2010	10
false	1	1	1	10	1.1	10.1	6541	10/17/10	1	2010-10-17T08:41:07.200	2010	10
false	1	1	1	10	1.1	10.1	6551	10/18/10	1	2010-10-18T08:51:07.650	2010	10
false	1	1	1	10	1.1	10.1	6561	10/19/10	1	2010-10-19T09:01:08.100	2010	10
false	1	1	1	10	1.1	10.1	6571	10/20/10	1	2010-10-20T09:11:08.550	2010	10
false	1	1	1	10	1.1	10.1	6581	10/21/10	1	2010-10-21T09:21:09	2010	10
false	1	1	1	10	1.1	10.1	6591	10/22/10	1	2010-10-22T09:31:09.450	2010	10
false	1	1	1	10	1.1	10.1	6601	10/23/10	1	2010-10-23T09:41:09.900	2010	10
false	1	1	1	10	1.1	10.1	6611	10/24/10	1	2010-10-24T09:51:10.350	2010	10
false	1	1	1	10	1.1	10.1	6621	10/25/10	1	2010-10-25T10:01:10.800	2010	10
false	1	1	1	10	1.1	10.1	6631	10/26/10	1	2010-10-26T10:11:11.250	2010	10
false	1	1	1	10	1.1	10.1	6641	10/27/10	1	2010-10-27T10:21:11.700	2010	10
false	1	1	1	10	1.1	10.1	6651	10/28/10	1	2010-10-28T10:31:12.150	2010	10
false	1	1	1	10	1.1	10.1	6661	10/29/10	1	2010-10-29T10:41:12.600	2010	10
false	1	1	1	10	1.1	10.1	6671	10/30/10	1	2010-10-30T10:51:13.500	2010	10
false	1	1	1	10	1.1	10.1	6681	10/31/10	1	2010-10-31T12:01:13.500	2010	10
false	1	1	1	10	1.1	10.1	6691	11/01/10	1	2010-11-01T07:01	2010	11
false	1	1	1	10	1.1	10.1	6701	11/02/10	1	2010-11-02T07:11:00.450	2010	11
false	1	1	1	10	1.1	10.1	6711	11/03/10	1	2010-11-03T07:21:00.900	2010	11
false	1	1	1	10	1.1	10.1	6721	11/04/10	1	2010-11-04T07:31:01.350	2010	11
false	1	1	1	10	1.1	10.1	6731	11/05/10	1	2010-11-05T07:41:01.800	2010	11
false	1	1	1	10	1.1	10.1	6741	11/06/10	1	2010-11-06T07:51:02.250	2010	11
false	1	1	1	10	1.1	10.1	6751	11/07/10	1	2010-11-07T08:01:02.700	2010	11
false	1	1	1	10	1.1	10.1	6761	11/08/10	1	2010-11-08T08:11:03.150	2010	11
false	1	1	1	10	1.1	10.1	6771	11/09/10	1	2010-11-09T08:21:03.600	2010	11
false	1	1	1	10	1.1	10.1	6781	11/10/10	1	2010-11-10T08:31:04.500	2010	11
false	1	1	1	10	1.1	10.1	6791	11/11/10	1	2010-11-11T08:41:04.500	2010	11
false	1	1	1	10	1.1	10.1	6801	11/12/10	1	2010-11-12T08:51:04.950	2010	11
false	1	1	1	10	1.1	10.1	6811	11/13/10	1	2010-11-13T09:01:05.400	2010	11
false	1	1	1	10	1.1	10.1	6821	11/14/10	1	2010-11-14T09:11:05.850	2010	11
false	1	1	1	10	1.1	10.1	6831	11/15/10	1	2010-11-15T09:21:06.300	2010	11
false	1	1	1	10	1.1	10.1	6841	11/16/10	1	2010-11-16T09:31:06.750	2010	11
false	1	1	1	10	1.1	10.1	6851	11/17/10	1	2010-11-17T09:41:07.200	2010	11
false	1	1	1	10	1.1	10.1	6861	11/18/10	1	2010-11-18T09:51:07.650	2010	11
false	1	1	1	10	1.1	10.1	6871	11/19/10	1	2010-11-19T10:01:08.100	2010	11
false	1	1	1	10	1.1	10.1	6881	11/20/10	1	2010-11-20T10:11:08.550	2010	11
false	1	1	1	10	1.1	10.1	6891	11/21/10	1	2010-11-21T10:21:09	2010	11
false	1	1	1	10	1.1	10.1	6901	11/22/10	1	2010-11-22T10:31:09.450	2010	11
false	1	1	1	10	1.1	10.1	6911	11/23/10	1	2010-11-23T10:41:09.900	2010	11
false	1	1	1	10	1.1	10.1	6921	11/24/10	1	2010-11-24T10:51:10.350	2010	11
false	1	1	1	10	1.1	10.1	6931	11/25/10	1	2010-11-25T11:01:10.800	2010	11
false	1	1	1	10	1.1	10.1	6941	11/26/10	1	2010-11-26T11:11:11.250	2010	11
false	1	1	1	10	1.1	10.1	6951	11/27/10	1	2010-11-27T11:21:11.700	2010	11
false	1	1	1	10	1.1	10.1	6961	11/28/10	1	2010-11-28T11:31:12.150	2010	11
false	1	1	1	10	1.1	10.1	6971	11/29/10	1	2010-11-29T11:41:12.600	2010	11
false	1	1	1	10	1.1	10.1	6981	11/30/10	1	2010-11-30T11:51:13.500	2010	11
false	1	1	1	10	1.1	10.1	6991	12/01/10	1	2010-12-01T07:01	2010	12
false	1	1	1	10	1.1	10.1	7001	12/02/10	1	2010-12-02T07:11:00.450	2010	12
false	1	1	1	10	1.1	10.1	7011	12/03/10	1	2010-12-03T07:21:00.900	2010	12
false	1	1	1	10	1.1	10.1	7021	12/04/10	1	2010-12-04T07:31:01.350	2010	12
false	1	1	1	10	1.1	10.1	7031	12/05/10	1	2010-12-05T07:41:01.800	2010	12
false	1	1	1	10	1.1	10.1	7041	12/06/10	1	2010-12-06T07:51:02.250	2010	12
false	1	1	1	10	1.1	10.1	7051	12/07/10	1	2010-12-07T08:01:02.700	2010	12
false	1	1	1	10	1.1	10.1	7061	12/08/10	1	2010-12-08T08:11:03.150	2010	12
false	1	1	1	10	1.1	10.1	7071	12/09/10	1	2010-12-09T08:21:03.600	2010	12
false	1	1	1	10	1.1	10.1	7081	12/10/10	1	2010-12-10T08:31:04.500	2010	12
false	1	1	1	10	1.1	10.1	7091	12/11/10	1	2010-12-11T08:41:04.500	2010	12
false	1	1	1	10	1.1	10.1	7101	12/12/10	1	2010-12-12T08:51:04.950	2010	12
false	1	1	1	10	1.1	10.1	7111	12/13/10	1	2010-12-13T09:01:05.400	2010	12
false	1	1	1	10	1.1	10.1	7121	12/14/10	1	2010-12-14T09:11:05.850	2010	12
false	1	1	1	10	1.1	10.1	7131	12/15/10	1	2010-12-15T09:21:06.300	2010	12
false	1	1	1	10	1.1	10.1	7141	12/16/10	1	2010-12-16T09:31:06.750	2010	12
false	1	1	1	10	1.1	10.1	7151	12/17/10	1	2010-12-17T09:41:07.200	2010	12
false	1	1	1	10	1.1	10.1	7161	12/18/10	1	2010-12-18T09:51:07.650	2010	12
false	1	1	1	10	1.1	10.1	7171	12/19/10	1	2010-12-19T10:01:08.100	2010	12
false	1	1	1	10	1.1	10.1	7181	12/20/10	1	2010-12-20T10:11:08.550	2010	12
false	1	1	1	10	1.1	10.1	7191	12/21/10	1	2010-12-21T10:21:09	2010	12
false	1	1	1	10	1.1	10.1	7201	12/22/10	1	2010-12-22T10:31:09.450	2010	12
false	1	1	1	10	1.1	10.1	7211	12/23/10	1	2010-12-23T10:41:09.900	2010	12
false	1	1	1	10	1.1	10.1	7221	12/24/10	1	2010-12-24T10:51:10.350	2010	12
false	1	1	1	10	1.1	10.1	7231	12/25/10	1	2010-12-25T11:01:10.800	2010	12
false	1	1	1	10	1.1	10.1	7241	12/26/10	1	2010-12-26T11:11:11.250	2010	12
false	1	1	1	10	1.1	10.1	7251	12/27/10	1	2010-12-27T11:21:11.700	2010	12
false	1	1	1	10	1.1	10.1	7261	12/28/10	1	2010-12-28T11:31:12.150	2010	12
false	1	1	1	10	1.1	10.1	7271	12/29/10	1	2010-12-29T11:41:12.600	2010	12
false	1	1	1	10	1.1	10.1	7281	12/30/10	1	2010-12-30T11:51:13.500	2010	12
false	1	1	1	10	1.1	10.1	7291	12/31/10	1	2010-12-31T12:01:13.500	2010	12
false	3	3	3	30	3.3	30.3	2303	08/19/09	3	2009-08-19T09:03:08.130	2009	8
false	3	3	3	30	3.3	30.3	2313	08/20/09	3	2009-08-20T09:13:08.580	2009	8
false	3	3	3	30	3.3	30.3	2323	08/21/09	3	2009-08-21T09:23:09.300	2009	8
false	3	3	3	30	3.3	30.3	2333	08/22/09	3	2009-08-22T09:33:09.480	2009	8
false	3	3	3	30	3.3	30.3	2343	08/23/09	3	2009-08-23T09:43:09.930	2009	8
false	3	3	3	30	3.3	30.3	2353	08/24/09	3	2009-08-24T09:53:10.380	2009	8
false	3	3	3	30	3.3	30.3	2363	08/25/09	3	2009-08-25T10:03:10.830	2009	8
false	3	3	3	30	3.3	30.3	2373	08/26/09	3	2009-08-26T10:13:11.280	2009	8
false	3	3	3	30	3.3	30.3	2383	08/27/09	3	2009-08-27T10:23:11.730	2009	8
false	3	3	3	30	3.3	30.3	2393	08/28/09	3	2009-08-28T10:33:12.180	2009	8
false	3	3	3	30	3.3	30.3	2403	08/29/09	3	2009-08-29T10:43:12.630	2009	8
false	3	3	3	30	3.3	30.3	2413	08/30/09	3	2009-08-30T10:53:13.800	2009	8
false	3	3	3	30	3.3	30.3	2423	08/31/09	3	2009-08-31T11:03:13.530	2009	8
false	3	3	3	30	3.3	30.3	2433	09/01/09	3	2009-09-01T06:03:00.300	2009	9
false	3	3	3	30	3.3	30.3	2443	09/02/09	3	2009-09-02T06:13:00.480	2009	9
false	3	3	3	30	3.3	30.3	2453	09/03/09	3	2009-09-03T06:23:00.930	2009	9
false	3	3	3	30	3.3	30.3	2463	09/04/09	3	2009-09-04T06:33:01.380	2009	9
false	3	3	3	30	3.3	30.3	2473	09/05/09	3	2009-09-05T06:43:01.830	2009	9
false	3	3	3	30	3.3	30.3	2483	09/06/09	3	2009-09-06T06:53:02.280	2009	9
false	3	3	3	30	3.3	30.3	2493	09/07/09	3	2009-09-07T07:03:02.730	2009	9
false	3	3	3	30	3.3	30.3	2503	09/08/09	3	2009-09-08T07:13:03.180	2009	9
false	3	3	3	30	3.3	30.3	2513	09/09/09	3	2009-09-09T07:23:03.630	2009	9
false	3	3	3	30	3.3	30.3	2523	09/10/09	3	2009-09-10T07:33:04.800	2009	9
false	3	3	3	30	3.3	30.3	2533	09/11/09	3	2009-09-11T07:43:04.530	2009	9
false	3	3	3	30	3.3	30.3	2543	09/12/09	3	2009-09-12T07:53:04.980	2009	9
false	3	3	3	30	3.3	30.3	2553	09/13/09	3	2009-09-13T08:03:05.430	2009	9
false	3	3	3	30	3.3	30.3	2563	09/14/09	3	2009-09-14T08:13:05.880	2009	9
false	3	3	3	30	3.3	30.3	2573	09/15/09	3	2009-09-15T08:23:06.330	2009	9
false	3	3	3	30	3.3	30.3	2583	09/16/09	3	2009-09-16T08:33:06.780	2009	9
false	3	3	3	30	3.3	30.3	2593	09/17/09	3	2009-09-17T08:43:07.230	2009	9
false	3	3	3	30	3.3	30.3	2603	09/18/09	3	2009-09-18T08:53:07.680	2009	9
false	3	3	3	30	3.3	30.3	2613	09/19/09	3	2009-09-19T09:03:08.130	2009	9
false	3	3	3	30	3.3	30.3	2623	09/20/09	3	2009-09-20T09:13:08.580	2009	9
false	3	3	3	30	3.3	30.3	2633	09/21/09	3	2009-09-21T09:23:09.300	2009	9
false	3	3	3	30	3.3	30.3	2643	09/22/09	3	2009-09-22T09:33:09.480	2009	9
false	3	3	3	30	3.3	30.3	2653	09/23/09	3	2009-09-23T09:43:09.930	2009	9
false	3	3	3	30	3.3	30.3	2663	09/24/09	3	2009-09-24T09:53:10.380	2009	9
false	3	3	3	30	3.3	30.3	2673	09/25/09	3	2009-09-25T10:03:10.830	2009	9
false	3	3	3	30	3.3	30.3	2683	09/26/09	3	2009-09-26T10:13:11.280	2009	9
false	3	3	3	30	3.3	30.3	2693	09/27/09	3	2009-09-27T10:23:11.730	2009	9
false	3	3	3	30	3.3	30.3	2703	09/28/09	3	2009-09-28T10:33:12.180	2009	9
false	3	3	3	30	3.3	30.3	2713	09/29/09	3	2009-09-29T10:43:12.630	2009	9
false	3	3	3	30	3.3	30.3	2723	09/30/09	3	2009-09-30T10:53:13.800	2009	9
false	3	3	3	30	3.3	30.3	2733	10/01/09	3	2009-10-01T06:03:00.300	2009	10
false	3	3	3	30	3.3	30.3	2743	10/02/09	3	2009-10-02T06:13:00.480	2009	10
false	3	3	3	30	3.3	30.3	2753	10/03/09	3	2009-10-03T06:23:00.930	2009	10
false	3	3	3	30	3.3	30.3	2763	10/04/09	3	2009-10-04T06:33:01.380	2009	10
false	3	3	3	30	3.3	30.3	2773	10/05/09	3	2009-10-05T06:43:01.830	2009	10
false	3	3	3	30	3.3	30.3	2783	10/06/09	3	2009-10-06T06:53:02.280	2009	10
false	3	3	3	30	3.3	30.3	2793	10/07/09	3	2009-10-07T07:03:02.730	2009	10
false	3	3	3	30	3.3	30.3	2803	10/08/09	3	2009-10-08T07:13:03.180	2009	10
false	3	3	3	30	3.3	30.3	2813	10/09/09	3	2009-10-09T07:23:03.630	2009	10
false	3	3	3	30	3.3	30.3	2823	10/10/09	3	2009-10-10T07:33:04.800	2009	10
false	3	3	3	30	3.3	30.3	2833	10/11/09	3	2009-10-11T07:43:04.530	2009	10
false	3	3	3	30	3.3	30.3	2843	10/12/09	3	2009-10-12T07:53:04.980	2009	10
false	3	3	3	30	3.3	30.3	2853	10/13/09	3	2009-10-13T08:03:05.430	2009	10
false	3	3	3	30	3.3	30.3	2863	10/14/09	3	2009-10-14T08:13:05.880	2009	10
false	3	3	3	30	3.3	30.3	2873	10/15/09	3	2009-10-15T08:23:06.330	2009	10
false	3	3	3	30	3.3	30.3	2883	10/16/09	3	2009-10-16T08:33:06.780	2009	10
false	3	3	3	30	3.3	30.3	2893	10/17/09	3	2009-10-17T08:43:07.230	2009	10
false	3	3	3	30	3.3	30.3	2903	10/18/09	3	2009-10-18T08:53:07.680	2009	10
false	3	3	3	30	3.3	30.3	2913	10/19/09	3	2009-10-19T09:03:08.130	2009	10
false	3	3	3	30	3.3	30.3	2923	10/20/09	3	2009-10-20T09:13:08.580	2009	10
false	3	3	3	30	3.3	30.3	2933	10/21/09	3	2009-10-21T09:23:09.300	2009	10
false	3	3	3	30	3.3	30.3	2943	10/22/09	3	2009-10-22T09:33:09.480	2009	10
false	3	3	3	30	3.3	30.3	2953	10/23/09	3	2009-10-23T09:43:09.930	2009	10
false	3	3	3	30	3.3	30.3	2963	10/24/09	3	2009-10-24T09:53:10.380	2009	10
false	3	3	3	30	3.3	30.3	2973	10/25/09	3	2009-10-25T11:03:10.830	2009	10
false	3	3	3	30	3.3	30.3	2983	10/26/09	3	2009-10-26T11:13:11.280	2009	10
false	3	3	3	30	3.3	30.3	2993	10/27/09	3	2009-10-27T11:23:11.730	2009	10
false	3	3	3	30	3.3	30.3	3003	10/28/09	3	2009-10-28T11:33:12.180	2009	10
false	3	3	3	30	3.3	30.3	3013	10/29/09	3	2009-10-29T11:43:12.630	2009	10
false	3	3	3	30	3.3	30.3	3023	10/30/09	3	2009-10-30T11:53:13.800	2009	10
false	3	3	3	30	3.3	30.3	3033	10/31/09	3	2009-10-31T12:03:13.530	2009	10
false	3	3	3	30	3.3	30.3	3043	11/01/09	3	2009-11-01T07:03:00.300	2009	11
false	3	3	3	30	3.3	30.3	3053	11/02/09	3	2009-11-02T07:13:00.480	2009	11
false	3	3	3	30	3.3	30.3	3063	11/03/09	3	2009-11-03T07:23:00.930	2009	11
false	3	3	3	30	3.3	30.3	3073	11/04/09	3	2009-11-04T07:33:01.380	2009	11
false	3	3	3	30	3.3	30.3	3083	11/05/09	3	2009-11-05T07:43:01.830	2009	11
false	3	3	3	30	3.3	30.3	3093	11/06/09	3	2009-11-06T07:53:02.280	2009	11
false	3	3	3	30	3.3	30.3	3103	11/07/09	3	2009-11-07T08:03:02.730	2009	11
false	3	3	3	30	3.3	30.3	3113	11/08/09	3	2009-11-08T08:13:03.180	2009	11
false	3	3	3	30	3.3	30.3	3123	11/09/09	3	2009-11-09T08:23:03.630	2009	11
false	3	3	3	30	3.3	30.3	3133	11/10/09	3	2009-11-10T08:33:04.800	2009	11
false	3	3	3	30	3.3	30.3	3143	11/11/09	3	2009-11-11T08:43:04.530	2009	11
false	3	3	3	30	3.3	30.3	3153	11/12/09	3	2009-11-12T08:53:04.980	2009	11
false	3	3	3	30	3.3	30.3	3163	11/13/09	3	2009-11-13T09:03:05.430	2009	11
false	3	3	3	30	3.3	30.3	3173	11/14/09	3	2009-11-14T09:13:05.880	2009	11
false	3	3	3	30	3.3	30.3	3183	11/15/09	3	2009-11-15T09:23:06.330	2009	11
false	3	3	3	30	3.3	30.3	3193	11/16/09	3	2009-11-16T09:33:06.780	2009	11
false	3	3	3	30	3.3	30.3	3203	11/17/09	3	2009-11-17T09:43:07.230	2009	11
false	3	3	3	30	3.3	30.3	3213	11/18/09	3	2009-11-18T09:53:07.680	2009	11
false	3	3	3	30	3.3	30.3	3223	11/19/09	3	2009-11-19T10:03:08.130	2009	11
false	3	3	3	30	3.3	30.3	3233	11/20/09	3	2009-11-20T10:13:08.580	2009	11
false	3	3	3	30	3.3	30.3	3243	11/21/09	3	2009-11-21T10:23:09.300	2009	11
false	3	3	3	30	3.3	30.3	3253	11/22/09	3	2009-11-22T10:33:09.480	2009	11
false	3	3	3	30	3.3	30.3	3263	11/23/09	3	2009-11-23T10:43:09.930	2009	11
false	3	3	3	30	3.3	30.3	3273	11/24/09	3	2009-11-24T10:53:10.380	2009	11
false	3	3	3	30	3.3	30.3	3283	11/25/09	3	2009-11-25T11:03:10.830	2009	11
false	3	3	3	30	3.3	30.3	3293	11/26/09	3	2009-11-26T11:13:11.280	2009	11
false	3	3	3	30	3.3	30.3	3303	11/27/09	3	2009-11-27T11:23:11.730	2009	11
false	3	3	3	30	3.3	30.3	3313	11/28/09	3	2009-11-28T11:33:12.180	2009	11
false	3	3	3	30	3.3	30.3	3323	11/29/09	3	2009-11-29T11:43:12.630	2009	11
false	3	3	3	30	3.3	30.3	3333	11/30/09	3	2009-11-30T11:53:13.800	2009	11
false	3	3	3	30	3.3	30.3	3343	12/01/09	3	2009-12-01T07:03:00.300	2009	12
false	3	3	3	30	3.3	30.3	3353	12/02/09	3	2009-12-02T07:13:00.480	2009	12
false	3	3	3	30	3.3	30.3	3363	12/03/09	3	2009-12-03T07:23:00.930	2009	12
false	3	3	3	30	3.3	30.3	3373	12/04/09	3	2009-12-04T07:33:01.380	2009	12
false	3	3	3	30	3.3	30.3	3383	12/05/09	3	2009-12-05T07:43:01.830	2009	12
false	3	3	3	30	3.3	30.3	3393	12/06/09	3	2009-12-06T07:53:02.280	2009	12
false	3	3	3	30	3.3	30.3	3403	12/07/09	3	2009-12-07T08:03:02.730	2009	12
false	3	3	3	30	3.3	30.3	3413	12/08/09	3	2009-12-08T08:13:03.180	2009	12
false	3	3	3	30	3.3	30.3	3423	12/09/09	3	2009-12-09T08:23:03.630	2009	12
false	3	3	3	30	3.3	30.3	3433	12/10/09	3	2009-12-10T08:33:04.800	2009	12
false	3	3	3	30	3.3	30.3	3443	12/11/09	3	2009-12-11T08:43:04.530	2009	12
false	3	3	3	30	3.3	30.3	3453	12/12/09	3	2009-12-12T08:53:04.980	2009	12
false	3	3	3	30	3.3	30.3	3463	12/13/09	3	2009-12-13T09:03:05.430	2009	12
false	3	3	3	30	3.3	30.3	3473	12/14/09	3	2009-12-14T09:13:05.880	2009	12
false	3	3	3	30	3.3	30.3	3483	12/15/09	3	2009-12-15T09:23:06.330	2009	12
false	3	3	3	30	3.3	30.3	3493	12/16/09	3	2009-12-16T09:33:06.780	2009	12
false	3	3	3	30	3.3	30.3	3503	12/17/09	3	2009-12-17T09:43:07.230	2009	12
false	3	3	3	30	3.3	30.3	3513	12/18/09	3	2009-12-18T09:53:07.680	2009	12
false	3	3	3	30	3.3	30.3	3523	12/19/09	3	2009-12-19T10:03:08.130	2009	12
false	3	3	3	30	3.3	30.3	3533	12/20/09	3	2009-12-20T10:13:08.580	2009	12
false	3	3	3	30	3.3	30.3	3543	12/21/09	3	2009-12-21T10:23:09.300	2009	12
false	3	3	3	30	3.3	30.3	3553	12/22/09	3	2009-12-22T10:33:09.480	2009	12
false	3	3	3	30	3.3	30.3	3563	12/23/09	3	2009-12-23T10:43:09.930	2009	12
false	3	3	3	30	3.3	30.3	3573	12/24/09	3	2009-12-24T10:53:10.380	2009	12
false	3	3	3	30	3.3	30.3	3583	12/25/09	3	2009-12-25T11:03:10.830	2009	12
false	3	3	3	30	3.3	30.3	3593	12/26/09	3	2009-12-26T11:13:11.280	2009	12
false	3	3	3	30	3.3	30.3	3603	12/27/09	3	2009-12-27T11:23:11.730	2009	12
false	3	3	3	30	3.3	30.3	3613	12/28/09	3	2009-12-28T11:33:12.180	2009	12
false	3	3	3	30	3.3	30.3	3623	12/29/09	3	2009-12-29T11:43:12.630	2009	12
false	3	3	3	30	3.3	30.3	3633	12/30/09	3	2009-12-30T11:53:13.800	2009	12
false	3	3	3	30	3.3	30.3	3643	12/31/09	3	2009-12-31T12:03:13.530	2009	12
false	3	3	3	30	3.3	30.3	3653	01/01/10	3	2010-01-01T07:03:00.300	2010	1
false	3	3	3	30	3.3	30.3	3663	01/02/10	3	2010-01-02T07:13:00.480	2010	1
false	3	3	3	30	3.3	30.3	3673	01/03/10	3	2010-01-03T07:23:00.930	2010	1
false	3	3	3	30	3.3	30.3	3683	01/04/10	3	2010-01-04T07:33:01.380	2010	1
false	3	3	3	30	3.3	30.3	3693	01/05/10	3	2010-01-05T07:43:01.830	2010	1
false	3	3	3	30	3.3	30.3	3703	01/06/10	3	2010-01-06T07:53:02.280	2010	1
false	3	3	3	30	3.3	30.3	3713	01/07/10	3	2010-01-07T08:03:02.730	2010	1
false	3	3	3	30	3.3	30.3	3723	01/08/10	3	2010-01-08T08:13:03.180	2010	1
false	3	3	3	30	3.3	30.3	3733	01/09/10	3	2010-01-09T08:23:03.630	2010	1
false	3	3	3	30	3.3	30.3	3743	01/10/10	3	2010-01-10T08:33:04.800	2010	1
false	3	3	3	30	3.3	30.3	3753	01/11/10	3	2010-01-11T08:43:04.530	2010	1
false	3	3	3	30	3.3	30.3	3763	01/12/10	3	2010-01-12T08:53:04.980	2010	1
false	3	3	3	30	3.3	30.3	3773	01/13/10	3	2010-01-13T09:03:05.430	2010	1
false	3	3	3	30	3.3	30.3	3783	01/14/10	3	2010-01-14T09:13:05.880	2010	1
false	3	3	3	30	3.3	30.3	3793	01/15/10	3	2010-01-15T09:23:06.330	2010	1
false	3	3	3	30	3.3	30.3	3803	01/16/10	3	2010-01-16T09:33:06.780	2010	1
false	3	3	3	30	3.3	30.3	3813	01/17/10	3	2010-01-17T09:43:07.230	2010	1
false	3	3	3	30	3.3	30.3	3823	01/18/10	3	2010-01-18T09:53:07.680	2010	1
false	3	3	3	30	3.3	30.3	3833	01/19/10	3	2010-01-19T10:03:08.130	2010	1
false	3	3	3	30	3.3	30.3	3843	01/20/10	3	2010-01-20T10:13:08.580	2010	1
false	3	3	3	30	3.3	30.3	3853	01/21/10	3	2010-01-21T10:23:09.300	2010	1
false	3	3	3	30	3.3	30.3	3863	01/22/10	3	2010-01-22T10:33:09.480	2010	1
false	3	3	3	30	3.3	30.3	3873	01/23/10	3	2010-01-23T10:43:09.930	2010	1
false	3	3	3	30	3.3	30.3	3883	01/24/10	3	2010-01-24T10:53:10.380	2010	1
false	3	3	3	30	3.3	30.3	3893	01/25/10	3	2010-01-25T11:03:10.830	2010	1
false	3	3	3	30	3.3	30.3	3903	01/26/10	3	2010-01-26T11:13:11.280	2010	1
false	3	3	3	30	3.3	30.3	3913	01/27/10	3	2010-01-27T11:23:11.730	2010	1
false	3	3	3	30	3.3	30.3	3923	01/28/10	3	2010-01-28T11:33:12.180	2010	1
false	3	3	3	30	3.3	30.3	3933	01/29/10	3	2010-01-29T11:43:12.630	2010	1
false	3	3	3	30	3.3	30.3	3943	01/30/10	3	2010-01-30T11:53:13.800	2010	1
false	3	3	3	30	3.3	30.3	3953	01/31/10	3	2010-01-31T12:03:13.530	2010	1
false	3	3	3	30	3.3	30.3	3963	02/01/10	3	2010-02-01T07:03:00.300	2010	2
false	3	3	3	30	3.3	30.3	3973	02/02/10	3	2010-02-02T07:13:00.480	2010	2
false	3	3	3	30	3.3	30.3	3983	02/03/10	3	2010-02-03T07:23:00.930	2010	2
false	3	3	3	30	3.3	30.3	3993	02/04/10	3	2010-02-04T07:33:01.380	2010	2
false	3	3	3	30	3.3	30.3	4003	02/05/10	3	2010-02-05T07:43:01.830	2010	2
false	3	3	3	30	3.3	30.3	4013	02/06/10	3	2010-02-06T07:53:02.280	2010	2
false	3	3	3	30	3.3	30.3	4023	02/07/10	3	2010-02-07T08:03:02.730	2010	2
false	3	3	3	30	3.3	30.3	4033	02/08/10	3	2010-02-08T08:13:03.180	2010	2
false	3	3	3	30	3.3	30.3	4043	02/09/10	3	2010-02-09T08:23:03.630	2010	2
false	3	3	3	30	3.3	30.3	4053	02/10/10	3	2010-02-10T08:33:04.800	2010	2
false	3	3	3	30	3.3	30.3	4063	02/11/10	3	2010-02-11T08:43:04.530	2010	2
false	3	3	3	30	3.3	30.3	4073	02/12/10	3	2010-02-12T08:53:04.980	2010	2
false	3	3	3	30	3.3	30.3	4083	02/13/10	3	2010-02-13T09:03:05.430	2010	2
false	3	3	3	30	3.3	30.3	4093	02/14/10	3	2010-02-14T09:13:05.880	2010	2
false	3	3	3	30	3.3	30.3	4103	02/15/10	3	2010-02-15T09:23:06.330	2010	2
false	3	3	3	30	3.3	30.3	4113	02/16/10	3	2010-02-16T09:33:06.780	2010	2
false	3	3	3	30	3.3	30.3	4123	02/17/10	3	2010-02-17T09:43:07.230	2010	2
false	3	3	3	30	3.3	30.3	4133	02/18/10	3	2010-02-18T09:53:07.680	2010	2
false	3	3	3	30	3.3	30.3	4143	02/19/10	3	2010-02-19T10:03:08.130	2010	2
false	3	3	3	30	3.3	30.3	4153	02/20/10	3	2010-02-20T10:13:08.580	2010	2
false	3	3	3	30	3.3	30.3	4163	02/21/10	3	2010-02-21T10:23:09.300	2010	2
false	3	3	3	30	3.3	30.3	4173	02/22/10	3	2010-02-22T10:33:09.480	2010	2
false	3	3	3	30	3.3	30.3	4183	02/23/10	3	2010-02-23T10:43:09.930	2010	2
false	3	3	3	30	3.3	30.3	4193	02/24/10	3	2010-02-24T10:53:10.380	2010	2
false	3	3	3	30	3.3	30.3	4203	02/25/10	3	2010-02-25T11:03:10.830	2010	2
false	3	3	3	30	3.3	30.3	4213	02/26/10	3	2010-02-26T11:13:11.280	2010	2
false	3	3	3	30	3.3	30.3	4223	02/27/10	3	2010-02-27T11:23:11.730	2010	2
false	3	3	3	30	3.3	30.3	4233	02/28/10	3	2010-02-28T11:33:12.180	2010	2
false	3	3	3	30	3.3	30.3	4243	03/01/10	3	2010-03-01T07:03:00.300	2010	3
false	3	3	3	30	3.3	30.3	4253	03/02/10	3	2010-03-02T07:13:00.480	2010	3
false	3	3	3	30	3.3	30.3	4263	03/03/10	3	2010-03-03T07:23:00.930	2010	3
false	3	3	3	30	3.3	30.3	4273	03/04/10	3	2010-03-04T07:33:01.380	2010	3
false	3	3	3	30	3.3	30.3	4283	03/05/10	3	2010-03-05T07:43:01.830	2010	3
false	3	3	3	30	3.3	30.3	4293	03/06/10	3	2010-03-06T07:53:02.280	2010	3
false	3	3	3	30	3.3	30.3	4303	03/07/10	3	2010-03-07T08:03:02.730	2010	3
false	3	3	3	30	3.3	30.3	4313	03/08/10	3	2010-03-08T08:13:03.180	2010	3
false	3	3	3	30	3.3	30.3	4323	03/09/10	3	2010-03-09T08:23:03.630	2010	3
false	3	3	3	30	3.3	30.3	4333	03/10/10	3	2010-03-10T08:33:04.800	2010	3
false	3	3	3	30	3.3	30.3	4343	03/11/10	3	2010-03-11T08:43:04.530	2010	3
false	3	3	3	30	3.3	30.3	4353	03/12/10	3	2010-03-12T08:53:04.980	2010	3
false	3	3	3	30	3.3	30.3	4363	03/13/10	3	2010-03-13T09:03:05.430	2010	3
false	3	3	3	30	3.3	30.3	4373	03/14/10	3	2010-03-14T08:13:05.880	2010	3
false	3	3	3	30	3.3	30.3	4383	03/15/10	3	2010-03-15T08:23:06.330	2010	3
false	3	3	3	30	3.3	30.3	4393	03/16/10	3	2010-03-16T08:33:06.780	2010	3
false	3	3	3	30	3.3	30.3	4403	03/17/10	3	2010-03-17T08:43:07.230	2010	3
false	3	3	3	30	3.3	30.3	4413	03/18/10	3	2010-03-18T08:53:07.680	2010	3
false	3	3	3	30	3.3	30.3	4423	03/19/10	3	2010-03-19T09:03:08.130	2010	3
false	3	3	3	30	3.3	30.3	4433	03/20/10	3	2010-03-20T09:13:08.580	2010	3
false	3	3	3	30	3.3	30.3	4443	03/21/10	3	2010-03-21T09:23:09.300	2010	3
false	3	3	3	30	3.3	30.3	4453	03/22/10	3	2010-03-22T09:33:09.480	2010	3
false	3	3	3	30	3.3	30.3	4463	03/23/10	3	2010-03-23T09:43:09.930	2010	3
false	3	3	3	30	3.3	30.3	4473	03/24/10	3	2010-03-24T09:53:10.380	2010	3
false	3	3	3	30	3.3	30.3	4483	03/25/10	3	2010-03-25T10:03:10.830	2010	3
false	3	3	3	30	3.3	30.3	4493	03/26/10	3	2010-03-26T10:13:11.280	2010	3
false	3	3	3	30	3.3	30.3	4503	03/27/10	3	2010-03-27T10:23:11.730	2010	3
false	3	3	3	30	3.3	30.3	4513	03/28/10	3	2010-03-28T09:33:12.180	2010	3
false	3	3	3	30	3.3	30.3	4523	03/29/10	3	2010-03-29T09:43:12.630	2010	3
false	3	3	3	30	3.3	30.3	4533	03/30/10	3	2010-03-30T09:53:13.800	2010	3
false	3	3	3	30	3.3	30.3	4543	03/31/10	3	2010-03-31T10:03:13.530	2010	3
false	3	3	3	30	3.3	30.3	4553	04/01/10	3	2010-04-01T06:03:00.300	2010	4
false	3	3	3	30	3.3	30.3	4563	04/02/10	3	2010-04-02T06:13:00.480	2010	4
false	3	3	3	30	3.3	30.3	4573	04/03/10	3	2010-04-03T06:23:00.930	2010	4
false	3	3	3	30	3.3	30.3	4583	04/04/10	3	2010-04-04T06:33:01.380	2010	4
false	3	3	3	30	3.3	30.3	4593	04/05/10	3	2010-04-05T06:43:01.830	2010	4
false	3	3	3	30	3.3	30.3	4603	04/06/10	3	2010-04-06T06:53:02.280	2010	4
false	3	3	3	30	3.3	30.3	4613	04/07/10	3	2010-04-07T07:03:02.730	2010	4
false	3	3	3	30	3.3	30.3	4623	04/08/10	3	2010-04-08T07:13:03.180	2010	4
false	3	3	3	30	3.3	30.3	4633	04/09/10	3	2010-04-09T07:23:03.630	2010	4
false	3	3	3	30	3.3	30.3	4643	04/10/10	3	2010-04-10T07:33:04.800	2010	4
false	3	3	3	30	3.3	30.3	4653	04/11/10	3	2010-04-11T07:43:04.530	2010	4
false	3	3	3	30	3.3	30.3	4663	04/12/10	3	2010-04-12T07:53:04.980	2010	4
false	3	3	3	30	3.3	30.3	4673	04/13/10	3	2010-04-13T08:03:05.430	2010	4
false	3	3	3	30	3.3	30.3	4683	04/14/10	3	2010-04-14T08:13:05.880	2010	4
false	3	3	3	30	3.3	30.3	4693	04/15/10	3	2010-04-15T08:23:06.330	2010	4
false	3	3	3	30	3.3	30.3	4703	04/16/10	3	2010-04-16T08:33:06.780	2010	4
false	3	3	3	30	3.3	30.3	4713	04/17/10	3	2010-04-17T08:43:07.230	2010	4
false	3	3	3	30	3.3	30.3	4723	04/18/10	3	2010-04-18T08:53:07.680	2010	4
false	3	3	3	30	3.3	30.3	4733	04/19/10	3	2010-04-19T09:03:08.130	2010	4
false	3	3	3	30	3.3	30.3	4743	04/20/10	3	2010-04-20T09:13:08.580	2010	4
false	3	3	3	30	3.3	30.3	4753	04/21/10	3	2010-04-21T09:23:09.300	2010	4
false	3	3	3	30	3.3	30.3	4763	04/22/10	3	2010-04-22T09:33:09.480	2010	4
false	3	3	3	30	3.3	30.3	4773	04/23/10	3	2010-04-23T09:43:09.930	2010	4
false	3	3	3	30	3.3	30.3	4783	04/24/10	3	2010-04-24T09:53:10.380	2010	4
false	3	3	3	30	3.3	30.3	4793	04/25/10	3	2010-04-25T10:03:10.830	2010	4
false	3	3	3	30	3.3	30.3	4803	04/26/10	3	2010-04-26T10:13:11.280	2010	4
false	3	3	3	30	3.3	30.3	4813	04/27/10	3	2010-04-27T10:23:11.730	2010	4
false	3	3	3	30	3.3	30.3	4823	04/28/10	3	2010-04-28T10:33:12.180	2010	4
false	3	3	3	30	3.3	30.3	4833	04/29/10	3	2010-04-29T10:43:12.630	2010	4
false	3	3	3	30	3.3	30.3	4843	04/30/10	3	2010-04-30T10:53:13.800	2010	4
false	3	3	3	30	3.3	30.3	4853	05/01/10	3	2010-05-01T06:03:00.300	2010	5
false	3	3	3	30	3.3	30.3	4863	05/02/10	3	2010-05-02T06:13:00.480	2010	5
false	3	3	3	30	3.3	30.3	4873	05/03/10	3	2010-05-03T06:23:00.930	2010	5
false	3	3	3	30	3.3	30.3	4883	05/04/10	3	2010-05-04T06:33:01.380	2010	5
false	3	3	3	30	3.3	30.3	4893	05/05/10	3	2010-05-05T06:43:01.830	2010	5
false	3	3	3	30	3.3	30.3	4903	05/06/10	3	2010-05-06T06:53:02.280	2010	5
false	3	3	3	30	3.3	30.3	4913	05/07/10	3	2010-05-07T07:03:02.730	2010	5
false	3	3	3	30	3.3	30.3	4923	05/08/10	3	2010-05-08T07:13:03.180	2010	5
false	3	3	3	30	3.3	30.3	4933	05/09/10	3	2010-05-09T07:23:03.630	2010	5
false	3	3	3	30	3.3	30.3	4943	05/10/10	3	2010-05-10T07:33:04.800	2010	5
false	3	3	3	30	3.3	30.3	4953	05/11/10	3	2010-05-11T07:43:04.530	2010	5
false	3	3	3	30	3.3	30.3	4963	05/12/10	3	2010-05-12T07:53:04.980	2010	5
false	3	3	3	30	3.3	30.3	4973	05/13/10	3	2010-05-13T08:03:05.430	2010	5
false	3	3	3	30	3.3	30.3	4983	05/14/10	3	2010-05-14T08:13:05.880	2010	5
false	3	3	3	30	3.3	30.3	4993	05/15/10	3	2010-05-15T08:23:06.330	2010	5
false	3	3	3	30	3.3	30.3	5003	05/16/10	3	2010-05-16T08:33:06.780	2010	5
false	3	3	3	30	3.3	30.3	5013	05/17/10	3	2010-05-17T08:43:07.230	2010	5
false	3	3	3	30	3.3	30.3	5023	05/18/10	3	2010-05-18T08:53:07.680	2010	5
false	3	3	3	30	3.3	30.3	5033	05/19/10	3	2010-05-19T09:03:08.130	2010	5
false	3	3	3	30	3.3	30.3	5043	05/20/10	3	2010-05-20T09:13:08.580	2010	5
false	3	3	3	30	3.3	30.3	5053	05/21/10	3	2010-05-21T09:23:09.300	2010	5
false	3	3	3	30	3.3	30.3	5063	05/22/10	3	2010-05-22T09:33:09.480	2010	5
false	3	3	3	30	3.3	30.3	5073	05/23/10	3	2010-05-23T09:43:09.930	2010	5
false	3	3	3	30	3.3	30.3	5083	05/24/10	3	2010-05-24T09:53:10.380	2010	5
false	3	3	3	30	3.3	30.3	5093	05/25/10	3	2010-05-25T10:03:10.830	2010	5
false	3	3	3	30	3.3	30.3	5103	05/26/10	3	2010-05-26T10:13:11.280	2010	5
false	3	3	3	30	3.3	30.3	5113	05/27/10	3	2010-05-27T10:23:11.730	2010	5
false	3	3	3	30	3.3	30.3	5123	05/28/10	3	2010-05-28T10:33:12.180	2010	5
false	3	3	3	30	3.3	30.3	5133	05/29/10	3	2010-05-29T10:43:12.630	2010	5
false	3	3	3	30	3.3	30.3	5143	05/30/10	3	2010-05-30T10:53:13.800	2010	5
false	3	3	3	30	3.3	30.3	5153	05/31/10	3	2010-05-31T11:03:13.530	2010	5
false	3	3	3	30	3.3	30.3	5163	06/01/10	3	2010-06-01T06:03:00.300	2010	6
false	3	3	3	30	3.3	30.3	5173	06/02/10	3	2010-06-02T06:13:00.480	2010	6
false	3	3	3	30	3.3	30.3	5183	06/03/10	3	2010-06-03T06:23:00.930	2010	6
false	3	3	3	30	3.3	30.3	5193	06/04/10	3	2010-06-04T06:33:01.380	2010	6
false	3	3	3	30	3.3	30.3	5203	06/05/10	3	2010-06-05T06:43:01.830	2010	6
false	3	3	3	30	3.3	30.3	5213	06/06/10	3	2010-06-06T06:53:02.280	2010	6
false	3	3	3	30	3.3	30.3	5223	06/07/10	3	2010-06-07T07:03:02.730	2010	6
false	3	3	3	30	3.3	30.3	5233	06/08/10	3	2010-06-08T07:13:03.180	2010	6
false	3	3	3	30	3.3	30.3	5243	06/09/10	3	2010-06-09T07:23:03.630	2010	6
false	3	3	3	30	3.3	30.3	5253	06/10/10	3	2010-06-10T07:33:04.800	2010	6
false	3	3	3	30	3.3	30.3	5263	06/11/10	3	2010-06-11T07:43:04.530	2010	6
false	3	3	3	30	3.3	30.3	5273	06/12/10	3	2010-06-12T07:53:04.980	2010	6
false	3	3	3	30	3.3	30.3	5283	06/13/10	3	2010-06-13T08:03:05.430	2010	6
false	3	3	3	30	3.3	30.3	5293	06/14/10	3	2010-06-14T08:13:05.880	2010	6
false	3	3	3	30	3.3	30.3	5303	06/15/10	3	2010-06-15T08:23:06.330	2010	6
false	3	3	3	30	3.3	30.3	5313	06/16/10	3	2010-06-16T08:33:06.780	2010	6
false	3	3	3	30	3.3	30.3	5323	06/17/10	3	2010-06-17T08:43:07.230	2010	6
false	3	3	3	30	3.3	30.3	5333	06/18/10	3	2010-06-18T08:53:07.680	2010	6
false	3	3	3	30	3.3	30.3	5343	06/19/10	3	2010-06-19T09:03:08.130	2010	6
false	3	3	3	30	3.3	30.3	5353	06/20/10	3	2010-06-20T09:13:08.580	2010	6
false	3	3	3	30	3.3	30.3	5363	06/21/10	3	2010-06-21T09:23:09.300	2010	6
false	3	3	3	30	3.3	30.3	5373	06/22/10	3	2010-06-22T09:33:09.480	2010	6
false	3	3	3	30	3.3	30.3	5383	06/23/10	3	2010-06-23T09:43:09.930	2010	6
false	3	3	3	30	3.3	30.3	5393	06/24/10	3	2010-06-24T09:53:10.380	2010	6
false	3	3	3	30	3.3	30.3	5403	06/25/10	3	2010-06-25T10:03:10.830	2010	6
false	3	3	3	30	3.3	30.3	5413	06/26/10	3	2010-06-26T10:13:11.280	2010	6
false	3	3	3	30	3.3	30.3	5423	06/27/10	3	2010-06-27T10:23:11.730	2010	6
false	3	3	3	30	3.3	30.3	5433	06/28/10	3	2010-06-28T10:33:12.180	2010	6
false	3	3	3	30	3.3	30.3	5443	06/29/10	3	2010-06-29T10:43:12.630	2010	6
false	3	3	3	30	3.3	30.3	5453	06/30/10	3	2010-06-30T10:53:13.800	2010	6
false	3	3	3	30	3.3	30.3	5463	07/01/10	3	2010-07-01T06:03:00.300	2010	7
false	3	3	3	30	3.3	30.3	5473	07/02/10	3	2010-07-02T06:13:00.480	2010	7
false	3	3	3	30	3.3	30.3	5483	07/03/10	3	2010-07-03T06:23:00.930	2010	7
false	3	3	3	30	3.3	30.3	5493	07/04/10	3	2010-07-04T06:33:01.380	2010	7
false	3	3	3	30	3.3	30.3	5503	07/05/10	3	2010-07-05T06:43:01.830	2010	7
false	3	3	3	30	3.3	30.3	5513	07/06/10	3	2010-07-06T06:53:02.280	2010	7
false	3	3	3	30	3.3	30.3	5523	07/07/10	3	2010-07-07T07:03:02.730	2010	7
false	3	3	3	30	3.3	30.3	5533	07/08/10	3	2010-07-08T07:13:03.180	2010	7
false	3	3	3	30	3.3	30.3	5543	07/09/10	3	2010-07-09T07:23:03.630	2010	7
false	3	3	3	30	3.3	30.3	5553	07/10/10	3	2010-07-10T07:33:04.800	2010	7
false	3	3	3	30	3.3	30.3	5563	07/11/10	3	2010-07-11T07:43:04.530	2010	7
false	3	3	3	30	3.3	30.3	5573	07/12/10	3	2010-07-12T07:53:04.980	2010	7
false	3	3	3	30	3.3	30.3	5583	07/13/10	3	2010-07-13T08:03:05.430	2010	7
false	3	3	3	30	3.3	30.3	5593	07/14/10	3	2010-07-14T08:13:05.880	2010	7
false	3	3	3	30	3.3	30.3	5603	07/15/10	3	2010-07-15T08:23:06.330	2010	7
false	3	3	3	30	3.3	30.3	5613	07/16/10	3	2010-07-16T08:33:06.780	2010	7
false	3	3	3	30	3.3	30.3	5623	07/17/10	3	2010-07-17T08:43:07.230	2010	7
false	3	3	3	30	3.3	30.3	5633	07/18/10	3	2010-07-18T08:53:07.680	2010	7
false	3	3	3	30	3.3	30.3	5643	07/19/10	3	2010-07-19T09:03:08.130	2010	7
false	3	3	3	30	3.3	30.3	5653	07/20/10	3	2010-07-20T09:13:08.580	2010	7
false	3	3	3	30	3.3	30.3	5663	07/21/10	3	2010-07-21T09:23:09.300	2010	7
false	3	3	3	30	3.3	30.3	5673	07/22/10	3	2010-07-22T09:33:09.480	2010	7
false	3	3	3	30	3.3	30.3	5683	07/23/10	3	2010-07-23T09:43:09.930	2010	7
false	3	3	3	30	3.3	30.3	5693	07/24/10	3	2010-07-24T09:53:10.380	2010	7
false	3	3	3	30	3.3	30.3	5703	07/25/10	3	2010-07-25T10:03:10.830	2010	7
false	3	3	3	30	3.3	30.3	5713	07/26/10	3	2010-07-26T10:13:11.280	2010	7
false	3	3	3	30	3.3	30.3	5723	07/27/10	3	2010-07-27T10:23:11.730	2010	7
false	3	3	3	30	3.3	30.3	5733	07/28/10	3	2010-07-28T10:33:12.180	2010	7
false	3	3	3	30	3.3	30.3	5743	07/29/10	3	2010-07-29T10:43:12.630	2010	7
false	3	3	3	30	3.3	30.3	5753	07/30/10	3	2010-07-30T10:53:13.800	2010	7
false	3	3	3	30	3.3	30.3	5763	07/31/10	3	2010-07-31T11:03:13.530	2010	7
false	3	3	3	30	3.3	30.3	5773	08/01/10	3	2010-08-01T06:03:00.300	2010	8
false	3	3	3	30	3.3	30.3	5783	08/02/10	3	2010-08-02T06:13:00.480	2010	8
false	3	3	3	30	3.3	30.3	5793	08/03/10	3	2010-08-03T06:23:00.930	2010	8
false	3	3	3	30	3.3	30.3	5803	08/04/10	3	2010-08-04T06:33:01.380	2010	8
false	3	3	3	30	3.3	30.3	5813	08/05/10	3	2010-08-05T06:43:01.830	2010	8
false	3	3	3	30	3.3	30.3	5823	08/06/10	3	2010-08-06T06:53:02.280	2010	8
false	3	3	3	30	3.3	30.3	5833	08/07/10	3	2010-08-07T07:03:02.730	2010	8
false	3	3	3	30	3.3	30.3	5843	08/08/10	3	2010-08-08T07:13:03.180	2010	8
false	3	3	3	30	3.3	30.3	5853	08/09/10	3	2010-08-09T07:23:03.630	2010	8
false	3	3	3	30	3.3	30.3	5863	08/10/10	3	2010-08-10T07:33:04.800	2010	8
false	3	3	3	30	3.3	30.3	5873	08/11/10	3	2010-08-11T07:43:04.530	2010	8
false	3	3	3	30	3.3	30.3	5883	08/12/10	3	2010-08-12T07:53:04.980	2010	8
false	3	3	3	30	3.3	30.3	5893	08/13/10	3	2010-08-13T08:03:05.430	2010	8
false	3	3	3	30	3.3	30.3	5903	08/14/10	3	2010-08-14T08:13:05.880	2010	8
false	3	3	3	30	3.3	30.3	5913	08/15/10	3	2010-08-15T08:23:06.330	2010	8
false	3	3	3	30	3.3	30.3	5923	08/16/10	3	2010-08-16T08:33:06.780	2010	8
false	3	3	3	30	3.3	30.3	5933	08/17/10	3	2010-08-17T08:43:07.230	2010	8
false	3	3	3	30	3.3	30.3	5943	08/18/10	3	2010-08-18T08:53:07.680	2010	8
false	3	3	3	30	3.3	30.3	5953	08/19/10	3	2010-08-19T09:03:08.130	2010	8
false	3	3	3	30	3.3	30.3	5963	08/20/10	3	2010-08-20T09:13:08.580	2010	8
false	3	3	3	30	3.3	30.3	5973	08/21/10	3	2010-08-21T09:23:09.300	2010	8
false	3	3	3	30	3.3	30.3	5983	08/22/10	3	2010-08-22T09:33:09.480	2010	8
false	3	3	3	30	3.3	30.3	5993	08/23/10	3	2010-08-23T09:43:09.930	2010	8
false	3	3	3	30	3.3	30.3	6003	08/24/10	3	2010-08-24T09:53:10.380	2010	8
false	3	3	3	30	3.3	30.3	6013	08/25/10	3	2010-08-25T10:03:10.830	2010	8
false	3	3	3	30	3.3	30.3	6023	08/26/10	3	2010-08-26T10:13:11.280	2010	8
false	3	3	3	30	3.3	30.3	6033	08/27/10	3	2010-08-27T10:23:11.730	2010	8
false	3	3	3	30	3.3	30.3	6043	08/28/10	3	2010-08-28T10:33:12.180	2010	8
false	3	3	3	30	3.3	30.3	6053	08/29/10	3	2010-08-29T10:43:12.630	2010	8
false	3	3	3	30	3.3	30.3	6063	08/30/10	3	2010-08-30T10:53:13.800	2010	8
false	3	3	3	30	3.3	30.3	6073	08/31/10	3	2010-08-31T11:03:13.530	2010	8
false	3	3	3	30	3.3	30.3	6083	09/01/10	3	2010-09-01T06:03:00.300	2010	9
false	3	3	3	30	3.3	30.3	6093	09/02/10	3	2010-09-02T06:13:00.480	2010	9
false	3	3	3	30	3.3	30.3	6103	09/03/10	3	2010-09-03T06:23:00.930	2010	9
false	3	3	3	30	3.3	30.3	6113	09/04/10	3	2010-09-04T06:33:01.380	2010	9
false	3	3	3	30	3.3	30.3	6123	09/05/10	3	2010-09-05T06:43:01.830	2010	9
false	3	3	3	30	3.3	30.3	6133	09/06/10	3	2010-09-06T06:53:02.280	2010	9
false	3	3	3	30	3.3	30.3	6143	09/07/10	3	2010-09-07T07:03:02.730	2010	9
false	3	3	3	30	3.3	30.3	6153	09/08/10	3	2010-09-08T07:13:03.180	2010	9
false	3	3	3	30	3.3	30.3	6163	09/09/10	3	2010-09-09T07:23:03.630	2010	9
false	3	3	3	30	3.3	30.3	6173	09/10/10	3	2010-09-10T07:33:04.800	2010	9
false	3	3	3	30	3.3	30.3	6183	09/11/10	3	2010-09-11T07:43:04.530	2010	9
false	3	3	3	30	3.3	30.3	6193	09/12/10	3	2010-09-12T07:53:04.980	2010	9
false	3	3	3	30	3.3	30.3	6203	09/13/10	3	2010-09-13T08:03:05.430	2010	9
false	3	3	3	30	3.3	30.3	6213	09/14/10	3	2010-09-14T08:13:05.880	2010	9
false	3	3	3	30	3.3	30.3	6223	09/15/10	3	2010-09-15T08:23:06.330	2010	9
false	3	3	3	30	3.3	30.3	6233	09/16/10	3	2010-09-16T08:33:06.780	2010	9
false	3	3	3	30	3.3	30.3	6243	09/17/10	3	2010-09-17T08:43:07.230	2010	9
false	3	3	3	30	3.3	30.3	6253	09/18/10	3	2010-09-18T08:53:07.680	2010	9
false	3	3	3	30	3.3	30.3	6263	09/19/10	3	2010-09-19T09:03:08.130	2010	9
false	3	3	3	30	3.3	30.3	6273	09/20/10	3	2010-09-20T09:13:08.580	2010	9
false	3	3	3	30	3.3	30.3	6283	09/21/10	3	2010-09-21T09:23:09.300	2010	9
false	3	3	3	30	3.3	30.3	6293	09/22/10	3	2010-09-22T09:33:09.480	2010	9
false	3	3	3	30	3.3	30.3	6303	09/23/10	3	2010-09-23T09:43:09.930	2010	9
false	3	3	3	30	3.3	30.3	6313	09/24/10	3	2010-09-24T09:53:10.380	2010	9
false	3	3	3	30	3.3	30.3	6323	09/25/10	3	2010-09-25T10:03:10.830	2010	9
false	3	3	3	30	3.3	30.3	6333	09/26/10	3	2010-09-26T10:13:11.280	2010	9
false	3	3	3	30	3.3	30.3	6343	09/27/10	3	2010-09-27T10:23:11.730	2010	9
false	3	3	3	30	3.3	30.3	6353	09/28/10	3	2010-09-28T10:33:12.180	2010	9
false	3	3	3	30	3.3	30.3	6363	09/29/10	3	2010-09-29T10:43:12.630	2010	9
false	3	3	3	30	3.3	30.3	6373	09/30/10	3	2010-09-30T10:53:13.800	2010	9
false	3	3	3	30	3.3	30.3	6383	10/01/10	3	2010-10-01T06:03:00.300	2010	10
false	3	3	3	30	3.3	30.3	6393	10/02/10	3	2010-10-02T06:13:00.480	2010	10
false	3	3	3	30	3.3	30.3	6403	10/03/10	3	2010-10-03T06:23:00.930	2010	10
false	3	3	3	30	3.3	30.3	6413	10/04/10	3	2010-10-04T06:33:01.380	2010	10
false	3	3	3	30	3.3	30.3	6423	10/05/10	3	2010-10-05T06:43:01.830	2010	10
false	3	3	3	30	3.3	30.3	6433	10/06/10	3	2010-10-06T06:53:02.280	2010	10
false	3	3	3	30	3.3	30.3	6443	10/07/10	3	2010-10-07T07:03:02.730	2010	10
false	3	3	3	30	3.3	30.3	6453	10/08/10	3	2010-10-08T07:13:03.180	2010	10
false	3	3	3	30	3.3	30.3	6463	10/09/10	3	2010-10-09T07:23:03.630	2010	10
false	3	3	3	30	3.3	30.3	6473	10/10/10	3	2010-10-10T07:33:04.800	2010	10
false	3	3	3	30	3.3	30.3	6483	10/11/10	3	2010-10-11T07:43:04.530	2010	10
false	3	3	3	30	3.3	30.3	6493	10/12/10	3	2010-10-12T07:53:04.980	2010	10
false	3	3	3	30	3.3	30.3	6503	10/13/10	3	2010-10-13T08:03:05.430	2010	10
false	3	3	3	30	3.3	30.3	6513	10/14/10	3	2010-10-14T08:13:05.880	2010	10
false	3	3	3	30	3.3	30.3	6523	10/15/10	3	2010-10-15T08:23:06.330	2010	10
false	3	3	3	30	3.3	30.3	6533	10/16/10	3	2010-10-16T08:33:06.780	2010	10
false	3	3	3	30	3.3	30.3	6543	10/17/10	3	2010-10-17T08:43:07.230	2010	10
false	3	3	3	30	3.3	30.3	6553	10/18/10	3	2010-10-18T08:53:07.680	2010	10
false	3	3	3	30	3.3	30.3	6563	10/19/10	3	2010-10-19T09:03:08.130	2010	10
false	3	3	3	30	3.3	30.3	6573	10/20/10	3	2010-10-20T09:13:08.580	2010	10
false	3	3	3	30	3.3	30.3	6583	10/21/10	3	2010-10-21T09:23:09.300	2010	10
false	3	3	3	30	3.3	30.3	6593	10/22/10	3	2010-10-22T09:33:09.480	2010	10
false	3	3	3	30	3.3	30.3	6603	10/23/10	3	2010-10-23T09:43:09.930	2010	10
false	3	3	3	30	3.3	30.3	6613	10/24/10	3	2010-10-24T09:53:10.380	2010	10
false	3	3	3	30	3.3	30.3	6623	10/25/10	3	2010-10-25T10:03:10.830	2010	10
false	3	3	3	30	3.3	30.3	6633	10/26/10	3	2010-10-26T10:13:11.280	2010	10
false	3	3	3	30	3.3	30.3	6643	10/27/10	3	2010-10-27T10:23:11.730	2010	10
false	3	3	3	30	3.3	30.3	6653	10/28/10	3	2010-10-28T10:33:12.180	2010	10
false	3	3	3	30	3.3	30.3	6663	10/29/10	3	2010-10-29T10:43:12.630	2010	10
false	3	3	3	30	3.3	30.3	6673	10/30/10	3	2010-10-30T10:53:13.800	2010	10
false	3	3	3	30	3.3	30.3	6683	10/31/10	3	2010-10-31T12:03:13.530	2010	10
false	3	3	3	30	3.3	30.3	6693	11/01/10	3	2010-11-01T07:03:00.300	2010	11
false	3	3	3	30	3.3	30.3	6703	11/02/10	3	2010-11-02T07:13:00.480	2010	11
false	3	3	3	30	3.3	30.3	6713	11/03/10	3	2010-11-03T07:23:00.930	2010	11
false	3	3	3	30	3.3	30.3	6723	11/04/10	3	2010-11-04T07:33:01.380	2010	11
false	3	3	3	30	3.3	30.3	6733	11/05/10	3	2010-11-05T07:43:01.830	2010	11
false	3	3	3	30	3.3	30.3	6743	11/06/10	3	2010-11-06T07:53:02.280	2010	11
false	3	3	3	30	3.3	30.3	6753	11/07/10	3	2010-11-07T08:03:02.730	2010	11
false	3	3	3	30	3.3	30.3	6763	11/08/10	3	2010-11-08T08:13:03.180	2010	11
false	3	3	3	30	3.3	30.3	6773	11/09/10	3	2010-11-09T08:23:03.630	2010	11
false	3	3	3	30	3.3	30.3	6783	11/10/10	3	2010-11-10T08:33:04.800	2010	11
false	3	3	3	30	3.3	30.3	6793	11/11/10	3	2010-11-11T08:43:04.530	2010	11
false	3	3	3	30	3.3	30.3	6803	11/12/10	3	2010-11-12T08:53:04.980	2010	11
false	3	3	3	30	3.3	30.3	6813	11/13/10	3	2010-11-13T09:03:05.430	2010	11
false	3	3	3	30	3.3	30.3	6823	11/14/10	3	2010-11-14T09:13:05.880	2010	11
false	3	3	3	30	3.3	30.3	6833	11/15/10	3	2010-11-15T09:23:06.330	2010	11
false	3	3	3	30	3.3	30.3	6843	11/16/10	3	2010-11-16T09:33:06.780	2010	11
false	3	3	3	30	3.3	30.3	6853	11/17/10	3	2010-11-17T09:43:07.230	2010	11
false	3	3	3	30	3.3	30.3	6863	11/18/10	3	2010-11-18T09:53:07.680	2010	11
false	3	3	3	30	3.3	30.3	6873	11/19/10	3	2010-11-19T10:03:08.130	2010	11
false	3	3	3	30	3.3	30.3	6883	11/20/10	3	2010-11-20T10:13:08.580	2010	11
false	3	3	3	30	3.3	30.3	6893	11/21/10	3	2010-11-21T10:23:09.300	2010	11
false	3	3	3	30	3.3	30.3	6903	11/22/10	3	2010-11-22T10:33:09.480	2010	11
false	3	3	3	30	3.3	30.3	6913	11/23/10	3	2010-11-23T10:43:09.930	2010	11
false	3	3	3	30	3.3	30.3	6923	11/24/10	3	2010-11-24T10:53:10.380	2010	11
false	3	3	3	30	3.3	30.3	6933	11/25/10	3	2010-11-25T11:03:10.830	2010	11
false	3	3	3	30	3.3	30.3	6943	11/26/10	3	2010-11-26T11:13:11.280	2010	11
false	3	3	3	30	3.3	30.3	6953	11/27/10	3	2010-11-27T11:23:11.730	2010	11
false	3	3	3	30	3.3	30.3	6963	11/28/10	3	2010-11-28T11:33:12.180	2010	11
false	3	3	3	30	3.3	30.3	6973	11/29/10	3	2010-11-29T11:43:12.630	2010	11
false	3	3	3	30	3.3	30.3	6983	11/30/10	3	2010-11-30T11:53:13.800	2010	11
false	3	3	3	30	3.3	30.3	6993	12/01/10	3	2010-12-01T07:03:00.300	2010	12
false	3	3	3	30	3.3	30.3	7003	12/02/10	3	2010-12-02T07:13:00.480	2010	12
false	3	3	3	30	3.3	30.3	7013	12/03/10	3	2010-12-03T07:23:00.930	2010	12
false	3	3	3	30	3.3	30.3	7023	12/04/10	3	2010-12-04T07:33:01.380	2010	12
false	3	3	3	30	3.3	30.3	7033	12/05/10	3	2010-12-05T07:43:01.830	2010	12
false	3	3	3	30	3.3	30.3	7043	12/06/10	3	2010-12-06T07:53:02.280	2010	12
false	3	3	3	30	3.3	30.3	7053	12/07/10	3	2010-12-07T08:03:02.730	2010	12
false	3	3	3	30	3.3	30.3	7063	12/08/10	3	2010-12-08T08:13:03.180	2010	12
false	3	3	3	30	3.3	30.3	7073	12/09/10	3	2010-12-09T08:23:03.630	2010	12
false	3	3	3	30	3.3	30.3	7083	12/10/10	3	2010-12-10T08:33:04.800	2010	12
false	3	3	3	30	3.3	30.3	7093	12/11/10	3	2010-12-11T08:43:04.530	2010	12
false	3	3	3	30	3.3	30.3	7103	12/12/10	3	2010-12-12T08:53:04.980	2010	12
false	3	3	3	30	3.3	30.3	7113	12/13/10	3	2010-12-13T09:03:05.430	2010	12
false	3	3	3	30	3.3	30.3	7123	12/14/10	3	2010-12-14T09:13:05.880	2010	12
false	3	3	3	30	3.3	30.3	7133	12/15/10	3	2010-12-15T09:23:06.330	2010	12
false	3	3	3	30	3.3	30.3	7143	12/16/10	3	2010-12-16T09:33:06.780	2010	12
false	3	3	3	30	3.3	30.3	7153	12/17/10	3	2010-12-17T09:43:07.230	2010	12
false	3	3	3	30	3.3	30.3	7163	12/18/10	3	2010-12-18T09:53:07.680	2010	12
false	3	3	3	30	3.3	30.3	7173	12/19/10	3	2010-12-19T10:03:08.130	2010	12
false	3	3	3	30	3.3	30.3	7183	12/20/10	3	2010-12-20T10:13:08.580	2010	12
false	3	3	3	30	3.3	30.3	7193	12/21/10	3	2010-12-21T10:23:09.300	2010	12
false	3	3	3	30	3.3	30.3	7203	12/22/10	3	2010-12-22T10:33:09.480	2010	12
false	3	3	3	30	3.3	30.3	7213	12/23/10	3	2010-12-23T10:43:09.930	2010	12
false	3	3	3	30	3.3	30.3	7223	12/24/10	3	2010-12-24T10:53:10.380	2010	12
false	3	3	3	30	3.3	30.3	7233	12/25/10	3	2010-12-25T11:03:10.830	2010	12
false	3	3	3	30	3.3	30.3	7243	12/26/10	3	2010-12-26T11:13:11.280	2010	12
false	3	3	3	30	3.3	30.3	7253	12/27/10	3	2010-12-27T11:23:11.730	2010	12
false	3	3	3	30	3.3	30.3	7263	12/28/10	3	2010-12-28T11:33:12.180	2010	12
false	3	3	3	30	3.3	30.3	7273	12/29/10	3	2010-12-29T11:43:12.630	2010	12
false	3	3	3	30	3.3	30.3	7283	12/30/10	3	2010-12-30T11:53:13.800	2010	12
false	3	3	3	30	3.3	30.3	7293	12/31/10	3	2010-12-31T12:03:13.530	2010	12
false	5	5	5	50	5.5	50.5	2305	08/19/09	5	2009-08-19T09:05:08.200	2009	8
false	5	5	5	50	5.5	50.5	2315	08/20/09	5	2009-08-20T09:15:08.650	2009	8
false	5	5	5	50	5.5	50.5	2325	08/21/09	5	2009-08-21T09:25:09.100	2009	8
false	5	5	5	50	5.5	50.5	2335	08/22/09	5	2009-08-22T09:35:09.550	2009	8
false	5	5	5	50	5.5	50.5	2345	08/23/09	5	2009-08-23T09:45:10	2009	8
false	5	5	5	50	5.5	50.5	2355	08/24/09	5	2009-08-24T09:55:10.450	2009	8
false	5	5	5	50	5.5	50.5	2365	08/25/09	5	2009-08-25T10:05:10.900	2009	8
false	5	5	5	50	5.5	50.5	2375	08/26/09	5	2009-08-26T10:15:11.350	2009	8
false	5	5	5	50	5.5	50.5	2385	08/27/09	5	2009-08-27T10:25:11.800	2009	8
false	5	5	5	50	5.5	50.5	2395	08/28/09	5	2009-08-28T10:35:12.250	2009	8
false	5	5	5	50	5.5	50.5	2405	08/29/09	5	2009-08-29T10:45:12.700	2009	8
false	5	5	5	50	5.5	50.5	2415	08/30/09	5	2009-08-30T10:55:13.150	2009	8
false	5	5	5	50	5.5	50.5	2425	08/31/09	5	2009-08-31T11:05:13.600	2009	8
false	5	5	5	50	5.5	50.5	2435	09/01/09	5	2009-09-01T06:05:00.100	2009	9
false	5	5	5	50	5.5	50.5	2445	09/02/09	5	2009-09-02T06:15:00.550	2009	9
false	5	5	5	50	5.5	50.5	2455	09/03/09	5	2009-09-03T06:25:01	2009	9
false	5	5	5	50	5.5	50.5	2465	09/04/09	5	2009-09-04T06:35:01.450	2009	9
false	5	5	5	50	5.5	50.5	2475	09/05/09	5	2009-09-05T06:45:01.900	2009	9
false	5	5	5	50	5.5	50.5	2485	09/06/09	5	2009-09-06T06:55:02.350	2009	9
false	5	5	5	50	5.5	50.5	2495	09/07/09	5	2009-09-07T07:05:02.800	2009	9
false	5	5	5	50	5.5	50.5	2505	09/08/09	5	2009-09-08T07:15:03.250	2009	9
false	5	5	5	50	5.5	50.5	2515	09/09/09	5	2009-09-09T07:25:03.700	2009	9
false	5	5	5	50	5.5	50.5	2525	09/10/09	5	2009-09-10T07:35:04.150	2009	9
false	5	5	5	50	5.5	50.5	2535	09/11/09	5	2009-09-11T07:45:04.600	2009	9
false	5	5	5	50	5.5	50.5	2545	09/12/09	5	2009-09-12T07:55:05.500	2009	9
false	5	5	5	50	5.5	50.5	2555	09/13/09	5	2009-09-13T08:05:05.500	2009	9
false	5	5	5	50	5.5	50.5	2565	09/14/09	5	2009-09-14T08:15:05.950	2009	9
false	5	5	5	50	5.5	50.5	2575	09/15/09	5	2009-09-15T08:25:06.400	2009	9
false	5	5	5	50	5.5	50.5	2585	09/16/09	5	2009-09-16T08:35:06.850	2009	9
false	5	5	5	50	5.5	50.5	2595	09/17/09	5	2009-09-17T08:45:07.300	2009	9
false	5	5	5	50	5.5	50.5	2605	09/18/09	5	2009-09-18T08:55:07.750	2009	9
false	5	5	5	50	5.5	50.5	2615	09/19/09	5	2009-09-19T09:05:08.200	2009	9
false	5	5	5	50	5.5	50.5	2625	09/20/09	5	2009-09-20T09:15:08.650	2009	9
false	5	5	5	50	5.5	50.5	2635	09/21/09	5	2009-09-21T09:25:09.100	2009	9
false	5	5	5	50	5.5	50.5	2645	09/22/09	5	2009-09-22T09:35:09.550	2009	9
false	5	5	5	50	5.5	50.5	2655	09/23/09	5	2009-09-23T09:45:10	2009	9
false	5	5	5	50	5.5	50.5	2665	09/24/09	5	2009-09-24T09:55:10.450	2009	9
false	5	5	5	50	5.5	50.5	2675	09/25/09	5	2009-09-25T10:05:10.900	2009	9
false	5	5	5	50	5.5	50.5	2685	09/26/09	5	2009-09-26T10:15:11.350	2009	9
false	5	5	5	50	5.5	50.5	2695	09/27/09	5	2009-09-27T10:25:11.800	2009	9
false	5	5	5	50	5.5	50.5	2705	09/28/09	5	2009-09-28T10:35:12.250	2009	9
false	5	5	5	50	5.5	50.5	2715	09/29/09	5	2009-09-29T10:45:12.700	2009	9
false	5	5	5	50	5.5	50.5	2725	09/30/09	5	2009-09-30T10:55:13.150	2009	9
false	5	5	5	50	5.5	50.5	2735	10/01/09	5	2009-10-01T06:05:00.100	2009	10
false	5	5	5	50	5.5	50.5	2745	10/02/09	5	2009-10-02T06:15:00.550	2009	10
false	5	5	5	50	5.5	50.5	2755	10/03/09	5	2009-10-03T06:25:01	2009	10
false	5	5	5	50	5.5	50.5	2765	10/04/09	5	2009-10-04T06:35:01.450	2009	10
false	5	5	5	50	5.5	50.5	2775	10/05/09	5	2009-10-05T06:45:01.900	2009	10
false	5	5	5	50	5.5	50.5	2785	10/06/09	5	2009-10-06T06:55:02.350	2009	10
false	5	5	5	50	5.5	50.5	2795	10/07/09	5	2009-10-07T07:05:02.800	2009	10
false	5	5	5	50	5.5	50.5	2805	10/08/09	5	2009-10-08T07:15:03.250	2009	10
false	5	5	5	50	5.5	50.5	2815	10/09/09	5	2009-10-09T07:25:03.700	2009	10
false	5	5	5	50	5.5	50.5	2825	10/10/09	5	2009-10-10T07:35:04.150	2009	10
false	5	5	5	50	5.5	50.5	2835	10/11/09	5	2009-10-11T07:45:04.600	2009	10
false	5	5	5	50	5.5	50.5	2845	10/12/09	5	2009-10-12T07:55:05.500	2009	10
false	5	5	5	50	5.5	50.5	2855	10/13/09	5	2009-10-13T08:05:05.500	2009	10
false	5	5	5	50	5.5	50.5	2865	10/14/09	5	2009-10-14T08:15:05.950	2009	10
false	5	5	5	50	5.5	50.5	2875	10/15/09	5	2009-10-15T08:25:06.400	2009	10
false	5	5	5	50	5.5	50.5	2885	10/16/09	5	2009-10-16T08:35:06.850	2009	10
false	5	5	5	50	5.5	50.5	2895	10/17/09	5	2009-10-17T08:45:07.300	2009	10
false	5	5	5	50	5.5	50.5	2905	10/18/09	5	2009-10-18T08:55:07.750	2009	10
false	5	5	5	50	5.5	50.5	2915	10/19/09	5	2009-10-19T09:05:08.200	2009	10
false	5	5	5	50	5.5	50.5	2925	10/20/09	5	2009-10-20T09:15:08.650	2009	10
false	5	5	5	50	5.5	50.5	2935	10/21/09	5	2009-10-21T09:25:09.100	2009	10
false	5	5	5	50	5.5	50.5	2945	10/22/09	5	2009-10-22T09:35:09.550	2009	10
false	5	5	5	50	5.5	50.5	2955	10/23/09	5	2009-10-23T09:45:10	2009	10
false	5	5	5	50	5.5	50.5	2965	10/24/09	5	2009-10-24T09:55:10.450	2009	10
false	5	5	5	50	5.5	50.5	2975	10/25/09	5	2009-10-25T11:05:10.900	2009	10
false	5	5	5	50	5.5	50.5	2985	10/26/09	5	2009-10-26T11:15:11.350	2009	10
false	5	5	5	50	5.5	50.5	2995	10/27/09	5	2009-10-27T11:25:11.800	2009	10
false	5	5	5	50	5.5	50.5	3005	10/28/09	5	2009-10-28T11:35:12.250	2009	10
false	5	5	5	50	5.5	50.5	3015	10/29/09	5	2009-10-29T11:45:12.700	2009	10
false	5	5	5	50	5.5	50.5	3025	10/30/09	5	2009-10-30T11:55:13.150	2009	10
false	5	5	5	50	5.5	50.5	3035	10/31/09	5	2009-10-31T12:05:13.600	2009	10
false	5	5	5	50	5.5	50.5	3045	11/01/09	5	2009-11-01T07:05:00.100	2009	11
false	5	5	5	50	5.5	50.5	3055	11/02/09	5	2009-11-02T07:15:00.550	2009	11
false	5	5	5	50	5.5	50.5	3065	11/03/09	5	2009-11-03T07:25:01	2009	11
false	5	5	5	50	5.5	50.5	3075	11/04/09	5	2009-11-04T07:35:01.450	2009	11
false	5	5	5	50	5.5	50.5	3085	11/05/09	5	2009-11-05T07:45:01.900	2009	11
false	5	5	5	50	5.5	50.5	3095	11/06/09	5	2009-11-06T07:55:02.350	2009	11
false	5	5	5	50	5.5	50.5	3105	11/07/09	5	2009-11-07T08:05:02.800	2009	11
false	5	5	5	50	5.5	50.5	3115	11/08/09	5	2009-11-08T08:15:03.250	2009	11
false	5	5	5	50	5.5	50.5	3125	11/09/09	5	2009-11-09T08:25:03.700	2009	11
false	5	5	5	50	5.5	50.5	3135	11/10/09	5	2009-11-10T08:35:04.150	2009	11
false	5	5	5	50	5.5	50.5	3145	11/11/09	5	2009-11-11T08:45:04.600	2009	11
false	5	5	5	50	5.5	50.5	3155	11/12/09	5	2009-11-12T08:55:05.500	2009	11
false	5	5	5	50	5.5	50.5	3165	11/13/09	5	2009-11-13T09:05:05.500	2009	11
false	5	5	5	50	5.5	50.5	3175	11/14/09	5	2009-11-14T09:15:05.950	2009	11
false	5	5	5	50	5.5	50.5	3185	11/15/09	5	2009-11-15T09:25:06.400	2009	11
false	5	5	5	50	5.5	50.5	3195	11/16/09	5	2009-11-16T09:35:06.850	2009	11
false	5	5	5	50	5.5	50.5	3205	11/17/09	5	2009-11-17T09:45:07.300	2009	11
false	5	5	5	50	5.5	50.5	3215	11/18/09	5	2009-11-18T09:55:07.750	2009	11
false	5	5	5	50	5.5	50.5	3225	11/19/09	5	2009-11-19T10:05:08.200	2009	11
false	5	5	5	50	5.5	50.5	3235	11/20/09	5	2009-11-20T10:15:08.650	2009	11
false	5	5	5	50	5.5	50.5	3245	11/21/09	5	2009-11-21T10:25:09.100	2009	11
false	5	5	5	50	5.5	50.5	3255	11/22/09	5	2009-11-22T10:35:09.550	2009	11
false	5	5	5	50	5.5	50.5	3265	11/23/09	5	2009-11-23T10:45:10	2009	11
false	5	5	5	50	5.5	50.5	3275	11/24/09	5	2009-11-24T10:55:10.450	2009	11
false	5	5	5	50	5.5	50.5	3285	11/25/09	5	2009-11-25T11:05:10.900	2009	11
false	5	5	5	50	5.5	50.5	3295	11/26/09	5	2009-11-26T11:15:11.350	2009	11
false	5	5	5	50	5.5	50.5	3305	11/27/09	5	2009-11-27T11:25:11.800	2009	11
false	5	5	5	50	5.5	50.5	3315	11/28/09	5	2009-11-28T11:35:12.250	2009	11
false	5	5	5	50	5.5	50.5	3325	11/29/09	5	2009-11-29T11:45:12.700	2009	11
false	5	5	5	50	5.5	50.5	3335	11/30/09	5	2009-11-30T11:55:13.150	2009	11
false	5	5	5	50	5.5	50.5	3345	12/01/09	5	2009-12-01T07:05:00.100	2009	12
false	5	5	5	50	5.5	50.5	3355	12/02/09	5	2009-12-02T07:15:00.550	2009	12
false	5	5	5	50	5.5	50.5	3365	12/03/09	5	2009-12-03T07:25:01	2009	12
false	5	5	5	50	5.5	50.5	3375	12/04/09	5	2009-12-04T07:35:01.450	2009	12
false	5	5	5	50	5.5	50.5	3385	12/05/09	5	2009-12-05T07:45:01.900	2009	12
false	5	5	5	50	5.5	50.5	3395	12/06/09	5	2009-12-06T07:55:02.350	2009	12
false	5	5	5	50	5.5	50.5	3405	12/07/09	5	2009-12-07T08:05:02.800	2009	12
false	5	5	5	50	5.5	50.5	3415	12/08/09	5	2009-12-08T08:15:03.250	2009	12
false	5	5	5	50	5.5	50.5	3425	12/09/09	5	2009-12-09T08:25:03.700	2009	12
false	5	5	5	50	5.5	50.5	3435	12/10/09	5	2009-12-10T08:35:04.150	2009	12
false	5	5	5	50	5.5	50.5	3445	12/11/09	5	2009-12-11T08:45:04.600	2009	12
false	5	5	5	50	5.5	50.5	3455	12/12/09	5	2009-12-12T08:55:05.500	2009	12
false	5	5	5	50	5.5	50.5	3465	12/13/09	5	2009-12-13T09:05:05.500	2009	12
false	5	5	5	50	5.5	50.5	3475	12/14/09	5	2009-12-14T09:15:05.950	2009	12
false	5	5	5	50	5.5	50.5	3485	12/15/09	5	2009-12-15T09:25:06.400	2009	12
false	5	5	5	50	5.5	50.5	3495	12/16/09	5	2009-12-16T09:35:06.850	2009	12
false	5	5	5	50	5.5	50.5	3505	12/17/09	5	2009-12-17T09:45:07.300	2009	12
false	5	5	5	50	5.5	50.5	3515	12/18/09	5	2009-12-18T09:55:07.750	2009	12
false	5	5	5	50	5.5	50.5	3525	12/19/09	5	2009-12-19T10:05:08.200	2009	12
false	5	5	5	50	5.5	50.5	3535	12/20/09	5	2009-12-20T10:15:08.650	2009	12
false	5	5	5	50	5.5	50.5	3545	12/21/09	5	2009-12-21T10:25:09.100	2009	12
false	5	5	5	50	5.5	50.5	3555	12/22/09	5	2009-12-22T10:35:09.550	2009	12
false	5	5	5	50	5.5	50.5	3565	12/23/09	5	2009-12-23T10:45:10	2009	12
false	5	5	5	50	5.5	50.5	3575	12/24/09	5	2009-12-24T10:55:10.450	2009	12
false	5	5	5	50	5.5	50.5	3585	12/25/09	5	2009-12-25T11:05:10.900	2009	12
false	5	5	5	50	5.5	50.5	3595	12/26/09	5	2009-12-26T11:15:11.350	2009	12
false	5	5	5	50	5.5	50.5	3605	12/27/09	5	2009-12-27T11:25:11.800	2009	12
false	5	5	5	50	5.5	50.5	3615	12/28/09	5	2009-12-28T11:35:12.250	2009	12
false	5	5	5	50	5.5	50.5	3625	12/29/09	5	2009-12-29T11:45:12.700	2009	12
false	5	5	5	50	5.5	50.5	3635	12/30/09	5	2009-12-30T11:55:13.150	2009	12
false	5	5	5	50	5.5	50.5	3645	12/31/09	5	2009-12-31T12:05:13.600	2009	12
false	5	5	5	50	5.5	50.5	3655	01/01/10	5	2010-01-01T07:05:00.100	2010	1
false	5	5	5	50	5.5	50.5	3665	01/02/10	5	2010-01-02T07:15:00.550	2010	1
false	5	5	5	50	5.5	50.5	3675	01/03/10	5	2010-01-03T07:25:01	2010	1
false	5	5	5	50	5.5	50.5	3685	01/04/10	5	2010-01-04T07:35:01.450	2010	1
false	5	5	5	50	5.5	50.5	3695	01/05/10	5	2010-01-05T07:45:01.900	2010	1
false	5	5	5	50	5.5	50.5	3705	01/06/10	5	2010-01-06T07:55:02.350	2010	1
false	5	5	5	50	5.5	50.5	3715	01/07/10	5	2010-01-07T08:05:02.800	2010	1
false	5	5	5	50	5.5	50.5	3725	01/08/10	5	2010-01-08T08:15:03.250	2010	1
false	5	5	5	50	5.5	50.5	3735	01/09/10	5	2010-01-09T08:25:03.700	2010	1
false	5	5	5	50	5.5	50.5	3745	01/10/10	5	2010-01-10T08:35:04.150	2010	1
false	5	5	5	50	5.5	50.5	3755	01/11/10	5	2010-01-11T08:45:04.600	2010	1
false	5	5	5	50	5.5	50.5	3765	01/12/10	5	2010-01-12T08:55:05.500	2010	1
false	5	5	5	50	5.5	50.5	3775	01/13/10	5	2010-01-13T09:05:05.500	2010	1
false	5	5	5	50	5.5	50.5	3785	01/14/10	5	2010-01-14T09:15:05.950	2010	1
false	5	5	5	50	5.5	50.5	3795	01/15/10	5	2010-01-15T09:25:06.400	2010	1
false	5	5	5	50	5.5	50.5	3805	01/16/10	5	2010-01-16T09:35:06.850	2010	1
false	5	5	5	50	5.5	50.5	3815	01/17/10	5	2010-01-17T09:45:07.300	2010	1
false	5	5	5	50	5.5	50.5	3825	01/18/10	5	2010-01-18T09:55:07.750	2010	1
false	5	5	5	50	5.5	50.5	3835	01/19/10	5	2010-01-19T10:05:08.200	2010	1
false	5	5	5	50	5.5	50.5	3845	01/20/10	5	2010-01-20T10:15:08.650	2010	1
false	5	5	5	50	5.5	50.5	3855	01/21/10	5	2010-01-21T10:25:09.100	2010	1
false	5	5	5	50	5.5	50.5	3865	01/22/10	5	2010-01-22T10:35:09.550	2010	1
false	5	5	5	50	5.5	50.5	3875	01/23/10	5	2010-01-23T10:45:10	2010	1
false	5	5	5	50	5.5	50.5	3885	01/24/10	5	2010-01-24T10:55:10.450	2010	1
false	5	5	5	50	5.5	50.5	3895	01/25/10	5	2010-01-25T11:05:10.900	2010	1
false	5	5	5	50	5.5	50.5	3905	01/26/10	5	2010-01-26T11:15:11.350	2010	1
false	5	5	5	50	5.5	50.5	3915	01/27/10	5	2010-01-27T11:25:11.800	2010	1
false	5	5	5	50	5.5	50.5	3925	01/28/10	5	2010-01-28T11:35:12.250	2010	1
false	5	5	5	50	5.5	50.5	3935	01/29/10	5	2010-01-29T11:45:12.700	2010	1
false	5	5	5	50	5.5	50.5	3945	01/30/10	5	2010-01-30T11:55:13.150	2010	1
false	5	5	5	50	5.5	50.5	3955	01/31/10	5	2010-01-31T12:05:13.600	2010	1
false	5	5	5	50	5.5	50.5	3965	02/01/10	5	2010-02-01T07:05:00.100	2010	2
false	5	5	5	50	5.5	50.5	3975	02/02/10	5	2010-02-02T07:15:00.550	2010	2
false	5	5	5	50	5.5	50.5	3985	02/03/10	5	2010-02-03T07:25:01	2010	2
false	5	5	5	50	5.5	50.5	3995	02/04/10	5	2010-02-04T07:35:01.450	2010	2
false	5	5	5	50	5.5	50.5	4005	02/05/10	5	2010-02-05T07:45:01.900	2010	2
false	5	5	5	50	5.5	50.5	4015	02/06/10	5	2010-02-06T07:55:02.350	2010	2
false	5	5	5	50	5.5	50.5	4025	02/07/10	5	2010-02-07T08:05:02.800	2010	2
false	5	5	5	50	5.5	50.5	4035	02/08/10	5	2010-02-08T08:15:03.250	2010	2
false	5	5	5	50	5.5	50.5	4045	02/09/10	5	2010-02-09T08:25:03.700	2010	2
false	5	5	5	50	5.5	50.5	4055	02/10/10	5	2010-02-10T08:35:04.150	2010	2
false	5	5	5	50	5.5	50.5	4065	02/11/10	5	2010-02-11T08:45:04.600	2010	2
false	5	5	5	50	5.5	50.5	4075	02/12/10	5	2010-02-12T08:55:05.500	2010	2
false	5	5	5	50	5.5	50.5	4085	02/13/10	5	2010-02-13T09:05:05.500	2010	2
false	5	5	5	50	5.5	50.5	4095	02/14/10	5	2010-02-14T09:15:05.950	2010	2
false	5	5	5	50	5.5	50.5	4105	02/15/10	5	2010-02-15T09:25:06.400	2010	2
false	5	5	5	50	5.5	50.5	4115	02/16/10	5	2010-02-16T09:35:06.850	2010	2
false	5	5	5	50	5.5	50.5	4125	02/17/10	5	2010-02-17T09:45:07.300	2010	2
false	5	5	5	50	5.5	50.5	4135	02/18/10	5	2010-02-18T09:55:07.750	2010	2
false	5	5	5	50	5.5	50.5	4145	02/19/10	5	2010-02-19T10:05:08.200	2010	2
false	5	5	5	50	5.5	50.5	4155	02/20/10	5	2010-02-20T10:15:08.650	2010	2
false	5	5	5	50	5.5	50.5	4165	02/21/10	5	2010-02-21T10:25:09.100	2010	2
false	5	5	5	50	5.5	50.5	4175	02/22/10	5	2010-02-22T10:35:09.550	2010	2
false	5	5	5	50	5.5	50.5	4185	02/23/10	5	2010-02-23T10:45:10	2010	2
false	5	5	5	50	5.5	50.5	4195	02/24/10	5	2010-02-24T10:55:10.450	2010	2
false	5	5	5	50	5.5	50.5	4205	02/25/10	5	2010-02-25T11:05:10.900	2010	2
false	5	5	5	50	5.5	50.5	4215	02/26/10	5	2010-02-26T11:15:11.350	2010	2
false	5	5	5	50	5.5	50.5	4225	02/27/10	5	2010-02-27T11:25:11.800	2010	2
false	5	5	5	50	5.5	50.5	4235	02/28/10	5	2010-02-28T11:35:12.250	2010	2
false	5	5	5	50	5.5	50.5	4245	03/01/10	5	2010-03-01T07:05:00.100	2010	3
false	5	5	5	50	5.5	50.5	4255	03/02/10	5	2010-03-02T07:15:00.550	2010	3
false	5	5	5	50	5.5	50.5	4265	03/03/10	5	2010-03-03T07:25:01	2010	3
false	5	5	5	50	5.5	50.5	4275	03/04/10	5	2010-03-04T07:35:01.450	2010	3
false	5	5	5	50	5.5	50.5	4285	03/05/10	5	2010-03-05T07:45:01.900	2010	3
false	5	5	5	50	5.5	50.5	4295	03/06/10	5	2010-03-06T07:55:02.350	2010	3
false	5	5	5	50	5.5	50.5	4305	03/07/10	5	2010-03-07T08:05:02.800	2010	3
false	5	5	5	50	5.5	50.5	4315	03/08/10	5	2010-03-08T08:15:03.250	2010	3
false	5	5	5	50	5.5	50.5	4325	03/09/10	5	2010-03-09T08:25:03.700	2010	3
false	5	5	5	50	5.5	50.5	4335	03/10/10	5	2010-03-10T08:35:04.150	2010	3
false	5	5	5	50	5.5	50.5	4345	03/11/10	5	2010-03-11T08:45:04.600	2010	3
false	5	5	5	50	5.5	50.5	4355	03/12/10	5	2010-03-12T08:55:05.500	2010	3
false	5	5	5	50	5.5	50.5	4365	03/13/10	5	2010-03-13T09:05:05.500	2010	3
false	5	5	5	50	5.5	50.5	4375	03/14/10	5	2010-03-14T08:15:05.950	2010	3
false	5	5	5	50	5.5	50.5	4385	03/15/10	5	2010-03-15T08:25:06.400	2010	3
false	5	5	5	50	5.5	50.5	4395	03/16/10	5	2010-03-16T08:35:06.850	2010	3
false	5	5	5	50	5.5	50.5	4405	03/17/10	5	2010-03-17T08:45:07.300	2010	3
false	5	5	5	50	5.5	50.5	4415	03/18/10	5	2010-03-18T08:55:07.750	2010	3
false	5	5	5	50	5.5	50.5	4425	03/19/10	5	2010-03-19T09:05:08.200	2010	3
false	5	5	5	50	5.5	50.5	4435	03/20/10	5	2010-03-20T09:15:08.650	2010	3
false	5	5	5	50	5.5	50.5	4445	03/21/10	5	2010-03-21T09:25:09.100	2010	3
false	5	5	5	50	5.5	50.5	4455	03/22/10	5	2010-03-22T09:35:09.550	2010	3
false	5	5	5	50	5.5	50.5	4465	03/23/10	5	2010-03-23T09:45:10	2010	3
false	5	5	5	50	5.5	50.5	4475	03/24/10	5	2010-03-24T09:55:10.450	2010	3
false	5	5	5	50	5.5	50.5	4485	03/25/10	5	2010-03-25T10:05:10.900	2010	3
false	5	5	5	50	5.5	50.5	4495	03/26/10	5	2010-03-26T10:15:11.350	2010	3
false	5	5	5	50	5.5	50.5	4505	03/27/10	5	2010-03-27T10:25:11.800	2010	3
false	5	5	5	50	5.5	50.5	4515	03/28/10	5	2010-03-28T09:35:12.250	2010	3
false	5	5	5	50	5.5	50.5	4525	03/29/10	5	2010-03-29T09:45:12.700	2010	3
false	5	5	5	50	5.5	50.5	4535	03/30/10	5	2010-03-30T09:55:13.150	2010	3
false	5	5	5	50	5.5	50.5	4545	03/31/10	5	2010-03-31T10:05:13.600	2010	3
false	5	5	5	50	5.5	50.5	4555	04/01/10	5	2010-04-01T06:05:00.100	2010	4
false	5	5	5	50	5.5	50.5	4565	04/02/10	5	2010-04-02T06:15:00.550	2010	4
false	5	5	5	50	5.5	50.5	4575	04/03/10	5	2010-04-03T06:25:01	2010	4
false	5	5	5	50	5.5	50.5	4585	04/04/10	5	2010-04-04T06:35:01.450	2010	4
false	5	5	5	50	5.5	50.5	4595	04/05/10	5	2010-04-05T06:45:01.900	2010	4
false	5	5	5	50	5.5	50.5	4605	04/06/10	5	2010-04-06T06:55:02.350	2010	4
false	5	5	5	50	5.5	50.5	4615	04/07/10	5	2010-04-07T07:05:02.800	2010	4
false	5	5	5	50	5.5	50.5	4625	04/08/10	5	2010-04-08T07:15:03.250	2010	4
false	5	5	5	50	5.5	50.5	4635	04/09/10	5	2010-04-09T07:25:03.700	2010	4
false	5	5	5	50	5.5	50.5	4645	04/10/10	5	2010-04-10T07:35:04.150	2010	4
false	5	5	5	50	5.5	50.5	4655	04/11/10	5	2010-04-11T07:45:04.600	2010	4
false	5	5	5	50	5.5	50.5	4665	04/12/10	5	2010-04-12T07:55:05.500	2010	4
false	5	5	5	50	5.5	50.5	4675	04/13/10	5	2010-04-13T08:05:05.500	2010	4
false	5	5	5	50	5.5	50.5	4685	04/14/10	5	2010-04-14T08:15:05.950	2010	4
false	5	5	5	50	5.5	50.5	4695	04/15/10	5	2010-04-15T08:25:06.400	2010	4
false	5	5	5	50	5.5	50.5	4705	04/16/10	5	2010-04-16T08:35:06.850	2010	4
false	5	5	5	50	5.5	50.5	4715	04/17/10	5	2010-04-17T08:45:07.300	2010	4
false	5	5	5	50	5.5	50.5	4725	04/18/10	5	2010-04-18T08:55:07.750	2010	4
false	5	5	5	50	5.5	50.5	4735	04/19/10	5	2010-04-19T09:05:08.200	2010	4
false	5	5	5	50	5.5	50.5	4745	04/20/10	5	2010-04-20T09:15:08.650	2010	4
false	5	5	5	50	5.5	50.5	4755	04/21/10	5	2010-04-21T09:25:09.100	2010	4
false	5	5	5	50	5.5	50.5	4765	04/22/10	5	2010-04-22T09:35:09.550	2010	4
false	5	5	5	50	5.5	50.5	4775	04/23/10	5	2010-04-23T09:45:10	2010	4
false	5	5	5	50	5.5	50.5	4785	04/24/10	5	2010-04-24T09:55:10.450	2010	4
false	5	5	5	50	5.5	50.5	4795	04/25/10	5	2010-04-25T10:05:10.900	2010	4
false	5	5	5	50	5.5	50.5	4805	04/26/10	5	2010-04-26T10:15:11.350	2010	4
false	5	5	5	50	5.5	50.5	4815	04/27/10	5	2010-04-27T10:25:11.800	2010	4
false	5	5	5	50	5.5	50.5	4825	04/28/10	5	2010-04-28T10:35:12.250	2010	4
false	5	5	5	50	5.5	50.5	4835	04/29/10	5	2010-04-29T10:45:12.700	2010	4
false	5	5	5	50	5.5	50.5	4845	04/30/10	5	2010-04-30T10:55:13.150	2010	4
false	5	5	5	50	5.5	50.5	4855	05/01/10	5	2010-05-01T06:05:00.100	2010	5
false	5	5	5	50	5.5	50.5	4865	05/02/10	5	2010-05-02T06:15:00.550	2010	5
false	5	5	5	50	5.5	50.5	4875	05/03/10	5	2010-05-03T06:25:01	2010	5
false	5	5	5	50	5.5	50.5	4885	05/04/10	5	2010-05-04T06:35:01.450	2010	5
false	5	5	5	50	5.5	50.5	4895	05/05/10	5	2010-05-05T06:45:01.900	2010	5
false	5	5	5	50	5.5	50.5	4905	05/06/10	5	2010-05-06T06:55:02.350	2010	5
false	5	5	5	50	5.5	50.5	4915	05/07/10	5	2010-05-07T07:05:02.800	2010	5
false	5	5	5	50	5.5	50.5	4925	05/08/10	5	2010-05-08T07:15:03.250	2010	5
false	5	5	5	50	5.5	50.5	4935	05/09/10	5	2010-05-09T07:25:03.700	2010	5
false	5	5	5	50	5.5	50.5	4945	05/10/10	5	2010-05-10T07:35:04.150	2010	5
false	5	5	5	50	5.5	50.5	4955	05/11/10	5	2010-05-11T07:45:04.600	2010	5
false	5	5	5	50	5.5	50.5	4965	05/12/10	5	2010-05-12T07:55:05.500	2010	5
false	5	5	5	50	5.5	50.5	4975	05/13/10	5	2010-05-13T08:05:05.500	2010	5
false	5	5	5	50	5.5	50.5	4985	05/14/10	5	2010-05-14T08:15:05.950	2010	5
false	5	5	5	50	5.5	50.5	4995	05/15/10	5	2010-05-15T08:25:06.400	2010	5
false	5	5	5	50	5.5	50.5	5005	05/16/10	5	2010-05-16T08:35:06.850	2010	5
false	5	5	5	50	5.5	50.5	5015	05/17/10	5	2010-05-17T08:45:07.300	2010	5
false	5	5	5	50	5.5	50.5	5025	05/18/10	5	2010-05-18T08:55:07.750	2010	5
false	5	5	5	50	5.5	50.5	5035	05/19/10	5	2010-05-19T09:05:08.200	2010	5
false	5	5	5	50	5.5	50.5	5045	05/20/10	5	2010-05-20T09:15:08.650	2010	5
false	5	5	5	50	5.5	50.5	5055	05/21/10	5	2010-05-21T09:25:09.100	2010	5
false	5	5	5	50	5.5	50.5	5065	05/22/10	5	2010-05-22T09:35:09.550	2010	5
false	5	5	5	50	5.5	50.5	5075	05/23/10	5	2010-05-23T09:45:10	2010	5
false	5	5	5	50	5.5	50.5	5085	05/24/10	5	2010-05-24T09:55:10.450	2010	5
false	5	5	5	50	5.5	50.5	5095	05/25/10	5	2010-05-25T10:05:10.900	2010	5
false	5	5	5	50	5.5	50.5	5105	05/26/10	5	2010-05-26T10:15:11.350	2010	5
false	5	5	5	50	5.5	50.5	5115	05/27/10	5	2010-05-27T10:25:11.800	2010	5
false	5	5	5	50	5.5	50.5	5125	05/28/10	5	2010-05-28T10:35:12.250	2010	5
false	5	5	5	50	5.5	50.5	5135	05/29/10	5	2010-05-29T10:45:12.700	2010	5
false	5	5	5	50	5.5	50.5	5145	05/30/10	5	2010-05-30T10:55:13.150	2010	5
false	5	5	5	50	5.5	50.5	5155	05/31/10	5	2010-05-31T11:05:13.600	2010	5
false	5	5	5	50	5.5	50.5	5165	06/01/10	5	2010-06-01T06:05:00.100	2010	6
false	5	5	5	50	5.5	50.5	5175	06/02/10	5	2010-06-02T06:15:00.550	2010	6
false	5	5	5	50	5.5	50.5	5185	06/03/10	5	2010-06-03T06:25:01	2010	6
false	5	5	5	50	5.5	50.5	5195	06/04/10	5	2010-06-04T06:35:01.450	2010	6
false	5	5	5	50	5.5	50.5	5205	06/05/10	5	2010-06-05T06:45:01.900	2010	6
false	5	5	5	50	5.5	50.5	5215	06/06/10	5	2010-06-06T06:55:02.350	2010	6
false	5	5	5	50	5.5	50.5	5225	06/07/10	5	2010-06-07T07:05:02.800	2010	6
false	5	5	5	50	5.5	50.5	5235	06/08/10	5	2010-06-08T07:15:03.250	2010	6
false	5	5	5	50	5.5	50.5	5245	06/09/10	5	2010-06-09T07:25:03.700	2010	6
false	5	5	5	50	5.5	50.5	5255	06/10/10	5	2010-06-10T07:35:04.150	2010	6
false	5	5	5	50	5.5	50.5	5265	06/11/10	5	2010-06-11T07:45:04.600	2010	6
false	5	5	5	50	5.5	50.5	5275	06/12/10	5	2010-06-12T07:55:05.500	2010	6
false	5	5	5	50	5.5	50.5	5285	06/13/10	5	2010-06-13T08:05:05.500	2010	6
false	5	5	5	50	5.5	50.5	5295	06/14/10	5	2010-06-14T08:15:05.950	2010	6
false	5	5	5	50	5.5	50.5	5305	06/15/10	5	2010-06-15T08:25:06.400	2010	6
false	5	5	5	50	5.5	50.5	5315	06/16/10	5	2010-06-16T08:35:06.850	2010	6
false	5	5	5	50	5.5	50.5	5325	06/17/10	5	2010-06-17T08:45:07.300	2010	6
false	5	5	5	50	5.5	50.5	5335	06/18/10	5	2010-06-18T08:55:07.750	2010	6
false	5	5	5	50	5.5	50.5	5345	06/19/10	5	2010-06-19T09:05:08.200	2010	6
false	5	5	5	50	5.5	50.5	5355	06/20/10	5	2010-06-20T09:15:08.650	2010	6
false	5	5	5	50	5.5	50.5	5365	06/21/10	5	2010-06-21T09:25:09.100	2010	6
false	5	5	5	50	5.5	50.5	5375	06/22/10	5	2010-06-22T09:35:09.550	2010	6
false	5	5	5	50	5.5	50.5	5385	06/23/10	5	2010-06-23T09:45:10	2010	6
false	5	5	5	50	5.5	50.5	5395	06/24/10	5	2010-06-24T09:55:10.450	2010	6
false	5	5	5	50	5.5	50.5	5405	06/25/10	5	2010-06-25T10:05:10.900	2010	6
false	5	5	5	50	5.5	50.5	5415	06/26/10	5	2010-06-26T10:15:11.350	2010	6
false	5	5	5	50	5.5	50.5	5425	06/27/10	5	2010-06-27T10:25:11.800	2010	6
false	5	5	5	50	5.5	50.5	5435	06/28/10	5	2010-06-28T10:35:12.250	2010	6
false	5	5	5	50	5.5	50.5	5445	06/29/10	5	2010-06-29T10:45:12.700	2010	6
false	5	5	5	50	5.5	50.5	5455	06/30/10	5	2010-06-30T10:55:13.150	2010	6
false	5	5	5	50	5.5	50.5	5465	07/01/10	5	2010-07-01T06:05:00.100	2010	7
false	5	5	5	50	5.5	50.5	5475	07/02/10	5	2010-07-02T06:15:00.550	2010	7
false	5	5	5	50	5.5	50.5	5485	07/03/10	5	2010-07-03T06:25:01	2010	7
false	5	5	5	50	5.5	50.5	5495	07/04/10	5	2010-07-04T06:35:01.450	2010	7
false	5	5	5	50	5.5	50.5	5505	07/05/10	5	2010-07-05T06:45:01.900	2010	7
false	5	5	5	50	5.5	50.5	5515	07/06/10	5	2010-07-06T06:55:02.350	2010	7
false	5	5	5	50	5.5	50.5	5525	07/07/10	5	2010-07-07T07:05:02.800	2010	7
false	5	5	5	50	5.5	50.5	5535	07/08/10	5	2010-07-08T07:15:03.250	2010	7
false	5	5	5	50	5.5	50.5	5545	07/09/10	5	2010-07-09T07:25:03.700	2010	7
false	5	5	5	50	5.5	50.5	5555	07/10/10	5	2010-07-10T07:35:04.150	2010	7
false	5	5	5	50	5.5	50.5	5565	07/11/10	5	2010-07-11T07:45:04.600	2010	7
false	5	5	5	50	5.5	50.5	5575	07/12/10	5	2010-07-12T07:55:05.500	2010	7
false	5	5	5	50	5.5	50.5	5585	07/13/10	5	2010-07-13T08:05:05.500	2010	7
false	5	5	5	50	5.5	50.5	5595	07/14/10	5	2010-07-14T08:15:05.950	2010	7
false	5	5	5	50	5.5	50.5	5605	07/15/10	5	2010-07-15T08:25:06.400	2010	7
false	5	5	5	50	5.5	50.5	5615	07/16/10	5	2010-07-16T08:35:06.850	2010	7
false	5	5	5	50	5.5	50.5	5625	07/17/10	5	2010-07-17T08:45:07.300	2010	7
false	5	5	5	50	5.5	50.5	5635	07/18/10	5	2010-07-18T08:55:07.750	2010	7
false	5	5	5	50	5.5	50.5	5645	07/19/10	5	2010-07-19T09:05:08.200	2010	7
false	5	5	5	50	5.5	50.5	5655	07/20/10	5	2010-07-20T09:15:08.650	2010	7
false	5	5	5	50	5.5	50.5	5665	07/21/10	5	2010-07-21T09:25:09.100	2010	7
false	5	5	5	50	5.5	50.5	5675	07/22/10	5	2010-07-22T09:35:09.550	2010	7
false	5	5	5	50	5.5	50.5	5685	07/23/10	5	2010-07-23T09:45:10	2010	7
false	5	5	5	50	5.5	50.5	5695	07/24/10	5	2010-07-24T09:55:10.450	2010	7
false	5	5	5	50	5.5	50.5	5705	07/25/10	5	2010-07-25T10:05:10.900	2010	7
false	5	5	5	50	5.5	50.5	5715	07/26/10	5	2010-07-26T10:15:11.350	2010	7
false	5	5	5	50	5.5	50.5	5725	07/27/10	5	2010-07-27T10:25:11.800	2010	7
false	5	5	5	50	5.5	50.5	5735	07/28/10	5	2010-07-28T10:35:12.250	2010	7
false	5	5	5	50	5.5	50.5	5745	07/29/10	5	2010-07-29T10:45:12.700	2010	7
false	5	5	5	50	5.5	50.5	5755	07/30/10	5	2010-07-30T10:55:13.150	2010	7
false	5	5	5	50	5.5	50.5	5765	07/31/10	5	2010-07-31T11:05:13.600	2010	7
false	5	5	5	50	5.5	50.5	5775	08/01/10	5	2010-08-01T06:05:00.100	2010	8
false	5	5	5	50	5.5	50.5	5785	08/02/10	5	2010-08-02T06:15:00.550	2010	8
false	5	5	5	50	5.5	50.5	5795	08/03/10	5	2010-08-03T06:25:01	2010	8
false	5	5	5	50	5.5	50.5	5805	08/04/10	5	2010-08-04T06:35:01.450	2010	8
false	5	5	5	50	5.5	50.5	5815	08/05/10	5	2010-08-05T06:45:01.900	2010	8
false	5	5	5	50	5.5	50.5	5825	08/06/10	5	2010-08-06T06:55:02.350	2010	8
false	5	5	5	50	5.5	50.5	5835	08/07/10	5	2010-08-07T07:05:02.800	2010	8
false	5	5	5	50	5.5	50.5	5845	08/08/10	5	2010-08-08T07:15:03.250	2010	8
false	5	5	5	50	5.5	50.5	5855	08/09/10	5	2010-08-09T07:25:03.700	2010	8
false	5	5	5	50	5.5	50.5	5865	08/10/10	5	2010-08-10T07:35:04.150	2010	8
false	5	5	5	50	5.5	50.5	5875	08/11/10	5	2010-08-11T07:45:04.600	2010	8
false	5	5	5	50	5.5	50.5	5885	08/12/10	5	2010-08-12T07:55:05.500	2010	8
false	5	5	5	50	5.5	50.5	5895	08/13/10	5	2010-08-13T08:05:05.500	2010	8
false	5	5	5	50	5.5	50.5	5905	08/14/10	5	2010-08-14T08:15:05.950	2010	8
false	5	5	5	50	5.5	50.5	5915	08/15/10	5	2010-08-15T08:25:06.400	2010	8
false	5	5	5	50	5.5	50.5	5925	08/16/10	5	2010-08-16T08:35:06.850	2010	8
false	5	5	5	50	5.5	50.5	5935	08/17/10	5	2010-08-17T08:45:07.300	2010	8
false	5	5	5	50	5.5	50.5	5945	08/18/10	5	2010-08-18T08:55:07.750	2010	8
false	5	5	5	50	5.5	50.5	5955	08/19/10	5	2010-08-19T09:05:08.200	2010	8
false	5	5	5	50	5.5	50.5	5965	08/20/10	5	2010-08-20T09:15:08.650	2010	8
false	5	5	5	50	5.5	50.5	5975	08/21/10	5	2010-08-21T09:25:09.100	2010	8
false	5	5	5	50	5.5	50.5	5985	08/22/10	5	2010-08-22T09:35:09.550	2010	8
false	5	5	5	50	5.5	50.5	5995	08/23/10	5	2010-08-23T09:45:10	2010	8
false	5	5	5	50	5.5	50.5	6005	08/24/10	5	2010-08-24T09:55:10.450	2010	8
